[32m[I 2022-07-06 16:58:25,584][0m Trial 616 finished with value: 0.3737781279432973 and parameters: {'sigma': 0.33768139252169926, 'a': 10.653308983652883, 'strategy': 'median', 'add_indicator': True, 'max_depth': 82, 'n_estimators': 1494, 'boosting_type': 'gbdt', 'num_leaves': 524, 'learning_rate': 0.004045777016518642, 'min_split_gain': 0.38146605852115867, 'min_child_samples': 598, 'subsample': 0.8716131128750583, 'subsample_freq': 881, 'colsample_bytree': 0.5695661654661331, 'reg_alpha': 90.97597741269522, 'reg_lambda': 10.406071294053376}. Best is trial 290 with value: 0.39243341529400166.[0m
[32m[I 2022-07-06 16:59:38,386][0m Trial 617 finished with value: 0.3733576912211089 and parameters: {'sigma': 0.7151579472834597, 'a': 11.52981115987518, 'strategy': 'median', 'add_indicator': True, 'max_depth': 84, 'n_estimators': 1494, 'boosting_type': 'gbdt', 'num_leaves': 440, 'learning_rate': 0.005315139222193607, 'min_split_gain': 0.9272620836508155, 'min_child_samples': 518, 'subsample': 0.7691896462394098, 'subsample_freq': 1213, 'colsample_bytree': 0.37701254802459094, 'reg_alpha': 57.361179066183446, 'reg_lambda': 16.389942856195542}. Best is trial 290 with value: 0.39243341529400166.[0m
[32m[I 2022-07-06 17:00:16,839][0m Trial 618 finished with value: 0.377462607861466 and parameters: {'sigma': 0.32952589857126924, 'a': 10.661767722939896, 'strategy': 'median', 'add_indicator': True, 'max_depth': 88, 'n_estimators': 800, 'boosting_type': 'gbdt', 'num_leaves': 153, 'learning_rate': 0.00838021205692136, 'min_split_gain': 0.7344776231638357, 'min_child_samples': 640, 'subsample': 0.8433139403352463, 'subsample_freq': 761, 'colsample_bytree': 0.42571429279305806, 'reg_alpha': 54.53973562880782, 'reg_lambda': 19.329357364219756}. Best is trial 290 with value: 0.39243341529400166.[0m
[32m[I 2022-07-06 17:00:52,055][0m Trial 619 finished with value: 0.3682743766763437 and parameters: {'sigma': 0.0034872034441841074, 'a': 10.22456094534636, 'strategy': 'median', 'add_indicator': True, 'max_depth': 86, 'n_estimators': 334, 'boosting_type': 'gbdt', 'num_leaves': 291, 'learning_rate': 0.004736767264242551, 'min_split_gain': 1.161753910986059, 'min_child_samples': 785, 'subsample': 0.7948312682320771, 'subsample_freq': 180, 'colsample_bytree': 0.38840872961315326, 'reg_alpha': 48.65780400715699, 'reg_lambda': 12.712908900032062}. Best is trial 290 with value: 0.39243341529400166.[0m
[32m[I 2022-07-06 17:01:44,700][0m Trial 620 finished with value: 0.37353462385494796 and parameters: {'sigma': 0.00035459780532766383, 'a': 11.042087374105884, 'strategy': 'median', 'add_indicator': True, 'max_depth': 91, 'n_estimators': 899, 'boosting_type': 'gbdt', 'num_leaves': 213, 'learning_rate': 0.0035037377465586533, 'min_split_gain': 1.3567150653925835, 'min_child_samples': 569, 'subsample': 0.7262042338358826, 'subsample_freq': 760, 'colsample_bytree': 0.3612066479547618, 'reg_alpha': 52.01109582250041, 'reg_lambda': 15.874960578263652}. Best is trial 290 with value: 0.39243341529400166.[0m
[32m[I 2022-07-06 17:02:40,071][0m Trial 621 finished with value: 0.3695701614658204 and parameters: {'sigma': 1.4789290889675752, 'a': 11.761385446801336, 'strategy': 'median', 'add_indicator': True, 'max_depth': 80, 'n_estimators': 1358, 'boosting_type': 'gbdt', 'num_leaves': 366, 'learning_rate': 0.006392716127824634, 'min_split_gain': 0.49318505830827564, 'min_child_samples': 9687, 'subsample': 0.8161374640428105, 'subsample_freq': 1053, 'colsample_bytree': 0.44626819297439235, 'reg_alpha': 43.32201793470779, 'reg_lambda': 9.64066377595242}. Best is trial 290 with value: 0.39243341529400166.[0m
[32m[I 2022-07-06 17:03:03,412][0m Trial 622 finished with value: 0.35993617150470375 and parameters: {'sigma': 0.004160587202683738, 'a': 11.400265950789295, 'strategy': 'median', 'add_indicator': True, 'max_depth': 84, 'n_estimators': 125, 'boosting_type': 'gbdt', 'num_leaves': 264, 'learning_rate': 0.0026418886447140363, 'min_split_gain': 0.8332791905841546, 'min_child_samples': 382, 'subsample': 0.6975539587787638, 'subsample_freq': 106, 'colsample_bytree': 0.4258773628421428, 'reg_alpha': 46.70596879592005, 'reg_lambda': 14.406625537466248}. Best is trial 290 with value: 0.39243341529400166.[0m
[32m[I 2022-07-06 17:03:52,706][0m Trial 623 finished with value: 0.36711995950252546 and parameters: {'sigma': 0.7053788158346512, 'a': 10.572642336863497, 'strategy': 'median', 'add_indicator': True, 'max_depth': 76, 'n_estimators': 595, 'boosting_type': 'gbdt', 'num_leaves': 325, 'learning_rate': 0.005925304535289803, 'min_split_gain': 1.090131539782275, 'min_child_samples': 960, 'subsample': 0.8550961354490876, 'subsample_freq': 72, 'colsample_bytree': 0.4052253036039098, 'reg_alpha': 50.42930057815936, 'reg_lambda': 17.73903073153612}. Best is trial 290 with value: 0.39243341529400166.[0m
[32m[I 2022-07-06 17:05:01,565][0m Trial 624 finished with value: 0.3729830775871166 and parameters: {'sigma': 0.9843400042929457, 'a': 12.054441482875099, 'strategy': 'median', 'add_indicator': True, 'max_depth': 82, 'n_estimators': 1488, 'boosting_type': 'gbdt', 'num_leaves': 466, 'learning_rate': 0.0042397975499780475, 'min_split_gain': 0.731722926459482, 'min_child_samples': 464, 'subsample': 0.751897456332455, 'subsample_freq': 305, 'colsample_bytree': 0.3871483820748088, 'reg_alpha': 45.17878032387382, 'reg_lambda': 11.90961251800267}. Best is trial 290 with value: 0.39243341529400166.[0m
[32m[I 2022-07-06 17:05:29,551][0m Trial 625 finished with value: 0.3657781541822455 and parameters: {'sigma': 0.41318635178707575, 'a': 9.837755486347945, 'strategy': 'median', 'add_indicator': True, 'max_depth': 86, 'n_estimators': 420, 'boosting_type': 'gbdt', 'num_leaves': 176, 'learning_rate': 0.008185410990287892, 'min_split_gain': 0.9414230562998047, 'min_child_samples': 706, 'subsample': 0.7933273373002423, 'subsample_freq': 165, 'colsample_bytree': 0.41465304428356287, 'reg_alpha': 53.29191790874273, 'reg_lambda': 13.610675544505256}. Best is trial 290 with value: 0.39243341529400166.[0m
[32m[I 2022-07-06 17:05:53,215][0m Trial 626 finished with value: 0.35499065222964593 and parameters: {'sigma': 0.6256495183817663, 'a': 10.973222495511884, 'strategy': 'median', 'add_indicator': True, 'max_depth': 89, 'n_estimators': 250, 'boosting_type': 'gbdt', 'num_leaves': 262, 'learning_rate': 0.005144711536613845, 'min_split_gain': 8.7075985460256, 'min_child_samples': 638, 'subsample': 0.828271210379065, 'subsample_freq': 249, 'colsample_bytree': 0.34413688576656826, 'reg_alpha': 48.02902922083494, 'reg_lambda': 22.634399356794667}. Best is trial 290 with value: 0.39243341529400166.[0m
[32m[I 2022-07-06 17:07:25,007][0m Trial 627 finished with value: 0.3696565319152412 and parameters: {'sigma': 2.3949037169900222, 'a': 11.403939772416658, 'strategy': 'median', 'add_indicator': True, 'max_depth': 84, 'n_estimators': 1397, 'boosting_type': 'gbdt', 'num_leaves': 864, 'learning_rate': 0.0036503521187442175, 'min_split_gain': 0.5502007303069594, 'min_child_samples': 539, 'subsample': 0.7708608956335268, 'subsample_freq': 1147, 'colsample_bytree': 0.4673894525025909, 'reg_alpha': 50.555552464600886, 'reg_lambda': 10.681595899488913}. Best is trial 290 with value: 0.39243341529400166.[0m
[32m[I 2022-07-06 17:08:03,493][0m Trial 628 finished with value: 0.3736611674438867 and parameters: {'sigma': 0.3874519471061276, 'a': 10.179392780168717, 'strategy': 'median', 'add_indicator': True, 'max_depth': 87, 'n_estimators': 818, 'boosting_type': 'gbdt', 'num_leaves': 403, 'learning_rate': 0.00693721692691136, 'min_split_gain': 1.3853529305372265, 'min_child_samples': 704, 'subsample': 0.8087820857761395, 'subsample_freq': 523, 'colsample_bytree': 0.43862736734343727, 'reg_alpha': 55.57572520465797, 'reg_lambda': 15.537057405297539}. Best is trial 290 with value: 0.39243341529400166.[0m
[32m[I 2022-07-06 17:08:59,932][0m Trial 629 finished with value: 0.3738579434785354 and parameters: {'sigma': 1.0768411104853668, 'a': 10.71657977780616, 'strategy': 'constant', 'add_indicator': True, 'max_depth': 81, 'n_estimators': 1493, 'boosting_type': 'gbdt', 'num_leaves': 323, 'learning_rate': 0.004800998945837134, 'min_split_gain': 0.1378564308390371, 'min_child_samples': 596, 'subsample': 0.8350928394140553, 'subsample_freq': 843, 'colsample_bytree': 0.364495451401277, 'reg_alpha': 41.68433034310322, 'reg_lambda': 20.717908489776356}. Best is trial 290 with value: 0.39243341529400166.[0m
[32m[I 2022-07-06 17:09:53,563][0m Trial 630 finished with value: 0.3604613850363414 and parameters: {'sigma': 0.33376292041825856, 'a': 11.752401356287773, 'strategy': 'most_frequent', 'add_indicator': True, 'max_depth': 85, 'n_estimators': 854, 'boosting_type': 'gbdt', 'num_leaves': 205, 'learning_rate': 0.0017850422140037031, 'min_split_gain': 1.099766898688835, 'min_child_samples': 802, 'subsample': 0.7850904042424268, 'subsample_freq': 787, 'colsample_bytree': 0.3921659724208743, 'reg_alpha': 47.71138610255005, 'reg_lambda': 8.541607482689464}. Best is trial 290 with value: 0.39243341529400166.[0m
