[32m[I 2022-07-06 03:24:52,039][0m Trial 73 finished with value: 0.34635099810499803 and parameters: {'sigma': 2.737721232519845, 'a': 18.01037097277729, 'strategy': 'mean', 'add_indicator': False, 'max_depth': 43, 'n_estimators': 1152, 'boosting_type': 'rf', 'num_leaves': 1434, 'learning_rate': 2.594139577884934e-07, 'min_split_gain': 6.031521094663882, 'min_child_samples': 341, 'subsample': 0.38929561404197655, 'subsample_freq': 333, 'colsample_bytree': 0.36211598930029965, 'reg_alpha': 71.90459051842456, 'reg_lambda': 29.7121715623175}. Best is trial 27 with value: 0.3520222444267047.[0m
[32m[I 2022-07-06 03:25:22,358][0m Trial 74 finished with value: 0.34269952503071593 and parameters: {'sigma': 11.32809714189154, 'a': 9.573403003762083, 'strategy': 'median', 'add_indicator': False, 'max_depth': 60, 'n_estimators': 159, 'boosting_type': 'gbdt', 'num_leaves': 1947, 'learning_rate': 3.411860497758069e-07, 'min_split_gain': 0.7513778173580876, 'min_child_samples': 3837, 'subsample': 0.49549131620619846, 'subsample_freq': 110, 'colsample_bytree': 0.44047906521770874, 'reg_alpha': 24.640203323910683, 'reg_lambda': 81.91023176741997}. Best is trial 27 with value: 0.3520222444267047.[0m
[32m[I 2022-07-06 03:28:48,586][0m Trial 75 finished with value: 0.3457491785513522 and parameters: {'sigma': 15.988319585220795, 'a': 13.924459770003091, 'strategy': 'median', 'add_indicator': True, 'max_depth': 96, 'n_estimators': 1341, 'boosting_type': 'dart', 'num_leaves': 1358, 'learning_rate': 0.0010784642153666727, 'min_split_gain': 6.587833667107174, 'min_child_samples': 3205, 'subsample': 0.8491956515653193, 'subsample_freq': 335, 'colsample_bytree': 0.49453071400670906, 'reg_alpha': 22.120944181960223, 'reg_lambda': 98.7668007996647}. Best is trial 27 with value: 0.3520222444267047.[0m
[32m[I 2022-07-06 03:30:16,951][0m Trial 76 finished with value: 0.3595680165359874 and parameters: {'sigma': 18.88118735313887, 'a': 0.8845935462332672, 'strategy': 'median', 'add_indicator': True, 'max_depth': 71, 'n_estimators': 895, 'boosting_type': 'gbdt', 'num_leaves': 123, 'learning_rate': 0.0020427407610843656, 'min_split_gain': 8.445493985350703, 'min_child_samples': 493, 'subsample': 0.8289154741506773, 'subsample_freq': 34, 'colsample_bytree': 0.6003071796972325, 'reg_alpha': 23.000883728770305, 'reg_lambda': 12.056688577727881}. Best is trial 76 with value: 0.3595680165359874.[0m
[32m[I 2022-07-06 03:31:03,573][0m Trial 77 finished with value: 0.2867192499550938 and parameters: {'sigma': 1.5390732630521669, 'a': 13.95614663997498, 'strategy': 'median', 'add_indicator': False, 'max_depth': 33, 'n_estimators': 1880, 'boosting_type': 'rf', 'num_leaves': 2, 'learning_rate': 0.0022412709881999577, 'min_split_gain': 0.21269410850387138, 'min_child_samples': 8001, 'subsample': 0.528937134027212, 'subsample_freq': 1766, 'colsample_bytree': 0.8007954034159287, 'reg_alpha': 99.79341105333374, 'reg_lambda': 35.071181545171015}. Best is trial 76 with value: 0.3595680165359874.[0m
[32m[I 2022-07-06 03:32:42,882][0m Trial 78 finished with value: 0.2656538755419864 and parameters: {'sigma': 15.343768106739649, 'a': 8.098425180823918, 'strategy': 'constant', 'add_indicator': True, 'max_depth': 43, 'n_estimators': 2214, 'boosting_type': 'dart', 'num_leaves': 22, 'learning_rate': 3.0306836237759826e-06, 'min_split_gain': 2.3360775104990994, 'min_child_samples': 123, 'subsample': 0.01787393473341381, 'subsample_freq': 2187, 'colsample_bytree': 0.4334954023985037, 'reg_alpha': 38.432664715968166, 'reg_lambda': 67.96472826930699}. Best is trial 76 with value: 0.3595680165359874.[0m
[32m[I 2022-07-06 03:33:20,182][0m Trial 79 finished with value: 0.32797595550159836 and parameters: {'sigma': 4.365085574762404, 'a': 19.004227560609483, 'strategy': 'constant', 'add_indicator': True, 'max_depth': 62, 'n_estimators': 505, 'boosting_type': 'rf', 'num_leaves': 630, 'learning_rate': 0.00010931606102061756, 'min_split_gain': 5.126885110165086, 'min_child_samples': 316, 'subsample': 0.17652803200550826, 'subsample_freq': 112, 'colsample_bytree': 0.194573879522812, 'reg_alpha': 77.95844735667534, 'reg_lambda': 35.01252591667301}. Best is trial 76 with value: 0.3595680165359874.[0m
[32m[I 2022-07-06 03:33:55,015][0m Trial 80 finished with value: 0.3150567408998935 and parameters: {'sigma': 1.1568629528411618, 'a': 19.385142339802144, 'strategy': 'most_frequent', 'add_indicator': False, 'max_depth': 70, 'n_estimators': 466, 'boosting_type': 'rf', 'num_leaves': 221, 'learning_rate': 9.219336658511299e-05, 'min_split_gain': 5.8008620783781115, 'min_child_samples': 157, 'subsample': 0.8774608626303804, 'subsample_freq': 124, 'colsample_bytree': 0.13821977206997613, 'reg_alpha': 88.87480798689772, 'reg_lambda': 95.56514982297534}. Best is trial 76 with value: 0.3595680165359874.[0m
[32m[I 2022-07-06 03:35:11,903][0m Trial 81 finished with value: 0.30573806762372924 and parameters: {'sigma': 17.242553724032838, 'a': 16.209369887025073, 'strategy': 'mean', 'add_indicator': True, 'max_depth': 73, 'n_estimators': 1490, 'boosting_type': 'dart', 'num_leaves': 3, 'learning_rate': 0.0018031612684575754, 'min_split_gain': 4.951465270139743, 'min_child_samples': 1108, 'subsample': 0.5924077846595176, 'subsample_freq': 1229, 'colsample_bytree': 0.3543311158231711, 'reg_alpha': 67.80161525590636, 'reg_lambda': 56.5731963995791}. Best is trial 76 with value: 0.3595680165359874.[0m
[32m[I 2022-07-06 03:35:49,502][0m Trial 82 finished with value: 0.32085737216123933 and parameters: {'sigma': 5.3405727331057244, 'a': 17.584736728467643, 'strategy': 'constant', 'add_indicator': False, 'max_depth': 71, 'n_estimators': 2042, 'boosting_type': 'gbdt', 'num_leaves': 5412, 'learning_rate': 0.002286744476401015, 'min_split_gain': 0.29247283034559146, 'min_child_samples': 6262, 'subsample': 0.1288698674734452, 'subsample_freq': 685, 'colsample_bytree': 0.7460731737286918, 'reg_alpha': 16.07598960483082, 'reg_lambda': 81.79670241190622}. Best is trial 76 with value: 0.3595680165359874.[0m
[32m[I 2022-07-06 03:38:20,934][0m Trial 83 finished with value: 0.32834869571678926 and parameters: {'sigma': 16.64268523781306, 'a': 10.198607901840639, 'strategy': 'constant', 'add_indicator': True, 'max_depth': 64, 'n_estimators': 1622, 'boosting_type': 'rf', 'num_leaves': 230, 'learning_rate': 0.006530704288855007, 'min_split_gain': 3.418721660386861, 'min_child_samples': 2376, 'subsample': 0.9320281055100175, 'subsample_freq': 167, 'colsample_bytree': 0.9378562023640866, 'reg_alpha': 68.78857223008133, 'reg_lambda': 6.78370591051719}. Best is trial 76 with value: 0.3595680165359874.[0m
[32m[I 2022-07-06 03:40:13,878][0m Trial 84 finished with value: 0.28669798159330717 and parameters: {'sigma': 6.019278329300655, 'a': 14.192624564041102, 'strategy': 'constant', 'add_indicator': False, 'max_depth': 98, 'n_estimators': 2907, 'boosting_type': 'dart', 'num_leaves': 2, 'learning_rate': 1.2900833126964436e-07, 'min_split_gain': 3.2361021914954122, 'min_child_samples': 1154, 'subsample': 0.7704074178077932, 'subsample_freq': 1987, 'colsample_bytree': 0.45144367931298085, 'reg_alpha': 27.362666628166586, 'reg_lambda': 99.71245001577111}. Best is trial 76 with value: 0.3595680165359874.[0m
[32m[I 2022-07-06 03:40:59,267][0m Trial 85 finished with value: 0.3304563092871837 and parameters: {'sigma': 8.523631782906437, 'a': 9.082601784160541, 'strategy': 'median', 'add_indicator': False, 'max_depth': 66, 'n_estimators': 823, 'boosting_type': 'rf', 'num_leaves': 9699, 'learning_rate': 1.2549793639668937e-05, 'min_split_gain': 6.385259476640855, 'min_child_samples': 731, 'subsample': 0.27421520234867003, 'subsample_freq': 810, 'colsample_bytree': 0.4152406662518926, 'reg_alpha': 89.40992036791344, 'reg_lambda': 22.995460589108617}. Best is trial 76 with value: 0.3595680165359874.[0m
[32m[I 2022-07-06 03:42:40,377][0m Trial 86 finished with value: 0.32382197501677207 and parameters: {'sigma': 4.2621019494546255, 'a': 0.719568249401776, 'strategy': 'most_frequent', 'add_indicator': True, 'max_depth': 87, 'n_estimators': 2331, 'boosting_type': 'gbdt', 'num_leaves': 507, 'learning_rate': 4.5313164050292004e-07, 'min_split_gain': 0.32526179491251916, 'min_child_samples': 10085, 'subsample': 0.616650314520738, 'subsample_freq': 1857, 'colsample_bytree': 0.4867071279974246, 'reg_alpha': 11.730818896239448, 'reg_lambda': 12.518579220255043}. Best is trial 76 with value: 0.3595680165359874.[0m
[32m[I 2022-07-06 03:44:26,777][0m Trial 87 finished with value: 0.2525229033371375 and parameters: {'sigma': 13.711308888926554, 'a': 8.663087308499307, 'strategy': 'constant', 'add_indicator': False, 'max_depth': 32, 'n_estimators': 1368, 'boosting_type': 'dart', 'num_leaves': 130, 'learning_rate': 0.00010002365969506355, 'min_split_gain': 2.9166257870930323, 'min_child_samples': 3249, 'subsample': 0.8601223971892046, 'subsample_freq': 1067, 'colsample_bytree': 0.049222637094873574, 'reg_alpha': 48.0506947257829, 'reg_lambda': 10.493017841817487}. Best is trial 76 with value: 0.3595680165359874.[0m
[32m[I 2022-07-06 03:45:33,042][0m Trial 88 finished with value: 0.3212051465110909 and parameters: {'sigma': 4.84090789680039, 'a': 19.734585606016214, 'strategy': 'constant', 'add_indicator': True, 'max_depth': 34, 'n_estimators': 1556, 'boosting_type': 'gbdt', 'num_leaves': 3, 'learning_rate': 9.65197928165614e-06, 'min_split_gain': 1.3271575404306035, 'min_child_samples': 1714, 'subsample': 0.6894649691372657, 'subsample_freq': 1246, 'colsample_bytree': 0.208148741802362, 'reg_alpha': 16.748258225906977, 'reg_lambda': 10.456784033440025}. Best is trial 76 with value: 0.3595680165359874.[0m
[32m[I 2022-07-06 03:48:56,252][0m Trial 89 finished with value: 0.3449848575663074 and parameters: {'sigma': 12.728608626570239, 'a': 14.158866957089332, 'strategy': 'median', 'add_indicator': False, 'max_depth': 72, 'n_estimators': 2406, 'boosting_type': 'gbdt', 'num_leaves': 6161, 'learning_rate': 5.4696795189266104e-05, 'min_split_gain': 8.172977699624937, 'min_child_samples': 962, 'subsample': 0.643577695196525, 'subsample_freq': 1267, 'colsample_bytree': 0.7342736265377786, 'reg_alpha': 8.162998203058958, 'reg_lambda': 6.03520839905638}. Best is trial 76 with value: 0.3595680165359874.[0m
[32m[I 2022-07-06 03:49:39,697][0m Trial 90 finished with value: 0.34061033059197604 and parameters: {'sigma': 4.942072209170589, 'a': 3.2749391342524476, 'strategy': 'most_frequent', 'add_indicator': False, 'max_depth': 67, 'n_estimators': 1497, 'boosting_type': 'gbdt', 'num_leaves': 15834, 'learning_rate': 0.0074811060416231714, 'min_split_gain': 6.503256863469369, 'min_child_samples': 271, 'subsample': 0.6802282424312913, 'subsample_freq': 109, 'colsample_bytree': 0.040345977183748, 'reg_alpha': 25.76828885112137, 'reg_lambda': 46.26229567393163}. Best is trial 76 with value: 0.3595680165359874.[0m
[32m[I 2022-07-06 03:51:21,518][0m Trial 91 finished with value: 0.36539255269296184 and parameters: {'sigma': 17.365451425442558, 'a': 14.570664488349529, 'strategy': 'mean', 'add_indicator': True, 'max_depth': 87, 'n_estimators': 1738, 'boosting_type': 'gbdt', 'num_leaves': 5050, 'learning_rate': 0.0031879339887351268, 'min_split_gain': 4.217209268734554, 'min_child_samples': 399, 'subsample': 0.5923503285933622, 'subsample_freq': 1586, 'colsample_bytree': 0.21855556711560992, 'reg_alpha': 62.296658356348274, 'reg_lambda': 63.156022009252055}. Best is trial 91 with value: 0.36539255269296184.[0m
[32m[I 2022-07-06 03:53:03,885][0m Trial 92 finished with value: 0.3421064243825694 and parameters: {'sigma': 14.662263117175396, 'a': 2.71819693403247, 'strategy': 'median', 'add_indicator': True, 'max_depth': 86, 'n_estimators': 1479, 'boosting_type': 'gbdt', 'num_leaves': 180, 'learning_rate': 6.254129173951128e-06, 'min_split_gain': 5.9295085143492745, 'min_child_samples': 226, 'subsample': 0.3910815366517607, 'subsample_freq': 1434, 'colsample_bytree': 0.26555209837411625, 'reg_alpha': 65.67366645412922, 'reg_lambda': 32.51900642246949}. Best is trial 91 with value: 0.36539255269296184.[0m
[32m[I 2022-07-06 03:59:18,996][0m Trial 93 finished with value: 0.342312672094061 and parameters: {'sigma': 15.469464779000756, 'a': 2.7043858482951615, 'strategy': 'mean', 'add_indicator': False, 'max_depth': 35, 'n_estimators': 2488, 'boosting_type': 'dart', 'num_leaves': 1072, 'learning_rate': 6.842417023266609e-07, 'min_split_gain': 1.6761921628831766, 'min_child_samples': 120, 'subsample': 0.7364020150656405, 'subsample_freq': 1652, 'colsample_bytree': 0.47988456699231574, 'reg_alpha': 84.41704489691972, 'reg_lambda': 80.56701529500532}. Best is trial 91 with value: 0.36539255269296184.[0m
[32m[I 2022-07-06 03:59:51,920][0m Trial 94 finished with value: 0.2920286089917449 and parameters: {'sigma': 11.7070914343914, 'a': 17.378598482213846, 'strategy': 'most_frequent', 'add_indicator': False, 'max_depth': 5, 'n_estimators': 370, 'boosting_type': 'gbdt', 'num_leaves': 7, 'learning_rate': 1.613854194219212e-07, 'min_split_gain': 1.4834320096208886, 'min_child_samples': 14028, 'subsample': 0.9651186964360455, 'subsample_freq': 2, 'colsample_bytree': 0.9522936675690066, 'reg_alpha': 63.91199378155004, 'reg_lambda': 86.79182945200222}. Best is trial 91 with value: 0.36539255269296184.[0m
[32m[I 2022-07-06 04:01:48,245][0m Trial 95 finished with value: 0.3359067057875338 and parameters: {'sigma': 9.094802565278625, 'a': 10.360360968727079, 'strategy': 'median', 'add_indicator': False, 'max_depth': 21, 'n_estimators': 2022, 'boosting_type': 'rf', 'num_leaves': 93, 'learning_rate': 0.002191347596964205, 'min_split_gain': 1.771497894473859, 'min_child_samples': 3210, 'subsample': 0.8381152896481102, 'subsample_freq': 1911, 'colsample_bytree': 0.6864155480067493, 'reg_alpha': 49.71747640084273, 'reg_lambda': 61.78472402012139}. Best is trial 91 with value: 0.36539255269296184.[0m
[32m[I 2022-07-06 04:03:05,325][0m Trial 96 finished with value: 0.3154839539393686 and parameters: {'sigma': 17.37810100052452, 'a': 11.45513395811271, 'strategy': 'median', 'add_indicator': False, 'max_depth': 40, 'n_estimators': 1956, 'boosting_type': 'dart', 'num_leaves': 2, 'learning_rate': 0.007689018770462679, 'min_split_gain': 4.069079607228706, 'min_child_samples': 7845, 'subsample': 0.7823854840582735, 'subsample_freq': 1110, 'colsample_bytree': 0.7410647171588133, 'reg_alpha': 87.8515561301348, 'reg_lambda': 40.4140321651033}. Best is trial 91 with value: 0.36539255269296184.[0m
[32m[I 2022-07-06 04:03:26,614][0m Trial 97 finished with value: 0.23964364817709635 and parameters: {'sigma': 6.540669960933158, 'a': 13.385108372715335, 'strategy': 'mean', 'add_indicator': True, 'max_depth': 55, 'n_estimators': 22, 'boosting_type': 'dart', 'num_leaves': 965, 'learning_rate': 8.765778781781622e-06, 'min_split_gain': 4.486936226225307, 'min_child_samples': 328, 'subsample': 0.3732517916293401, 'subsample_freq': 5, 'colsample_bytree': 0.0824639645307592, 'reg_alpha': 60.34485933813779, 'reg_lambda': 66.82127985550163}. Best is trial 91 with value: 0.36539255269296184.[0m
[32m[I 2022-07-06 04:03:57,848][0m Trial 98 finished with value: 0.0 and parameters: {'sigma': 12.38981072528883, 'a': 9.323531471631389, 'strategy': 'median', 'add_indicator': False, 'max_depth': 39, 'n_estimators': 1199, 'boosting_type': 'dart', 'num_leaves': 1840, 'learning_rate': 0.0011612579322936522, 'min_split_gain': 7.181230762264944, 'min_child_samples': 12001, 'subsample': 0.01823258267636163, 'subsample_freq': 235, 'colsample_bytree': 0.0174872462283607, 'reg_alpha': 64.7474714154603, 'reg_lambda': 89.8030548949987}. Best is trial 91 with value: 0.36539255269296184.[0m
[32m[I 2022-07-06 04:04:45,994][0m Trial 99 finished with value: 0.3250879846468673 and parameters: {'sigma': 4.86965349670302, 'a': 18.5479874414465, 'strategy': 'median', 'add_indicator': True, 'max_depth': 30, 'n_estimators': 925, 'boosting_type': 'rf', 'num_leaves': 437, 'learning_rate': 0.00038084948364657103, 'min_split_gain': 2.7262400073353374, 'min_child_samples': 792, 'subsample': 0.12188609333694755, 'subsample_freq': 168, 'colsample_bytree': 0.684306675425333, 'reg_alpha': 18.143834769562694, 'reg_lambda': 52.516338366706016}. Best is trial 91 with value: 0.36539255269296184.[0m
[32m[I 2022-07-06 04:06:11,074][0m Trial 100 finished with value: 0.3212593812197767 and parameters: {'sigma': 14.180928143986037, 'a': 2.2268507695854023, 'strategy': 'most_frequent', 'add_indicator': True, 'max_depth': 6, 'n_estimators': 1901, 'boosting_type': 'rf', 'num_leaves': 41, 'learning_rate': 1.3816526035853751e-06, 'min_split_gain': 2.1204483990822665, 'min_child_samples': 2132, 'subsample': 0.4110284698067047, 'subsample_freq': 1597, 'colsample_bytree': 0.9010228921640311, 'reg_alpha': 35.34213793027181, 'reg_lambda': 23.687055897448207}. Best is trial 91 with value: 0.36539255269296184.[0m
[32m[I 2022-07-06 04:06:55,374][0m Trial 101 finished with value: 0.3225652562642219 and parameters: {'sigma': 15.610512499622084, 'a': 5.568640107407908, 'strategy': 'mean', 'add_indicator': True, 'max_depth': 60, 'n_estimators': 508, 'boosting_type': 'gbdt', 'num_leaves': 4, 'learning_rate': 1.3127829579383555e-07, 'min_split_gain': 6.4197150044326605, 'min_child_samples': 2090, 'subsample': 0.54669741271407, 'subsample_freq': 118, 'colsample_bytree': 0.3969969359464595, 'reg_alpha': 59.4476335186173, 'reg_lambda': 49.67668588591694}. Best is trial 91 with value: 0.36539255269296184.[0m
[32m[I 2022-07-06 04:07:17,352][0m Trial 102 finished with value: 0.3210349777840594 and parameters: {'sigma': 19.755710526442545, 'a': 2.815151075878989, 'strategy': 'constant', 'add_indicator': False, 'max_depth': 14, 'n_estimators': 316, 'boosting_type': 'rf', 'num_leaves': 3, 'learning_rate': 2.6809656400139814e-07, 'min_split_gain': 8.941908746641182, 'min_child_samples': 260, 'subsample': 0.32337156211552076, 'subsample_freq': 72, 'colsample_bytree': 0.3614463427736179, 'reg_alpha': 6.942384274609337, 'reg_lambda': 51.90597909082704}. Best is trial 91 with value: 0.36539255269296184.[0m
[32m[I 2022-07-06 04:11:03,478][0m Trial 103 finished with value: 0.34097353559350385 and parameters: {'sigma': 1.3522605957186622, 'a': 16.027094505664994, 'strategy': 'most_frequent', 'add_indicator': True, 'max_depth': 34, 'n_estimators': 2010, 'boosting_type': 'rf', 'num_leaves': 1339, 'learning_rate': 2.118498015042098e-05, 'min_split_gain': 0.6014234260078521, 'min_child_samples': 1670, 'subsample': 0.9576252845053802, 'subsample_freq': 353, 'colsample_bytree': 0.6931048419124591, 'reg_alpha': 20.093368865905646, 'reg_lambda': 53.582768447308126}. Best is trial 91 with value: 0.36539255269296184.[0m
[32m[I 2022-07-06 04:11:55,745][0m Trial 104 finished with value: 0.330360421173766 and parameters: {'sigma': 1.933538026169896, 'a': 9.062381631537884, 'strategy': 'constant', 'add_indicator': True, 'max_depth': 41, 'n_estimators': 461, 'boosting_type': 'rf', 'num_leaves': 3771, 'learning_rate': 4.025222451217553e-05, 'min_split_gain': 6.2358568800275975, 'min_child_samples': 156, 'subsample': 0.7552704204968079, 'subsample_freq': 59, 'colsample_bytree': 0.8278069539500031, 'reg_alpha': 78.20280876703859, 'reg_lambda': 70.87446977429764}. Best is trial 91 with value: 0.36539255269296184.[0m
[32m[I 2022-07-06 04:14:00,746][0m Trial 105 finished with value: 0.3392852747084392 and parameters: {'sigma': 0.723217248891437, 'a': 6.132254283312038, 'strategy': 'constant', 'add_indicator': True, 'max_depth': 41, 'n_estimators': 1344, 'boosting_type': 'dart', 'num_leaves': 152, 'learning_rate': 0.009136714913061608, 'min_split_gain': 8.514249577450958, 'min_child_samples': 283, 'subsample': 0.9305952146439163, 'subsample_freq': 157, 'colsample_bytree': 0.8192752114062797, 'reg_alpha': 38.06232934765801, 'reg_lambda': 87.79743204450695}. Best is trial 91 with value: 0.36539255269296184.[0m
[32m[I 2022-07-06 04:15:42,981][0m Trial 106 finished with value: 0.37587706549111516 and parameters: {'sigma': 17.361135121582105, 'a': 16.13791546234066, 'strategy': 'mean', 'add_indicator': False, 'max_depth': 36, 'n_estimators': 2927, 'boosting_type': 'gbdt', 'num_leaves': 4541, 'learning_rate': 0.004109471307831885, 'min_split_gain': 4.870619188189359, 'min_child_samples': 2082, 'subsample': 0.7648098009029954, 'subsample_freq': 512, 'colsample_bytree': 0.5075404156988079, 'reg_alpha': 39.86630277723131, 'reg_lambda': 14.63739921622491}. Best is trial 106 with value: 0.37587706549111516.[0m
[32m[I 2022-07-06 04:17:19,415][0m Trial 107 finished with value: 0.3036413389404458 and parameters: {'sigma': 7.350694770486405, 'a': 1.456628956771322, 'strategy': 'most_frequent', 'add_indicator': True, 'max_depth': 32, 'n_estimators': 1521, 'boosting_type': 'dart', 'num_leaves': 11, 'learning_rate': 0.00012529674084353574, 'min_split_gain': 6.502010923981533, 'min_child_samples': 213, 'subsample': 0.06134962711066816, 'subsample_freq': 1188, 'colsample_bytree': 0.465202419531627, 'reg_alpha': 5.816379550547579, 'reg_lambda': 99.48663171697672}. Best is trial 106 with value: 0.37587706549111516.[0m
[32m[I 2022-07-06 04:17:57,659][0m Trial 108 finished with value: 0.3286974861602277 and parameters: {'sigma': 1.1556206421217228, 'a': 13.931201054285207, 'strategy': 'mean', 'add_indicator': True, 'max_depth': 70, 'n_estimators': 191, 'boosting_type': 'gbdt', 'num_leaves': 458, 'learning_rate': 3.3983499890855326e-06, 'min_split_gain': 6.238958362916385, 'min_child_samples': 1399, 'subsample': 0.4260833838903715, 'subsample_freq': 25, 'colsample_bytree': 0.887738173088062, 'reg_alpha': 44.97846488213225, 'reg_lambda': 19.462251182076507}. Best is trial 106 with value: 0.37587706549111516.[0m
