[32m[I 2022-07-06 12:52:17,442][0m Trial 327 finished with value: 0.37006079643193307 and parameters: {'sigma': 0.3448263706166692, 'a': 11.91107799082483, 'strategy': 'median', 'add_indicator': True, 'max_depth': 81, 'n_estimators': 1158, 'boosting_type': 'gbdt', 'num_leaves': 128, 'learning_rate': 0.0033747117128396244, 'min_split_gain': 0.7551435772458004, 'min_child_samples': 496, 'subsample': 0.8222294954008668, 'subsample_freq': 557, 'colsample_bytree': 0.4088244023577067, 'reg_alpha': 47.638033802626026, 'reg_lambda': 8.615472427348376}. Best is trial 290 with value: 0.39243341529400166.[0m
[32m[I 2022-07-06 12:53:04,364][0m Trial 328 finished with value: 0.3772057081384326 and parameters: {'sigma': 0.7069567355982439, 'a': 10.558881446371641, 'strategy': 'median', 'add_indicator': True, 'max_depth': 83, 'n_estimators': 942, 'boosting_type': 'gbdt', 'num_leaves': 185, 'learning_rate': 0.009934186672510389, 'min_split_gain': 1.03307983010893, 'min_child_samples': 656, 'subsample': 0.7924936911280279, 'subsample_freq': 641, 'colsample_bytree': 0.3919756482520426, 'reg_alpha': 44.589331165258734, 'reg_lambda': 11.621671968285803}. Best is trial 290 with value: 0.39243341529400166.[0m
[32m[I 2022-07-06 12:54:05,543][0m Trial 329 finished with value: 0.38398681573078974 and parameters: {'sigma': 0.038446203816404706, 'a': 10.167264547011857, 'strategy': 'median', 'add_indicator': True, 'max_depth': 78, 'n_estimators': 997, 'boosting_type': 'gbdt', 'num_leaves': 233, 'learning_rate': 0.0077338813602280815, 'min_split_gain': 1.2516542650629736, 'min_child_samples': 565, 'subsample': 0.8356823886483669, 'subsample_freq': 984, 'colsample_bytree': 0.4289655476702614, 'reg_alpha': 53.18839717731101, 'reg_lambda': 14.983890788072369}. Best is trial 290 with value: 0.39243341529400166.[0m
[32m[I 2022-07-06 12:54:41,710][0m Trial 330 finished with value: 0.3624640404832145 and parameters: {'sigma': 1.0551686938683529, 'a': 11.72550109220411, 'strategy': 'median', 'add_indicator': True, 'max_depth': 87, 'n_estimators': 512, 'boosting_type': 'gbdt', 'num_leaves': 308, 'learning_rate': 0.006177461675574061, 'min_split_gain': 0.6162799195306701, 'min_child_samples': 733, 'subsample': 0.8081457269192115, 'subsample_freq': 511, 'colsample_bytree': 0.31747550742286706, 'reg_alpha': 56.176979234333785, 'reg_lambda': 18.426924188880136}. Best is trial 290 with value: 0.39243341529400166.[0m
[32m[I 2022-07-06 12:55:34,067][0m Trial 331 finished with value: 0.3692935281949161 and parameters: {'sigma': 0.39770377859650496, 'a': 11.094910960651921, 'strategy': 'median', 'add_indicator': True, 'max_depth': 91, 'n_estimators': 983, 'boosting_type': 'gbdt', 'num_leaves': 395, 'learning_rate': 0.0045367133019355394, 'min_split_gain': 0.34743133599719, 'min_child_samples': 457, 'subsample': 0.7735377978677401, 'subsample_freq': 400, 'colsample_bytree': 0.36838824259009717, 'reg_alpha': 50.77693980540082, 'reg_lambda': 13.231206010278182}. Best is trial 290 with value: 0.39243341529400166.[0m
[32m[I 2022-07-06 12:56:24,968][0m Trial 332 finished with value: 0.37000149096038654 and parameters: {'sigma': 0.6317444430057829, 'a': 11.471941490812949, 'strategy': 'median', 'add_indicator': True, 'max_depth': 84, 'n_estimators': 1143, 'boosting_type': 'gbdt', 'num_leaves': 255, 'learning_rate': 0.0034639337025316698, 'min_split_gain': 0.8856813623861792, 'min_child_samples': 613, 'subsample': 0.8564609111326937, 'subsample_freq': 849, 'colsample_bytree': 0.4136165497263423, 'reg_alpha': 47.16371620006188, 'reg_lambda': 11.032237994230028}. Best is trial 290 with value: 0.39243341529400166.[0m
[32m[I 2022-07-06 12:57:05,143][0m Trial 333 finished with value: 0.376403918898841 and parameters: {'sigma': 0.03172327581983875, 'a': 10.912146181515253, 'strategy': 'median', 'add_indicator': True, 'max_depth': 86, 'n_estimators': 779, 'boosting_type': 'gbdt', 'num_leaves': 548, 'learning_rate': 0.005611161126028502, 'min_split_gain': 1.6091039292823477, 'min_child_samples': 867, 'subsample': 0.7993509850783026, 'subsample_freq': 778, 'colsample_bytree': 0.3430586128775982, 'reg_alpha': 49.58384296962221, 'reg_lambda': 15.632542875321423}. Best is trial 290 with value: 0.39243341529400166.[0m
[32m[I 2022-07-06 12:57:51,968][0m Trial 334 finished with value: 0.3768040102794627 and parameters: {'sigma': 1.8294683336261834, 'a': 12.352170103719226, 'strategy': 'median', 'add_indicator': True, 'max_depth': 79, 'n_estimators': 1260, 'boosting_type': 'gbdt', 'num_leaves': 361, 'learning_rate': 0.008055015681423543, 'min_split_gain': 1.1102354303849646, 'min_child_samples': 520, 'subsample': 0.7281453936688169, 'subsample_freq': 437, 'colsample_bytree': 0.44740749332771435, 'reg_alpha': 41.52497221538077, 'reg_lambda': 13.898359998356625}. Best is trial 290 with value: 0.39243341529400166.[0m
[32m[I 2022-07-06 12:58:48,469][0m Trial 335 finished with value: 0.37860639175571437 and parameters: {'sigma': 0.33768139252169926, 'a': 10.632162847389472, 'strategy': 'median', 'add_indicator': True, 'max_depth': 82, 'n_estimators': 1494, 'boosting_type': 'gbdt', 'num_leaves': 293, 'learning_rate': 0.004690413198025391, 'min_split_gain': 0.7783050470245843, 'min_child_samples': 673, 'subsample': 0.8875947508232244, 'subsample_freq': 881, 'colsample_bytree': 0.384472282643808, 'reg_alpha': 52.34986896225224, 'reg_lambda': 7.801989340437799}. Best is trial 290 with value: 0.39243341529400166.[0m
[32m[I 2022-07-06 13:00:05,671][0m Trial 336 finished with value: 0.3765113260008026 and parameters: {'sigma': 0.8940939638052734, 'a': 9.83725447095778, 'strategy': 'median', 'add_indicator': True, 'max_depth': 88, 'n_estimators': 1494, 'boosting_type': 'gbdt', 'num_leaves': 449, 'learning_rate': 0.006549986911361584, 'min_split_gain': 1.3211495328695424, 'min_child_samples': 792, 'subsample': 0.826056343791153, 'subsample_freq': 1213, 'colsample_bytree': 0.40436078362350963, 'reg_alpha': 46.28188900261984, 'reg_lambda': 17.78591945280194}. Best is trial 290 with value: 0.39243341529400166.[0m
[32m[I 2022-07-06 13:00:45,860][0m Trial 337 finished with value: 0.3628748815312428 and parameters: {'sigma': 0.3802275796665151, 'a': 11.350101342579826, 'strategy': 'median', 'add_indicator': True, 'max_depth': 85, 'n_estimators': 800, 'boosting_type': 'gbdt', 'num_leaves': 216, 'learning_rate': 0.002755549419701158, 'min_split_gain': 0.9558757428660799, 'min_child_samples': 572, 'subsample': 0.7529819744442231, 'subsample_freq': 670, 'colsample_bytree': 0.42657566001873726, 'reg_alpha': 43.89492776288869, 'reg_lambda': 22.515361851352573}. Best is trial 290 with value: 0.39243341529400166.[0m
[32m[I 2022-07-06 13:01:18,104][0m Trial 338 finished with value: 0.3644925569212234 and parameters: {'sigma': 0.0034872034441841074, 'a': 10.22456094534636, 'strategy': 'median', 'add_indicator': True, 'max_depth': 84, 'n_estimators': 334, 'boosting_type': 'gbdt', 'num_leaves': 361, 'learning_rate': 0.00374274573366373, 'min_split_gain': 0.4914567147526858, 'min_child_samples': 646, 'subsample': 0.788791183352052, 'subsample_freq': 180, 'colsample_bytree': 0.3768606493344036, 'reg_alpha': 54.515968653467944, 'reg_lambda': 12.465094953931521}. Best is trial 290 with value: 0.39243341529400166.[0m
[32m[I 2022-07-06 13:02:08,993][0m Trial 339 finished with value: 0.37866823377295816 and parameters: {'sigma': 0.00035459780532766383, 'a': 11.755273436458427, 'strategy': 'median', 'add_indicator': True, 'max_depth': 89, 'n_estimators': 899, 'boosting_type': 'gbdt', 'num_leaves': 290, 'learning_rate': 0.005163515347410527, 'min_split_gain': 0.7240307480634117, 'min_child_samples': 728, 'subsample': 0.8154958022627474, 'subsample_freq': 760, 'colsample_bytree': 0.39991251321365506, 'reg_alpha': 48.724462881163376, 'reg_lambda': 15.874960578263652}. Best is trial 290 with value: 0.39243341529400166.[0m
[32m[I 2022-07-06 13:03:16,759][0m Trial 340 finished with value: 0.36058029347678183 and parameters: {'sigma': 0.7198956912869642, 'a': 9.464443518452299, 'strategy': 'median', 'add_indicator': True, 'max_depth': 81, 'n_estimators': 948, 'boosting_type': 'gbdt', 'num_leaves': 150, 'learning_rate': 0.0019511424439315837, 'min_split_gain': 1.0752233905719921, 'min_child_samples': 513, 'subsample': 0.8468875793124512, 'subsample_freq': 735, 'colsample_bytree': 0.3554188573717595, 'reg_alpha': 51.376706357412864, 'reg_lambda': 10.014276250373062}. Best is trial 290 with value: 0.39243341529400166.[0m
[32m[I 2022-07-06 13:03:36,603][0m Trial 341 finished with value: 0.35351604932426345 and parameters: {'sigma': 1.4738470099986416, 'a': 11.072234720211052, 'strategy': 'median', 'add_indicator': True, 'max_depth': 87, 'n_estimators': 125, 'boosting_type': 'gbdt', 'num_leaves': 417, 'learning_rate': 0.009986071442206203, 'min_split_gain': 1.4527853183392638, 'min_child_samples': 600, 'subsample': 0.7749574837050032, 'subsample_freq': 106, 'colsample_bytree': 0.44296896680285197, 'reg_alpha': 46.0543733256051, 'reg_lambda': 20.199532351036677}. Best is trial 290 with value: 0.39243341529400166.[0m
[32m[I 2022-07-06 13:04:21,514][0m Trial 342 finished with value: 0.36870903937169003 and parameters: {'sigma': 0.6261914995441589, 'a': 10.572642336863497, 'strategy': 'median', 'add_indicator': True, 'max_depth': 92, 'n_estimators': 595, 'boosting_type': 'gbdt', 'num_leaves': 250, 'learning_rate': 0.006829163326431048, 'min_split_gain': 0.8854963108576843, 'min_child_samples': 1000, 'subsample': 0.8650220147066376, 'subsample_freq': 72, 'colsample_bytree': 0.4120806323323537, 'reg_alpha': 48.66371905195856, 'reg_lambda': 13.924284696250584}. Best is trial 290 with value: 0.39243341529400166.[0m
[32m[I 2022-07-06 13:05:53,425][0m Trial 343 finished with value: 0.3827673423674242 and parameters: {'sigma': 0.007306646946153728, 'a': 12.054441482875099, 'strategy': 'median', 'add_indicator': True, 'max_depth': 83, 'n_estimators': 1488, 'boosting_type': 'gbdt', 'num_leaves': 191, 'learning_rate': 0.0042397975499780475, 'min_split_gain': 1.233267634986843, 'min_child_samples': 744, 'subsample': 0.8043210308144391, 'subsample_freq': 305, 'colsample_bytree': 0.3871483820748088, 'reg_alpha': 50.991028306205706, 'reg_lambda': 11.672679660453836}. Best is trial 290 with value: 0.39243341529400166.[0m
[32m[I 2022-07-06 13:06:34,322][0m Trial 344 finished with value: 0.36408570357205067 and parameters: {'sigma': 0.41318635178707575, 'a': 11.33390345255066, 'strategy': 'median', 'add_indicator': True, 'max_depth': 86, 'n_estimators': 420, 'boosting_type': 'gbdt', 'num_leaves': 538, 'learning_rate': 0.005483550789975791, 'min_split_gain': 0.6530343589444603, 'min_child_samples': 422, 'subsample': 0.8305847881362801, 'subsample_freq': 154, 'colsample_bytree': 0.458520659697524, 'reg_alpha': 53.9745558306251, 'reg_lambda': 16.381108260199014}. Best is trial 290 with value: 0.39243341529400166.[0m
[32m[I 2022-07-06 13:06:58,191][0m Trial 345 finished with value: 0.3586452283750023 and parameters: {'sigma': 1.1386486019509898, 'a': 10.931437226782974, 'strategy': 'median', 'add_indicator': True, 'max_depth': 84, 'n_estimators': 250, 'boosting_type': 'gbdt', 'num_leaves': 327, 'learning_rate': 0.0074761511833681465, 'min_split_gain': 1.034542740767165, 'min_child_samples': 551, 'subsample': 0.7857908965237242, 'subsample_freq': 249, 'colsample_bytree': 0.4267056032609873, 'reg_alpha': 43.860872938869214, 'reg_lambda': 5.990519547259941}. Best is trial 290 with value: 0.39243341529400166.[0m
[32m[I 2022-07-06 13:07:54,647][0m Trial 346 finished with value: 0.37202145844479545 and parameters: {'sigma': 0.38651684722742874, 'a': 10.353806376003115, 'strategy': 'median', 'add_indicator': True, 'max_depth': 80, 'n_estimators': 1397, 'boosting_type': 'gbdt', 'num_leaves': 293, 'learning_rate': 0.0033335366579405642, 'min_split_gain': 0.2757836595698484, 'min_child_samples': 657, 'subsample': 0.818008720939832, 'subsample_freq': 1147, 'colsample_bytree': 0.36463731923326576, 'reg_alpha': 40.21451223837285, 'reg_lambda': 14.125525049250983}. Best is trial 290 with value: 0.39243341529400166.[0m
[32m[I 2022-07-06 13:08:36,314][0m Trial 347 finished with value: 0.3667264954999978 and parameters: {'sigma': 0.9276688092823332, 'a': 11.55897287902907, 'strategy': 'median', 'add_indicator': True, 'max_depth': 90, 'n_estimators': 818, 'boosting_type': 'gbdt', 'num_leaves': 677, 'learning_rate': 0.00427818332251731, 'min_split_gain': 0.8519192664166986, 'min_child_samples': 890, 'subsample': 0.834764762052555, 'subsample_freq': 523, 'colsample_bytree': 0.47716125494454564, 'reg_alpha': 46.78238770416741, 'reg_lambda': 18.601422457777357}. Best is trial 290 with value: 0.39243341529400166.[0m
[32m[I 2022-07-06 13:10:06,736][0m Trial 348 finished with value: 0.3508434899699983 and parameters: {'sigma': 0.3624811201522643, 'a': 10.71657977780616, 'strategy': 'median', 'add_indicator': True, 'max_depth': 87, 'n_estimators': 1493, 'boosting_type': 'gbdt', 'num_leaves': 378, 'learning_rate': 7.126981420300184e-05, 'min_split_gain': 0.5636432848281865, 'min_child_samples': 613, 'subsample': 0.7589042509341128, 'subsample_freq': 843, 'colsample_bytree': 0.39864263616372553, 'reg_alpha': 49.68496582141326, 'reg_lambda': 9.400021198478978}. Best is trial 290 with value: 0.39243341529400166.[0m
[32m[I 2022-07-06 13:10:43,158][0m Trial 349 finished with value: 0.36835966058399916 and parameters: {'sigma': 0.7020878712473118, 'a': 11.108762586066705, 'strategy': 'median', 'add_indicator': True, 'max_depth': 82, 'n_estimators': 854, 'boosting_type': 'gbdt', 'num_leaves': 472, 'learning_rate': 0.005957839867655868, 'min_split_gain': 1.2203498721024266, 'min_child_samples': 704, 'subsample': 0.8031178719720137, 'subsample_freq': 827, 'colsample_bytree': 0.3421145151777738, 'reg_alpha': 52.626118860337, 'reg_lambda': 11.92596121263281}. Best is trial 290 with value: 0.39243341529400166.[0m
[32m[I 2022-07-06 13:11:49,748][0m Trial 350 finished with value: 0.3823159238153884 and parameters: {'sigma': 0.03387907836641466, 'a': 9.108919905678889, 'strategy': 'median', 'add_indicator': True, 'max_depth': 85, 'n_estimators': 1473, 'boosting_type': 'gbdt', 'num_leaves': 247, 'learning_rate': 0.004971706294312686, 'min_split_gain': 1.4948555599471574, 'min_child_samples': 530, 'subsample': 0.8460259031727975, 'subsample_freq': 1462, 'colsample_bytree': 0.42108835746274914, 'reg_alpha': 57.06948588936111, 'reg_lambda': 15.296707708695967}. Best is trial 290 with value: 0.39243341529400166.[0m
[32m[I 2022-07-06 13:12:25,637][0m Trial 351 finished with value: 0.36384763575211104 and parameters: {'sigma': 0.6338709863230578, 'a': 12.687258832688736, 'strategy': 'median', 'add_indicator': True, 'max_depth': 88, 'n_estimators': 369, 'boosting_type': 'gbdt', 'num_leaves': 329, 'learning_rate': 0.007604928575744653, 'min_split_gain': 0.942981839508289, 'min_child_samples': 821, 'subsample': 0.7750215834843417, 'subsample_freq': 38, 'colsample_bytree': 0.38360011441847575, 'reg_alpha': 48.25274875830243, 'reg_lambda': 17.33056272819134}. Best is trial 290 with value: 0.39243341529400166.[0m
[32m[I 2022-07-06 13:14:01,716][0m Trial 352 finished with value: 0.37238670848597316 and parameters: {'sigma': 0.34232138183540106, 'a': 11.748281688325527, 'strategy': 'median', 'add_indicator': True, 'max_depth': 84, 'n_estimators': 1489, 'boosting_type': 'gbdt', 'num_leaves': 202, 'learning_rate': 0.0029471189194094365, 'min_split_gain': 0.7180212536253631, 'min_child_samples': 466, 'subsample': 0.8748584419748513, 'subsample_freq': 302, 'colsample_bytree': 0.4035910952587608, 'reg_alpha': 45.42746254883941, 'reg_lambda': 0.5171609860427111}. Best is trial 290 with value: 0.39243341529400166.[0m
[32m[I 2022-07-06 13:14:40,782][0m Trial 353 finished with value: 0.3715296755350304 and parameters: {'sigma': 0.007715206025207956, 'a': 9.868475993924008, 'strategy': 'median', 'add_indicator': True, 'max_depth': 82, 'n_estimators': 749, 'boosting_type': 'gbdt', 'num_leaves': 417, 'learning_rate': 0.0038079918508453093, 'min_split_gain': 1.077751708740179, 'min_child_samples': 589, 'subsample': 0.8081364307108824, 'subsample_freq': 197, 'colsample_bytree': 0.4400431457247677, 'reg_alpha': 49.963152789090245, 'reg_lambda': 13.034092156965976}. Best is trial 290 with value: 0.39243341529400166.[0m
[32m[I 2022-07-06 13:14:57,716][0m Trial 354 finished with value: 0.33899745820212696 and parameters: {'sigma': 0.7016944767107129, 'a': 12.218676474247747, 'strategy': 'median', 'add_indicator': True, 'max_depth': 77, 'n_estimators': 15, 'boosting_type': 'gbdt', 'num_leaves': 261, 'learning_rate': 0.006490899549283204, 'min_split_gain': 1.3395165181885713, 'min_child_samples': 655, 'subsample': 0.7940548749028635, 'subsample_freq': 15, 'colsample_bytree': 0.3739971856344498, 'reg_alpha': 55.176222880648034, 'reg_lambda': 11.195734907147035}. Best is trial 290 with value: 0.39243341529400166.[0m
[32m[I 2022-07-06 13:15:17,938][0m Trial 355 finished with value: 0.35046053281657374 and parameters: {'sigma': 1.0636577767010416, 'a': 10.755136824217956, 'strategy': 'median', 'add_indicator': True, 'max_depth': 87, 'n_estimators': 57, 'boosting_type': 'gbdt', 'num_leaves': 340, 'learning_rate': 0.008141676812559877, 'min_split_gain': 0.4222645936313969, 'min_child_samples': 767, 'subsample': 0.8307284875108502, 'subsample_freq': 39, 'colsample_bytree': 0.4172211581213417, 'reg_alpha': 42.284291650040906, 'reg_lambda': 15.2608184401846}. Best is trial 290 with value: 0.39243341529400166.[0m
[32m[I 2022-07-06 13:15:41,849][0m Trial 356 finished with value: 0.36182595053971295 and parameters: {'sigma': 0.016570912963686825, 'a': 11.293429093593694, 'strategy': 'median', 'add_indicator': True, 'max_depth': 85, 'n_estimators': 151, 'boosting_type': 'gbdt', 'num_leaves': 169, 'learning_rate': 0.005202269672994388, 'min_split_gain': 0.8958826892344137, 'min_child_samples': 556, 'subsample': 0.8962870170317817, 'subsample_freq': 148, 'colsample_bytree': 0.3923948288315614, 'reg_alpha': 52.05100050858946, 'reg_lambda': 7.80983352492161}. Best is trial 290 with value: 0.39243341529400166.[0m
[32m[I 2022-07-06 13:16:44,450][0m Trial 357 finished with value: 0.37054513925209315 and parameters: {'sigma': 1.4915525990519933, 'a': 10.23707374186789, 'strategy': 'median', 'add_indicator': True, 'max_depth': 80, 'n_estimators': 1437, 'boosting_type': 'gbdt', 'num_leaves': 471, 'learning_rate': 0.004033326862620569, 'min_split_gain': 0.6611568286557361, 'min_child_samples': 704, 'subsample': 0.7461222657962794, 'subsample_freq': 1182, 'colsample_bytree': 0.36164027758781503, 'reg_alpha': 47.932975897907966, 'reg_lambda': 20.64564923968723}. Best is trial 290 with value: 0.39243341529400166.[0m
[32m[I 2022-07-06 13:17:33,817][0m Trial 358 finished with value: 0.36705033653826563 and parameters: {'sigma': 0.3874662768652347, 'a': 11.873767184822434, 'strategy': 'median', 'add_indicator': True, 'max_depth': 89, 'n_estimators': 1072, 'boosting_type': 'gbdt', 'num_leaves': 286, 'learning_rate': 0.0025325988128784543, 'min_split_gain': 1.169812647522619, 'min_child_samples': 633, 'subsample': 0.8571272737707271, 'subsample_freq': 672, 'colsample_bytree': 0.4347450518131425, 'reg_alpha': 45.2627523845142, 'reg_lambda': 13.576377605695011}. Best is trial 290 with value: 0.39243341529400166.[0m
[32m[I 2022-07-06 13:18:02,140][0m Trial 359 finished with value: 0.3576139504132347 and parameters: {'sigma': 1.041774592572899, 'a': 11.370809071180158, 'strategy': 'median', 'add_indicator': True, 'max_depth': 83, 'n_estimators': 296, 'boosting_type': 'gbdt', 'num_leaves': 220, 'learning_rate': 0.006099012933458943, 'min_split_gain': 1.7714795355525759, 'min_child_samples': 498, 'subsample': 0.8130142358712457, 'subsample_freq': 282, 'colsample_bytree': 0.3290971295969544, 'reg_alpha': 50.413369951880455, 'reg_lambda': 9.808847762063312}. Best is trial 290 with value: 0.39243341529400166.[0m
[32m[I 2022-07-06 13:18:36,240][0m Trial 360 finished with value: 0.3615586130065859 and parameters: {'sigma': 0.44714477662135493, 'a': 10.813125325316934, 'strategy': 'median', 'add_indicator': True, 'max_depth': 93, 'n_estimators': 600, 'boosting_type': 'gbdt', 'num_leaves': 369, 'learning_rate': 0.004784007458021124, 'min_split_gain': 0.840741064713391, 'min_child_samples': 587, 'subsample': 0.7857934194019645, 'subsample_freq': 599, 'colsample_bytree': 0.4632686485634944, 'reg_alpha': 59.095067773440014, 'reg_lambda': 17.837849039190782}. Best is trial 290 with value: 0.39243341529400166.[0m
[32m[I 2022-07-06 13:19:36,751][0m Trial 361 finished with value: 0.3863444191702117 and parameters: {'sigma': 0.00830286481469276, 'a': 10.354250787702686, 'strategy': 'median', 'add_indicator': True, 'max_depth': 85, 'n_estimators': 1104, 'boosting_type': 'gbdt', 'num_leaves': 565, 'learning_rate': 0.008601156354216013, 'min_split_gain': 1.0211296876494997, 'min_child_samples': 681, 'subsample': 0.7709354397694561, 'subsample_freq': 202, 'colsample_bytree': 0.41046528604713406, 'reg_alpha': 53.868023882307654, 'reg_lambda': 15.721365775482198}. Best is trial 290 with value: 0.39243341529400166.[0m
[32m[I 2022-07-06 13:21:18,584][0m Trial 362 finished with value: 0.37021940448194196 and parameters: {'sigma': 0.7206295957539932, 'a': 11.163195737473037, 'strategy': 'median', 'add_indicator': True, 'max_depth': 91, 'n_estimators': 1489, 'boosting_type': 'gbdt', 'num_leaves': 304, 'learning_rate': 0.0034382424164107785, 'min_split_gain': 0.5123327851164617, 'min_child_samples': 778, 'subsample': 0.8235791003946968, 'subsample_freq': 1415, 'colsample_bytree': 0.39330970138936394, 'reg_alpha': 46.84795437363078, 'reg_lambda': 11.999585591723296}. Best is trial 290 with value: 0.39243341529400166.[0m
