[32m[I 2022-07-06 12:08:19,197][0m Trial 289 finished with value: 0.38237119467639796 and parameters: {'sigma': 0.7414974114265224, 'a': 10.75284744462591, 'strategy': 'median', 'add_indicator': True, 'max_depth': 88, 'n_estimators': 2670, 'boosting_type': 'gbdt', 'num_leaves': 419, 'learning_rate': 0.009844127860529227, 'min_split_gain': 0.8385684461192671, 'min_child_samples': 658, 'subsample': 0.7563934165722435, 'subsample_freq': 2382, 'colsample_bytree': 0.36699251041725284, 'reg_alpha': 45.479392406632144, 'reg_lambda': 9.242810408439814}. Best is trial 234 with value: 0.39041325693788764.[0m
[32m[I 2022-07-06 12:12:48,998][0m Trial 290 finished with value: 0.39243341529400166 and parameters: {'sigma': 0.00357388556823221, 'a': 9.77725834692898, 'strategy': 'median', 'add_indicator': True, 'max_depth': 87, 'n_estimators': 2937, 'boosting_type': 'gbdt', 'num_leaves': 241, 'learning_rate': 0.005361886976936977, 'min_split_gain': 0.6086886785851787, 'min_child_samples': 838, 'subsample': 0.7835139553236531, 'subsample_freq': 2464, 'colsample_bytree': 0.3910928389000126, 'reg_alpha': 42.91945800705953, 'reg_lambda': 17.218892830430974}. Best is trial 290 with value: 0.39243341529400166.[0m
[32m[I 2022-07-06 12:17:51,713][0m Trial 292 finished with value: 0.38288687627744206 and parameters: {'sigma': 0.46896527816900757, 'a': 9.747547672116179, 'strategy': 'median', 'add_indicator': True, 'max_depth': 92, 'n_estimators': 1291, 'boosting_type': 'gbdt', 'num_leaves': 203, 'learning_rate': 0.007386831285747461, 'min_split_gain': 0.3275117947302363, 'min_child_samples': 959, 'subsample': 0.7766540166877597, 'subsample_freq': 597, 'colsample_bytree': 0.3726067742581833, 'reg_alpha': 43.14520589233223, 'reg_lambda': 21.166210134338545}. Best is trial 290 with value: 0.39243341529400166.[0m
[32m[I 2022-07-06 12:19:43,511][0m Trial 293 finished with value: 0.3686669839545898 and parameters: {'sigma': 1.116884484118658, 'a': 10.17178763588894, 'strategy': 'median', 'add_indicator': True, 'max_depth': 87, 'n_estimators': 1036, 'boosting_type': 'gbdt', 'num_leaves': 254, 'learning_rate': 0.002968813476601752, 'min_split_gain': 0.5932489181899913, 'min_child_samples': 870, 'subsample': 0.9079005960248665, 'subsample_freq': 878, 'colsample_bytree': 0.3517042957059646, 'reg_alpha': 42.31880319589387, 'reg_lambda': 17.793337384615924}. Best is trial 290 with value: 0.39243341529400166.[0m
[32m[I 2022-07-06 12:21:36,322][0m Trial 294 finished with value: 0.38455561485397227 and parameters: {'sigma': 0.02239861915636821, 'a': 10.469914494130727, 'strategy': 'median', 'add_indicator': True, 'max_depth': 91, 'n_estimators': 1282, 'boosting_type': 'gbdt', 'num_leaves': 151, 'learning_rate': 0.005516948143554462, 'min_split_gain': 0.7113502539897768, 'min_child_samples': 798, 'subsample': 0.7558953393489102, 'subsample_freq': 786, 'colsample_bytree': 0.42552769348696007, 'reg_alpha': 46.598308737294666, 'reg_lambda': 16.27220255426192}. Best is trial 290 with value: 0.39243341529400166.[0m
[32m[I 2022-07-06 12:23:52,287][0m Trial 295 finished with value: 0.3741219247972202 and parameters: {'sigma': 0.6810361039600765, 'a': 9.6607986988928, 'strategy': 'median', 'add_indicator': True, 'max_depth': 86, 'n_estimators': 1494, 'boosting_type': 'gbdt', 'num_leaves': 225, 'learning_rate': 0.0040100236664433, 'min_split_gain': 1.3310589317592658, 'min_child_samples': 531, 'subsample': 0.7762563222177876, 'subsample_freq': 1471, 'colsample_bytree': 0.39369556015543017, 'reg_alpha': 44.32865326109114, 'reg_lambda': 19.22527357078841}. Best is trial 290 with value: 0.39243341529400166.[0m
[32m[I 2022-07-06 12:26:02,197][0m Trial 296 finished with value: 0.38534335590613916 and parameters: {'sigma': 0.008120376305293706, 'a': 10.797082446830611, 'strategy': 'median', 'add_indicator': True, 'max_depth': 79, 'n_estimators': 1330, 'boosting_type': 'gbdt', 'num_leaves': 283, 'learning_rate': 0.005968100152075196, 'min_split_gain': 0.9250609772358851, 'min_child_samples': 706, 'subsample': 0.7408247751582855, 'subsample_freq': 961, 'colsample_bytree': 0.44107977614773425, 'reg_alpha': 48.328726357288765, 'reg_lambda': 11.794986837372623}. Best is trial 290 with value: 0.39243341529400166.[0m
[32m[I 2022-07-06 12:27:58,427][0m Trial 297 finished with value: 0.3841944805530668 and parameters: {'sigma': 0.41388800720630264, 'a': 11.601876042552515, 'strategy': 'median', 'add_indicator': True, 'max_depth': 88, 'n_estimators': 1490, 'boosting_type': 'gbdt', 'num_leaves': 516, 'learning_rate': 0.008189927766309356, 'min_split_gain': 0.5378198925645301, 'min_child_samples': 649, 'subsample': 0.8630191526338877, 'subsample_freq': 1283, 'colsample_bytree': 0.37727760860798665, 'reg_alpha': 57.40029395788379, 'reg_lambda': 15.320525021592575}. Best is trial 290 with value: 0.39243341529400166.[0m
[32m[I 2022-07-06 12:29:20,302][0m Trial 298 finished with value: 0.3651285143703995 and parameters: {'sigma': 0.9563369482655649, 'a': 10.378205506159667, 'strategy': 'median', 'add_indicator': True, 'max_depth': 86, 'n_estimators': 461, 'boosting_type': 'gbdt', 'num_leaves': 383, 'learning_rate': 0.005168974219296195, 'min_split_gain': 1.1344874026897678, 'min_child_samples': 481, 'subsample': 0.7951504528207135, 'subsample_freq': 416, 'colsample_bytree': 0.40828305939576726, 'reg_alpha': 40.875665949043864, 'reg_lambda': 17.229109528970685}. Best is trial 290 with value: 0.39243341529400166.[0m
[32m[I 2022-07-06 12:30:49,788][0m Trial 299 finished with value: 0.3663310255539153 and parameters: {'sigma': 0.40305435437436954, 'a': 10.943927636621511, 'strategy': 'median', 'add_indicator': True, 'max_depth': 82, 'n_estimators': 635, 'boosting_type': 'gbdt', 'num_leaves': 194, 'learning_rate': 0.003455374767876456, 'min_split_gain': 0.8547072608477354, 'min_child_samples': 835, 'subsample': 0.8409748557260799, 'subsample_freq': 494, 'colsample_bytree': 0.3928918823221926, 'reg_alpha': 46.39788299027047, 'reg_lambda': 13.520179152667529}. Best is trial 290 with value: 0.39243341529400166.[0m
[32m[I 2022-07-06 12:31:40,742][0m Trial 301 finished with value: 0.34992222977155873 and parameters: {'sigma': 1.4474365267107019, 'a': 11.42078412515878, 'strategy': 'median', 'add_indicator': True, 'max_depth': 85, 'n_estimators': 62, 'boosting_type': 'gbdt', 'num_leaves': 270, 'learning_rate': 0.00669125822574916, 'min_split_gain': 0.7128600423086158, 'min_child_samples': 565, 'subsample': 0.800614913737443, 'subsample_freq': 29, 'colsample_bytree': 0.4350084062236564, 'reg_alpha': 54.9124467349075, 'reg_lambda': 10.401686955256496}. Best is trial 290 with value: 0.39243341529400166.[0m
[32m[I 2022-07-06 12:32:16,883][0m Trial 302 finished with value: 0.3680938481154481 and parameters: {'sigma': 0.017615911983083512, 'a': 9.969467462859816, 'strategy': 'median', 'add_indicator': True, 'max_depth': 90, 'n_estimators': 708, 'boosting_type': 'gbdt', 'num_leaves': 382, 'learning_rate': 0.002102203010564223, 'min_split_gain': 0.33585884934472343, 'min_child_samples': 699, 'subsample': 0.7789450212845713, 'subsample_freq': 600, 'colsample_bytree': 0.3517042957059646, 'reg_alpha': 49.09193729250056, 'reg_lambda': 14.616230341054038}. Best is trial 290 with value: 0.39243341529400166.[0m
[32m[I 2022-07-06 12:32:43,453][0m Trial 303 finished with value: 0.35697502327002417 and parameters: {'sigma': 0.6847037720019565, 'a': 11.870647970580904, 'strategy': 'median', 'add_indicator': True, 'max_depth': 88, 'n_estimators': 281, 'boosting_type': 'gbdt', 'num_leaves': 494, 'learning_rate': 0.004069485415582728, 'min_split_gain': 1.042389678116459, 'min_child_samples': 622, 'subsample': 0.8246263428323984, 'subsample_freq': 139, 'colsample_bytree': 0.4644648200667775, 'reg_alpha': 44.928807898649374, 'reg_lambda': 11.607533341416486}. Best is trial 290 with value: 0.39243341529400166.[0m
[32m[I 2022-07-06 12:33:38,190][0m Trial 304 finished with value: 0.3780618915668035 and parameters: {'sigma': 0.3815526861817685, 'a': 10.74904437105367, 'strategy': 'median', 'add_indicator': True, 'max_depth': 81, 'n_estimators': 1494, 'boosting_type': 'gbdt', 'num_leaves': 309, 'learning_rate': 0.005464923473383783, 'min_split_gain': 1.3310589317592658, 'min_child_samples': 531, 'subsample': 0.8518840398029623, 'subsample_freq': 1216, 'colsample_bytree': 0.4067424680709661, 'reg_alpha': 50.83646235536981, 'reg_lambda': 7.769736792315939}. Best is trial 290 with value: 0.39243341529400166.[0m
[32m[I 2022-07-06 12:34:36,867][0m Trial 305 finished with value: 0.3869967592140447 and parameters: {'sigma': 0.008120376305293706, 'a': 12.284462487256768, 'strategy': 'median', 'add_indicator': True, 'max_depth': 85, 'n_estimators': 1330, 'boosting_type': 'gbdt', 'num_leaves': 248, 'learning_rate': 0.007988292047837397, 'min_split_gain': 0.7878237939368977, 'min_child_samples': 760, 'subsample': 0.8026720241038731, 'subsample_freq': 961, 'colsample_bytree': 0.37630745837912943, 'reg_alpha': 47.77872356139789, 'reg_lambda': 16.126454477886657}. Best is trial 290 with value: 0.39243341529400166.[0m
[32m[I 2022-07-06 12:35:49,465][0m Trial 306 finished with value: 0.3677217731240671 and parameters: {'sigma': 1.0492402079687673, 'a': 11.238649883251268, 'strategy': 'median', 'add_indicator': True, 'max_depth': 87, 'n_estimators': 1490, 'boosting_type': 'gbdt', 'num_leaves': 365, 'learning_rate': 0.0031397645989239232, 'min_split_gain': 1.2146974112877937, 'min_child_samples': 690, 'subsample': 0.8303198521341412, 'subsample_freq': 1283, 'colsample_bytree': 0.42127187307649905, 'reg_alpha': 51.55985041173663, 'reg_lambda': 19.823139560096205}. Best is trial 290 with value: 0.39243341529400166.[0m
[32m[I 2022-07-06 12:36:24,178][0m Trial 307 finished with value: 0.3600452095535451 and parameters: {'sigma': 0.6414092247755623, 'a': 10.458697163344654, 'strategy': 'median', 'add_indicator': True, 'max_depth': 83, 'n_estimators': 461, 'boosting_type': 'gbdt', 'num_leaves': 183, 'learning_rate': 0.004401421836172449, 'min_split_gain': 1.003870711426678, 'min_child_samples': 593, 'subsample': 0.7655615057009449, 'subsample_freq': 416, 'colsample_bytree': 0.39202273280304667, 'reg_alpha': 42.84135374107674, 'reg_lambda': 12.573738322889442}. Best is trial 290 with value: 0.39243341529400166.[0m
[32m[I 2022-07-06 12:37:05,871][0m Trial 308 finished with value: 0.37488932378906137 and parameters: {'sigma': 0.38554240391887035, 'a': 11.626525144250857, 'strategy': 'median', 'add_indicator': True, 'max_depth': 85, 'n_estimators': 635, 'boosting_type': 'gbdt', 'num_leaves': 428, 'learning_rate': 0.009995852709155427, 'min_split_gain': 1.5499781905712933, 'min_child_samples': 991, 'subsample': 0.8823760339545214, 'subsample_freq': 494, 'colsample_bytree': 0.36561529944243737, 'reg_alpha': 53.81073717557652, 'reg_lambda': 14.96550450931884}. Best is trial 290 with value: 0.39243341529400166.[0m
[32m[I 2022-07-06 12:37:55,515][0m Trial 309 finished with value: 0.37500208805771207 and parameters: {'sigma': 0.8314405192200497, 'a': 11.039190261730111, 'strategy': 'median', 'add_indicator': True, 'max_depth': 78, 'n_estimators': 1133, 'boosting_type': 'gbdt', 'num_leaves': 320, 'learning_rate': 0.006685026293293575, 'min_split_gain': 0.570705007573147, 'min_child_samples': 499, 'subsample': 0.7868515276914252, 'subsample_freq': 726, 'colsample_bytree': 0.4512273415764658, 'reg_alpha': 49.65762182089884, 'reg_lambda': 17.061164783144463}. Best is trial 290 with value: 0.39243341529400166.[0m
[32m[I 2022-07-06 12:38:43,507][0m Trial 310 finished with value: 0.3805246004702574 and parameters: {'sigma': 0.0068311669940283, 'a': 9.465675149068776, 'strategy': 'median', 'add_indicator': True, 'max_depth': 90, 'n_estimators': 1020, 'boosting_type': 'gbdt', 'num_leaves': 232, 'learning_rate': 0.005104812869366608, 'min_split_gain': 0.9385958345422664, 'min_child_samples': 418, 'subsample': 0.8145624416031478, 'subsample_freq': 709, 'colsample_bytree': 0.42322621137451527, 'reg_alpha': 45.70953844215616, 'reg_lambda': 13.252327101871927}. Best is trial 290 with value: 0.39243341529400166.[0m
[32m[I 2022-07-06 12:39:38,075][0m Trial 311 finished with value: 0.3692490647013522 and parameters: {'sigma': 0.41748603123582695, 'a': 11.91103564289771, 'strategy': 'median', 'add_indicator': True, 'max_depth': 81, 'n_estimators': 636, 'boosting_type': 'gbdt', 'num_leaves': 591, 'learning_rate': 0.006405573132557921, 'min_split_gain': 0.7487441095226957, 'min_child_samples': 824, 'subsample': 0.8481199788577283, 'subsample_freq': 620, 'colsample_bytree': 0.4019555462746482, 'reg_alpha': 47.86328952955227, 'reg_lambda': 9.57985327259621}. Best is trial 290 with value: 0.39243341529400166.[0m
[32m[I 2022-07-06 12:40:18,367][0m Trial 312 finished with value: 0.36833958476513134 and parameters: {'sigma': 0.0029139521819114417, 'a': 11.292253474114226, 'strategy': 'median', 'add_indicator': True, 'max_depth': 87, 'n_estimators': 483, 'boosting_type': 'gbdt', 'num_leaves': 287, 'learning_rate': 0.004041596077692376, 'min_split_gain': 1.176808111913392, 'min_child_samples': 646, 'subsample': 0.7374515405509325, 'subsample_freq': 22, 'colsample_bytree': 0.3786323044006642, 'reg_alpha': 55.83519872321901, 'reg_lambda': 18.461421538261536}. Best is trial 290 with value: 0.39243341529400166.[0m
[32m[I 2022-07-06 12:40:40,900][0m Trial 313 finished with value: 0.35232678576247833 and parameters: {'sigma': 1.3038311201972426, 'a': 10.690037465176143, 'strategy': 'median', 'add_indicator': True, 'max_depth': 83, 'n_estimators': 137, 'boosting_type': 'gbdt', 'num_leaves': 370, 'learning_rate': 0.002828650218760985, 'min_split_gain': 0.38379035260972083, 'min_child_samples': 740, 'subsample': 0.8012749794084378, 'subsample_freq': 24, 'colsample_bytree': 0.3470541045867344, 'reg_alpha': 51.69306735952123, 'reg_lambda': 11.298825034689397}. Best is trial 290 with value: 0.39243341529400166.[0m
[32m[I 2022-07-06 12:41:26,224][0m Trial 314 finished with value: 0.3673365338111833 and parameters: {'sigma': 0.7141665983930608, 'a': 10.043720945945353, 'strategy': 'median', 'add_indicator': True, 'max_depth': 85, 'n_estimators': 683, 'boosting_type': 'gbdt', 'num_leaves': 494, 'learning_rate': 0.005217500439406738, 'min_split_gain': 1.02535127893857, 'min_child_samples': 564, 'subsample': 0.8308122822872798, 'subsample_freq': 148, 'colsample_bytree': 0.4330446015515706, 'reg_alpha': 44.02668439616644, 'reg_lambda': 15.2505421602568}. Best is trial 290 with value: 0.39243341529400166.[0m
[32m[I 2022-07-06 12:42:32,493][0m Trial 315 finished with value: 0.3832235043677484 and parameters: {'sigma': 0.35767372362563987, 'a': 11.102216801117962, 'strategy': 'median', 'add_indicator': True, 'max_depth': 93, 'n_estimators': 1488, 'boosting_type': 'gbdt', 'num_leaves': 234, 'learning_rate': 0.008186874641311728, 'min_split_gain': 0.5705058445822143, 'min_child_samples': 622, 'subsample': 0.7738707351549768, 'subsample_freq': 1481, 'colsample_bytree': 0.4061246351048519, 'reg_alpha': 46.732435935746246, 'reg_lambda': 13.310492899688741}. Best is trial 290 with value: 0.39243341529400166.[0m
[32m[I 2022-07-06 12:42:59,516][0m Trial 316 finished with value: 0.35626135176094764 and parameters: {'sigma': 0.40969582312391695, 'a': 10.367799708345657, 'strategy': 'median', 'add_indicator': True, 'max_depth': 88, 'n_estimators': 213, 'boosting_type': 'gbdt', 'num_leaves': 361, 'learning_rate': 0.003817317790514694, 'min_split_gain': 1.3978953136595529, 'min_child_samples': 542, 'subsample': 0.811672878979593, 'subsample_freq': 59, 'colsample_bytree': 0.3870466431149056, 'reg_alpha': 49.27756250766196, 'reg_lambda': 21.502282087753382}. Best is trial 290 with value: 0.39243341529400166.[0m
[32m[I 2022-07-06 12:43:50,640][0m Trial 317 finished with value: 0.37783991930151867 and parameters: {'sigma': 0.9533440677081262, 'a': 11.591587118342707, 'strategy': 'median', 'add_indicator': True, 'max_depth': 83, 'n_estimators': 1494, 'boosting_type': 'gbdt', 'num_leaves': 284, 'learning_rate': 0.0064716949736702886, 'min_split_gain': 0.81258242342165, 'min_child_samples': 903, 'subsample': 0.7902010040904649, 'subsample_freq': 1043, 'colsample_bytree': 0.328032415908191, 'reg_alpha': 39.38138655815779, 'reg_lambda': 6.700586482170714}. Best is trial 290 with value: 0.39243341529400166.[0m
[32m[I 2022-07-06 12:44:38,053][0m Trial 318 finished with value: 0.37934745665267994 and parameters: {'sigma': 0.0041487727412127945, 'a': 12.532658144747058, 'strategy': 'median', 'add_indicator': True, 'max_depth': 86, 'n_estimators': 1015, 'boosting_type': 'gbdt', 'num_leaves': 162, 'learning_rate': 0.004752854569961865, 'min_split_gain': 1.1895257500477945, 'min_child_samples': 702, 'subsample': 0.8597124440942056, 'subsample_freq': 327, 'colsample_bytree': 0.4775552031003697, 'reg_alpha': 53.02663559748309, 'reg_lambda': 10.316495771779975}. Best is trial 290 with value: 0.39243341529400166.[0m
[32m[I 2022-07-06 12:45:30,031][0m Trial 319 finished with value: 0.3643846398672674 and parameters: {'sigma': 0.4076324814118667, 'a': 10.754438982728873, 'strategy': 'median', 'add_indicator': True, 'max_depth': 80, 'n_estimators': 843, 'boosting_type': 'gbdt', 'num_leaves': 436, 'learning_rate': 0.003081221720466736, 'min_split_gain': 0.9213433076358313, 'min_child_samples': 472, 'subsample': 0.8239211051525823, 'subsample_freq': 504, 'colsample_bytree': 0.4183911574944298, 'reg_alpha': 50.29687846521652, 'reg_lambda': 17.288332145319554}. Best is trial 290 with value: 0.39243341529400166.[0m
[32m[I 2022-07-06 12:46:12,366][0m Trial 320 finished with value: 0.36750961130358456 and parameters: {'sigma': 0.7602129487759607, 'a': 12.07382612953522, 'strategy': 'median', 'add_indicator': True, 'max_depth': 90, 'n_estimators': 631, 'boosting_type': 'gbdt', 'num_leaves': 208, 'learning_rate': 0.007844642082548543, 'min_split_gain': 0.6314650777496064, 'min_child_samples': 610, 'subsample': 0.7527806931634814, 'subsample_freq': 583, 'colsample_bytree': 0.3675973764965364, 'reg_alpha': 58.37096284860461, 'reg_lambda': 14.41661166398182}. Best is trial 290 with value: 0.39243341529400166.[0m
[32m[I 2022-07-06 12:46:48,567][0m Trial 321 finished with value: 0.3673336129710109 and parameters: {'sigma': 0.36453260794975634, 'a': 11.351749289028657, 'strategy': 'median', 'add_indicator': True, 'max_depth': 84, 'n_estimators': 498, 'boosting_type': 'gbdt', 'num_leaves': 324, 'learning_rate': 0.005578565358767772, 'min_split_gain': 1.0843597991811085, 'min_child_samples': 767, 'subsample': 0.7861660208441443, 'subsample_freq': 413, 'colsample_bytree': 0.44368712708415875, 'reg_alpha': 47.859048425450844, 'reg_lambda': 12.02752775898922}. Best is trial 290 with value: 0.39243341529400166.[0m
[32m[I 2022-07-06 12:47:59,091][0m Trial 322 finished with value: 0.3732800937031055 and parameters: {'sigma': 1.102143122279119, 'a': 9.875264661494873, 'strategy': 'median', 'add_indicator': True, 'max_depth': 88, 'n_estimators': 1493, 'boosting_type': 'gbdt', 'num_leaves': 405, 'learning_rate': 0.004455459748276485, 'min_split_gain': 0.7779549327014521, 'min_child_samples': 666, 'subsample': 0.8745763938176879, 'subsample_freq': 85, 'colsample_bytree': 0.4010446403167997, 'reg_alpha': 54.5737116250514, 'reg_lambda': 15.99182682630742}. Best is trial 290 with value: 0.39243341529400166.[0m
[32m[I 2022-07-06 12:48:40,371][0m Trial 323 finished with value: 0.37051321962142564 and parameters: {'sigma': 0.3528434086761527, 'a': 10.9345299384032, 'strategy': 'median', 'add_indicator': True, 'max_depth': 82, 'n_estimators': 645, 'boosting_type': 'gbdt', 'num_leaves': 610, 'learning_rate': 0.006618326724308233, 'min_split_gain': 1.4341068603558997, 'min_child_samples': 550, 'subsample': 0.8063270639380983, 'subsample_freq': 644, 'colsample_bytree': 0.4278215454368184, 'reg_alpha': 45.56182083856968, 'reg_lambda': 9.471116322206207}. Best is trial 290 with value: 0.39243341529400166.[0m
[32m[I 2022-07-06 12:49:33,387][0m Trial 324 finished with value: 0.37026250229201535 and parameters: {'sigma': 0.014461162652025834, 'a': 10.451116582430915, 'strategy': 'median', 'add_indicator': True, 'max_depth': 86, 'n_estimators': 922, 'boosting_type': 'gbdt', 'num_leaves': 269, 'learning_rate': 0.002400606891188269, 'min_split_gain': 1.219007177420973, 'min_child_samples': 600, 'subsample': 0.8417378411490646, 'subsample_freq': 920, 'colsample_bytree': 0.38439836215140216, 'reg_alpha': 42.42433126738549, 'reg_lambda': 19.52367427541029}. Best is trial 290 with value: 0.39243341529400166.[0m
[32m[I 2022-07-06 12:50:05,260][0m Trial 325 finished with value: 0.35962647773620526 and parameters: {'sigma': 0.7307155268433974, 'a': 11.433227615693706, 'strategy': 'median', 'add_indicator': True, 'max_depth': 85, 'n_estimators': 551, 'boosting_type': 'gbdt', 'num_leaves': 338, 'learning_rate': 0.004029123848819247, 'min_split_gain': 0.9457102480114898, 'min_child_samples': 813, 'subsample': 0.766504817922709, 'subsample_freq': 550, 'colsample_bytree': 0.4574593741580699, 'reg_alpha': 51.56962057030041, 'reg_lambda': 13.361933685101036}. Best is trial 290 with value: 0.39243341529400166.[0m
[32m[I 2022-07-06 12:51:01,239][0m Trial 326 finished with value: 0.3769013978376403 and parameters: {'sigma': 1.366024873186257, 'a': 10.98962977158635, 'strategy': 'median', 'add_indicator': True, 'max_depth': 89, 'n_estimators': 1482, 'boosting_type': 'gbdt', 'num_leaves': 466, 'learning_rate': 0.005397099398878901, 'min_split_gain': 0.4891376816408658, 'min_child_samples': 698, 'subsample': 0.9146622592606454, 'subsample_freq': 1469, 'colsample_bytree': 0.35863304366746923, 'reg_alpha': 49.309298457008346, 'reg_lambda': 16.986114824829883}. Best is trial 290 with value: 0.39243341529400166.[0m
