[32m[I 2022-07-06 14:55:34,731][0m Trial 471 finished with value: 0.3714048877745819 and parameters: {'sigma': 1.2327367827192468, 'a': 11.312649789655811, 'strategy': 'median', 'add_indicator': True, 'max_depth': 84, 'n_estimators': 1090, 'boosting_type': 'gbdt', 'num_leaves': 325, 'learning_rate': 0.005860837265345893, 'min_split_gain': 1.296904345477139, 'min_child_samples': 450, 'subsample': 0.7683965967639086, 'subsample_freq': 464, 'colsample_bytree': 0.3431850165235555, 'reg_alpha': 47.38151827809299, 'reg_lambda': 9.58965468295268}. Best is trial 290 with value: 0.39243341529400166.[0m
[32m[I 2022-07-06 14:56:26,791][0m Trial 472 finished with value: 0.37337066231786403 and parameters: {'sigma': 0.6641397317629189, 'a': 11.798812827249547, 'strategy': 'median', 'add_indicator': True, 'max_depth': 81, 'n_estimators': 756, 'boosting_type': 'gbdt', 'num_leaves': 422, 'learning_rate': 0.008166848324660593, 'min_split_gain': 0.9967106879790141, 'min_child_samples': 647, 'subsample': 0.9449534281076813, 'subsample_freq': 440, 'colsample_bytree': 0.39812837612595126, 'reg_alpha': 55.62034783252807, 'reg_lambda': 19.62239664549746}. Best is trial 290 with value: 0.39243341529400166.[0m
[32m[I 2022-07-06 14:57:49,986][0m Trial 473 finished with value: 0.37681952176811145 and parameters: {'sigma': 0.37617089668306014, 'a': 10.556041056032491, 'strategy': 'median', 'add_indicator': True, 'max_depth': 92, 'n_estimators': 1484, 'boosting_type': 'gbdt', 'num_leaves': 508, 'learning_rate': 0.00470794107804782, 'min_split_gain': 1.5210850164543457, 'min_child_samples': 817, 'subsample': 0.8314408076181137, 'subsample_freq': 1219, 'colsample_bytree': 0.3662676778142468, 'reg_alpha': 50.64530314286559, 'reg_lambda': 13.853886960916874}. Best is trial 290 with value: 0.39243341529400166.[0m
[32m[I 2022-07-06 14:58:21,588][0m Trial 474 finished with value: 0.354366722830415 and parameters: {'sigma': 0.9117779124132419, 'a': 11.013800749187027, 'strategy': 'median', 'add_indicator': True, 'max_depth': 87, 'n_estimators': 287, 'boosting_type': 'gbdt', 'num_leaves': 352, 'learning_rate': 0.0033950144370144954, 'min_split_gain': 0.5518165896267809, 'min_child_samples': 611, 'subsample': 0.7962419036809274, 'subsample_freq': 286, 'colsample_bytree': 0.41550338180284896, 'reg_alpha': 43.20720692357444, 'reg_lambda': 16.316468288950453}. Best is trial 290 with value: 0.39243341529400166.[0m
[32m[I 2022-07-06 14:59:38,226][0m Trial 475 finished with value: 0.3848238735219853 and parameters: {'sigma': 0.00491044613168376, 'a': 12.323765754039732, 'strategy': 'median', 'add_indicator': True, 'max_depth': 83, 'n_estimators': 1212, 'boosting_type': 'gbdt', 'num_leaves': 256, 'learning_rate': 0.007034850017670211, 'min_split_gain': 0.8119554313356194, 'min_child_samples': 386, 'subsample': 0.7242046167792482, 'subsample_freq': 1036, 'colsample_bytree': 0.38558257021328524, 'reg_alpha': 48.93611152287209, 'reg_lambda': 11.571784698014572}. Best is trial 290 with value: 0.39243341529400166.[0m
[32m[I 2022-07-06 15:00:07,017][0m Trial 476 finished with value: 0.36188379974620893 and parameters: {'sigma': 1.5992686826602729, 'a': 9.619086611721432, 'strategy': 'median', 'add_indicator': True, 'max_depth': 86, 'n_estimators': 396, 'boosting_type': 'gbdt', 'num_leaves': 190, 'learning_rate': 0.0056442802488604615, 'min_split_gain': 1.1422590462378308, 'min_child_samples': 562, 'subsample': 0.8791312608075257, 'subsample_freq': 54, 'colsample_bytree': 0.42339752859216423, 'reg_alpha': 46.41006321178835, 'reg_lambda': 13.470114084299562}. Best is trial 290 with value: 0.39243341529400166.[0m
[32m[I 2022-07-06 15:01:06,943][0m Trial 477 finished with value: 0.3705426011639865 and parameters: {'sigma': 0.44894440879645503, 'a': 11.505164735800916, 'strategy': 'median', 'add_indicator': True, 'max_depth': 89, 'n_estimators': 1007, 'boosting_type': 'gbdt', 'num_leaves': 305, 'learning_rate': 0.0043589723692468935, 'min_split_gain': 0.8761263677144061, 'min_child_samples': 699, 'subsample': 0.8541143746429772, 'subsample_freq': 868, 'colsample_bytree': 0.4780604545172256, 'reg_alpha': 52.21945697919623, 'reg_lambda': 5.754838099851711}. Best is trial 290 with value: 0.39243341529400166.[0m
[32m[I 2022-07-06 15:01:58,501][0m Trial 478 finished with value: 0.3759750192600144 and parameters: {'sigma': 0.3698513553682673, 'a': 10.390351927182682, 'strategy': 'median', 'add_indicator': True, 'max_depth': 84, 'n_estimators': 708, 'boosting_type': 'gbdt', 'num_leaves': 404, 'learning_rate': 0.00986123200063619, 'min_split_gain': 1.3405242109379998, 'min_child_samples': 965, 'subsample': 0.8154467075187777, 'subsample_freq': 510, 'colsample_bytree': 0.3956255329261515, 'reg_alpha': 45.07339602331315, 'reg_lambda': 15.629404511063925}. Best is trial 290 with value: 0.39243341529400166.[0m
[32m[I 2022-07-06 15:03:03,482][0m Trial 479 finished with value: 0.38382462233544073 and parameters: {'sigma': 0.005850103668420523, 'a': 10.93586965703611, 'strategy': 'median', 'add_indicator': True, 'max_depth': 81, 'n_estimators': 1478, 'boosting_type': 'gbdt', 'num_leaves': 221, 'learning_rate': 0.007135079285218941, 'min_split_gain': 1.0426576482928611, 'min_child_samples': 505, 'subsample': 0.7828522574041592, 'subsample_freq': 991, 'colsample_bytree': 0.44110290016743686, 'reg_alpha': 54.17666253558923, 'reg_lambda': 11.236025430789175}. Best is trial 290 with value: 0.39243341529400166.[0m
[32m[I 2022-07-06 15:04:22,454][0m Trial 480 finished with value: 0.3761998308442407 and parameters: {'sigma': 1.0022270597664755, 'a': 11.931638562253694, 'strategy': 'median', 'add_indicator': True, 'max_depth': 86, 'n_estimators': 1487, 'boosting_type': 'gbdt', 'num_leaves': 728, 'learning_rate': 0.005597633274532711, 'min_split_gain': 0.6048806053685668, 'min_child_samples': 581, 'subsample': 0.8317149209375077, 'subsample_freq': 1285, 'colsample_bytree': 0.35758069795009534, 'reg_alpha': 48.33685706324958, 'reg_lambda': 8.692776342236654}. Best is trial 290 with value: 0.39243341529400166.[0m
[32m[I 2022-07-06 15:05:15,067][0m Trial 481 finished with value: 0.3632076466738501 and parameters: {'sigma': 0.6859427264243784, 'a': 9.908516243521591, 'strategy': 'median', 'add_indicator': True, 'max_depth': 91, 'n_estimators': 987, 'boosting_type': 'gbdt', 'num_leaves': 292, 'learning_rate': 0.003054805890481744, 'min_split_gain': 0.7762445994834971, 'min_child_samples': 717, 'subsample': 0.7541285932920534, 'subsample_freq': 883, 'colsample_bytree': 0.40522962980397276, 'reg_alpha': 50.688368341382926, 'reg_lambda': 18.667876731397815}. Best is trial 290 with value: 0.39243341529400166.[0m
[32m[I 2022-07-06 15:06:07,748][0m Trial 482 finished with value: 0.37273819262588836 and parameters: {'sigma': 0.2980079847295234, 'a': 11.226309480876441, 'strategy': 'median', 'add_indicator': True, 'max_depth': 83, 'n_estimators': 1121, 'boosting_type': 'gbdt', 'num_leaves': 495, 'learning_rate': 0.00405939901640112, 'min_split_gain': 0.32872504045872497, 'min_child_samples': 649, 'subsample': 0.7949342684823375, 'subsample_freq': 859, 'colsample_bytree': 0.30204978933281335, 'reg_alpha': 46.99687629243454, 'reg_lambda': 14.499187456245206}. Best is trial 290 with value: 0.39243341529400166.[0m
[32m[I 2022-07-06 15:06:47,650][0m Trial 483 finished with value: 0.36210289939348245 and parameters: {'sigma': 0.6937159549644141, 'a': 10.718176311886424, 'strategy': 'median', 'add_indicator': True, 'max_depth': 88, 'n_estimators': 425, 'boosting_type': 'gbdt', 'num_leaves': 368, 'learning_rate': 0.0052885096913569815, 'min_split_gain': 1.1110814831089115, 'min_child_samples': 790, 'subsample': 0.813323914975872, 'subsample_freq': 146, 'colsample_bytree': 0.3746960921870141, 'reg_alpha': 43.73013193395975, 'reg_lambda': 16.798323319646244}. Best is trial 290 with value: 0.39243341529400166.[0m
[32m[I 2022-07-06 15:07:55,975][0m Trial 484 finished with value: 0.3765067441470533 and parameters: {'sigma': 1.2036532573791503, 'a': 11.616037555236998, 'strategy': 'median', 'add_indicator': True, 'max_depth': 85, 'n_estimators': 1412, 'boosting_type': 'gbdt', 'num_leaves': 253, 'learning_rate': 0.008383474358126126, 'min_split_gain': 0.9308319886763703, 'min_child_samples': 528, 'subsample': 0.7655548963752117, 'subsample_freq': 1085, 'colsample_bytree': 0.42823110978627005, 'reg_alpha': 58.70810084348892, 'reg_lambda': 21.198955786602653}. Best is trial 290 with value: 0.39243341529400166.[0m
[32m[I 2022-07-06 15:08:37,977][0m Trial 485 finished with value: 0.36877983419560456 and parameters: {'sigma': 0.3393136353030485, 'a': 10.302200031210903, 'strategy': 'median', 'add_indicator': True, 'max_depth': 79, 'n_estimators': 526, 'boosting_type': 'gbdt', 'num_leaves': 146, 'learning_rate': 0.006429807507224897, 'min_split_gain': 1.4144270571181403, 'min_child_samples': 465, 'subsample': 0.9126419392202818, 'subsample_freq': 514, 'colsample_bytree': 0.33013401151696947, 'reg_alpha': 52.45606692361126, 'reg_lambda': 12.5872600813269}. Best is trial 290 with value: 0.39243341529400166.[0m
[32m[I 2022-07-06 15:08:57,878][0m Trial 486 finished with value: 0.349970445944507 and parameters: {'sigma': 0.3404031897935651, 'a': 11.22855156053328, 'strategy': 'median', 'add_indicator': True, 'max_depth': 82, 'n_estimators': 73, 'boosting_type': 'gbdt', 'num_leaves': 310, 'learning_rate': 0.002407328135909349, 'min_split_gain': 0.5176109988303361, 'min_child_samples': 591, 'subsample': 0.8539916372203882, 'subsample_freq': 6, 'colsample_bytree': 0.3948796598733948, 'reg_alpha': 56.635955816897386, 'reg_lambda': 10.471946230302768}. Best is trial 290 with value: 0.39243341529400166.[0m
[32m[I 2022-07-06 15:09:55,825][0m Trial 487 finished with value: 0.3698098802293924 and parameters: {'sigma': 0.9256852832745677, 'a': 10.741574719640402, 'strategy': 'median', 'add_indicator': True, 'max_depth': 88, 'n_estimators': 1344, 'boosting_type': 'gbdt', 'num_leaves': 445, 'learning_rate': 0.0037709051109458334, 'min_split_gain': 0.7650601957732069, 'min_child_samples': 678, 'subsample': 0.8260265717647263, 'subsample_freq': 1318, 'colsample_bytree': 0.45713440961492086, 'reg_alpha': 49.069641162590095, 'reg_lambda': 14.238487641643218}. Best is trial 290 with value: 0.39243341529400166.[0m
[32m[I 2022-07-06 15:10:25,671][0m Trial 488 finished with value: 0.35703644368896575 and parameters: {'sigma': 0.5991932941975542, 'a': 11.685045275985493, 'strategy': 'median', 'add_indicator': True, 'max_depth': 86, 'n_estimators': 275, 'boosting_type': 'gbdt', 'num_leaves': 372, 'learning_rate': 0.005006315120380333, 'min_split_gain': 1.229536023131112, 'min_child_samples': 864, 'subsample': 0.7824306507383065, 'subsample_freq': 246, 'colsample_bytree': 0.4137483715624031, 'reg_alpha': 41.77880920093095, 'reg_lambda': 17.592095959537364}. Best is trial 290 with value: 0.39243341529400166.[0m
[32m[I 2022-07-06 15:11:36,752][0m Trial 489 finished with value: 0.3856845496250158 and parameters: {'sigma': 0.015470269922456585, 'a': 12.147568297839637, 'strategy': 'median', 'add_indicator': True, 'max_depth': 90, 'n_estimators': 1136, 'boosting_type': 'gbdt', 'num_leaves': 212, 'learning_rate': 0.007295534445224514, 'min_split_gain': 1.024346560040852, 'min_child_samples': 732, 'subsample': 0.8026079633712118, 'subsample_freq': 189, 'colsample_bytree': 0.37891714072035054, 'reg_alpha': 50.8314960132512, 'reg_lambda': 11.884383771984012}. Best is trial 290 with value: 0.39243341529400166.[0m
[32m[I 2022-07-06 15:12:36,765][0m Trial 490 finished with value: 0.3724879734439322 and parameters: {'sigma': 0.33005478728753457, 'a': 8.856492826015185, 'strategy': 'median', 'add_indicator': True, 'max_depth': 84, 'n_estimators': 1453, 'boosting_type': 'gbdt', 'num_leaves': 546, 'learning_rate': 0.003145515548725325, 'min_split_gain': 1.600890055187052, 'min_child_samples': 646, 'subsample': 0.8931500714658505, 'subsample_freq': 1407, 'colsample_bytree': 0.4328754029710054, 'reg_alpha': 45.70124070398094, 'reg_lambda': 15.888578718250223}. Best is trial 290 with value: 0.39243341529400166.[0m
[32m[I 2022-07-06 15:13:29,545][0m Trial 491 finished with value: 0.37898380650093283 and parameters: {'sigma': 1.4814061393342806, 'a': 11.042299599864677, 'strategy': 'median', 'add_indicator': True, 'max_depth': 81, 'n_estimators': 1259, 'boosting_type': 'gbdt', 'num_leaves': 276, 'learning_rate': 0.00989451408031363, 'min_split_gain': 0.6835803543151069, 'min_child_samples': 551, 'subsample': 0.844638812239922, 'subsample_freq': 247, 'colsample_bytree': 0.3491791124745215, 'reg_alpha': 54.45168457636198, 'reg_lambda': 2.080519255619926}. Best is trial 290 with value: 0.39243341529400166.[0m
[32m[I 2022-07-06 15:14:02,947][0m Trial 492 finished with value: 0.3660463672680505 and parameters: {'sigma': 0.024690068489901625, 'a': 10.125129997466148, 'strategy': 'median', 'add_indicator': True, 'max_depth': 87, 'n_estimators': 228, 'boosting_type': 'gbdt', 'num_leaves': 332, 'learning_rate': 0.004507628616380622, 'min_split_gain': 0.9121880098423508, 'min_child_samples': 493, 'subsample': 0.8159045342936826, 'subsample_freq': 227, 'colsample_bytree': 0.400768237630891, 'reg_alpha': 48.23171859555115, 'reg_lambda': 12.81482147450076}. Best is trial 290 with value: 0.39243341529400166.[0m
[32m[I 2022-07-06 15:15:12,994][0m Trial 493 finished with value: 0.37641566694062184 and parameters: {'sigma': 0.7269995578424931, 'a': 10.538388710271603, 'strategy': 'median', 'add_indicator': True, 'max_depth': 84, 'n_estimators': 1373, 'boosting_type': 'gbdt', 'num_leaves': 432, 'learning_rate': 0.0062296860741215725, 'min_split_gain': 1.2074121797580455, 'min_child_samples': 603, 'subsample': 0.8698187616904343, 'subsample_freq': 219, 'colsample_bytree': 0.3662839501608409, 'reg_alpha': 52.88346443267165, 'reg_lambda': 8.094289891597652}. Best is trial 290 with value: 0.39243341529400166.[0m
[32m[I 2022-07-06 15:16:25,342][0m Trial 494 finished with value: 0.37428408925296686 and parameters: {'sigma': 0.3557541363989585, 'a': 11.379929780415043, 'strategy': 'median', 'add_indicator': True, 'max_depth': 94, 'n_estimators': 1460, 'boosting_type': 'gbdt', 'num_leaves': 182, 'learning_rate': 0.003915936879936674, 'min_split_gain': 0.4471283026500992, 'min_child_samples': 783, 'subsample': 0.7811010072872618, 'subsample_freq': 962, 'colsample_bytree': 0.42093595586016713, 'reg_alpha': 50.31013875854279, 'reg_lambda': 15.051893438014206}. Best is trial 290 with value: 0.39243341529400166.[0m
[32m[I 2022-07-06 15:17:17,833][0m Trial 495 finished with value: 0.374006902012782 and parameters: {'sigma': 0.992755194264382, 'a': 9.284724371830833, 'strategy': 'median', 'add_indicator': True, 'max_depth': 86, 'n_estimators': 1231, 'boosting_type': 'gbdt', 'num_leaves': 229, 'learning_rate': 0.005347679682073076, 'min_split_gain': 0.8170257629551554, 'min_child_samples': 687, 'subsample': 0.8345140473442509, 'subsample_freq': 744, 'colsample_bytree': 0.44775703516965987, 'reg_alpha': 44.54234381798805, 'reg_lambda': 19.497012392152623}. Best is trial 290 with value: 0.39243341529400166.[0m
[32m[I 2022-07-06 15:18:22,279][0m Trial 496 finished with value: 0.3759413788340485 and parameters: {'sigma': 11.00005331859733, 'a': 10.795191661822088, 'strategy': 'median', 'add_indicator': True, 'max_depth': 89, 'n_estimators': 1310, 'boosting_type': 'gbdt', 'num_leaves': 347, 'learning_rate': 0.007408941703334546, 'min_split_gain': 1.0339522204800358, 'min_child_samples': 911, 'subsample': 0.740522414311741, 'subsample_freq': 1251, 'colsample_bytree': 0.38712567411665577, 'reg_alpha': 47.6802575793939, 'reg_lambda': 10.026984849556218}. Best is trial 290 with value: 0.39243341529400166.[0m
[32m[I 2022-07-06 15:18:59,872][0m Trial 497 finished with value: 0.3763973042625086 and parameters: {'sigma': 0.028863451364768658, 'a': 12.823999149282963, 'strategy': 'median', 'add_indicator': True, 'max_depth': 82, 'n_estimators': 1437, 'boosting_type': 'gbdt', 'num_leaves': 268, 'learning_rate': 0.004585602691555567, 'min_split_gain': 1.4007911832027848, 'min_child_samples': 573, 'subsample': 0.3156018771616801, 'subsample_freq': 489, 'colsample_bytree': 0.4064210212147737, 'reg_alpha': 39.82547039686457, 'reg_lambda': 17.812533018101}. Best is trial 290 with value: 0.39243341529400166.[0m
[32m[I 2022-07-06 15:19:32,567][0m Trial 498 finished with value: 0.3573733786993689 and parameters: {'sigma': 0.6171669894405022, 'a': 11.112943517279714, 'strategy': 'median', 'add_indicator': True, 'max_depth': 85, 'n_estimators': 474, 'boosting_type': 'gbdt', 'num_leaves': 415, 'learning_rate': 0.003424983677725258, 'min_split_gain': 0.1803176549877411, 'min_child_samples': 624, 'subsample': 0.7950426713848876, 'subsample_freq': 467, 'colsample_bytree': 0.4968422305448371, 'reg_alpha': 49.365583795402465, 'reg_lambda': 13.348241929737057}. Best is trial 290 with value: 0.39243341529400166.[0m
[32m[I 2022-07-06 15:20:41,732][0m Trial 499 finished with value: 0.38245339643403686 and parameters: {'sigma': 0.0007046624498881007, 'a': 11.765610239564264, 'strategy': 'median', 'add_indicator': True, 'max_depth': 77, 'n_estimators': 1169, 'boosting_type': 'gbdt', 'num_leaves': 595, 'learning_rate': 0.005719980960919135, 'min_split_gain': 0.6727069046596086, 'min_child_samples': 515, 'subsample': 0.7704932575014907, 'subsample_freq': 1151, 'colsample_bytree': 0.3761233717210947, 'reg_alpha': 46.209837890886206, 'reg_lambda': 15.335268665476438}. Best is trial 290 with value: 0.39243341529400166.[0m
[32m[I 2022-07-06 15:21:03,697][0m Trial 500 finished with value: 0.3510614118453337 and parameters: {'sigma': 0.6514273570138323, 'a': 10.075817215150217, 'strategy': 'median', 'add_indicator': True, 'max_depth': 83, 'n_estimators': 180, 'boosting_type': 'gbdt', 'num_leaves': 314, 'learning_rate': 0.0027528692997377535, 'min_split_gain': 1.1571825201767973, 'min_child_samples': 680, 'subsample': 0.8238865740811079, 'subsample_freq': 95, 'colsample_bytree': 0.42454524270271693, 'reg_alpha': 55.04899691750317, 'reg_lambda': 7.575673139014523}. Best is trial 290 with value: 0.39243341529400166.[0m
[32m[I 2022-07-06 15:22:02,256][0m Trial 501 finished with value: 0.37256144634680916 and parameters: {'sigma': 1.2658403657482773, 'a': 11.385546060595024, 'strategy': 'median', 'add_indicator': True, 'max_depth': 88, 'n_estimators': 898, 'boosting_type': 'gbdt', 'num_leaves': 368, 'learning_rate': 0.0077135945946325305, 'min_split_gain': 0.00017520332724729748, 'min_child_samples': 759, 'subsample': 0.8048804583812356, 'subsample_freq': 880, 'colsample_bytree': 0.3444085267663144, 'reg_alpha': 51.92513232140853, 'reg_lambda': 30.62756052272799}. Best is trial 290 with value: 0.39243341529400166.[0m
[32m[I 2022-07-06 15:23:11,692][0m Trial 502 finished with value: 0.37289040411979996 and parameters: {'sigma': 2.09099273122307, 'a': 10.522165183925939, 'strategy': 'median', 'add_indicator': True, 'max_depth': 80, 'n_estimators': 1187, 'boosting_type': 'gbdt', 'num_leaves': 128, 'learning_rate': 0.004346761319367519, 'min_split_gain': 0.9189824333988386, 'min_child_samples': 430, 'subsample': 0.863310834156297, 'subsample_freq': 686, 'colsample_bytree': 0.27934287893087717, 'reg_alpha': 43.100244587069376, 'reg_lambda': 11.456260318975927}. Best is trial 290 with value: 0.39243341529400166.[0m
[32m[I 2022-07-06 15:23:43,511][0m Trial 503 finished with value: 0.37561841000457846 and parameters: {'sigma': 0.006467517624442559, 'a': 12.183458517997975, 'strategy': 'median', 'add_indicator': True, 'max_depth': 91, 'n_estimators': 500, 'boosting_type': 'gbdt', 'num_leaves': 232, 'learning_rate': 0.006176644382886134, 'min_split_gain': 0.5220456739775906, 'min_child_samples': 553, 'subsample': 0.7889469142750526, 'subsample_freq': 390, 'colsample_bytree': 0.39531645391642445, 'reg_alpha': 37.129625317828705, 'reg_lambda': 16.732122003178425}. Best is trial 290 with value: 0.39243341529400166.[0m
[32m[I 2022-07-06 15:24:16,017][0m Trial 504 finished with value: 0.3653921087874028 and parameters: {'sigma': 0.3932704306179515, 'a': 10.940351835925519, 'strategy': 'median', 'add_indicator': True, 'max_depth': 85, 'n_estimators': 404, 'boosting_type': 'gbdt', 'num_leaves': 480, 'learning_rate': 0.008346355223072185, 'min_split_gain': 1.2626396537644453, 'min_child_samples': 644, 'subsample': 0.7590663099613413, 'subsample_freq': 377, 'colsample_bytree': 0.45714535936568834, 'reg_alpha': 49.40546518725396, 'reg_lambda': 22.374524889934566}. Best is trial 290 with value: 0.39243341529400166.[0m
[32m[I 2022-07-06 15:26:01,987][0m Trial 505 finished with value: 0.3702844087494259 and parameters: {'sigma': 0.9492987397354518, 'a': 11.545007865681185, 'strategy': 'median', 'add_indicator': True, 'max_depth': 87, 'n_estimators': 1491, 'boosting_type': 'gbdt', 'num_leaves': 279, 'learning_rate': 0.0035935065241610963, 'min_split_gain': 0.7353139111167786, 'min_child_samples': 838, 'subsample': 0.8165921720535512, 'subsample_freq': 1086, 'colsample_bytree': 0.43392000153562627, 'reg_alpha': 46.47795929837073, 'reg_lambda': 13.384492698441402}. Best is trial 290 with value: 0.39243341529400166.[0m
[32m[I 2022-07-06 15:27:29,348][0m Trial 506 finished with value: 0.3770579674349446 and parameters: {'sigma': 0.3309270441736543, 'a': 9.848794455134598, 'strategy': 'median', 'add_indicator': True, 'max_depth': 83, 'n_estimators': 1388, 'boosting_type': 'gbdt', 'num_leaves': 188, 'learning_rate': 0.005049320894990749, 'min_split_gain': 1.0173841671726513, 'min_child_samples': 1079, 'subsample': 0.8461463137598549, 'subsample_freq': 1384, 'colsample_bytree': 0.40833678875838103, 'reg_alpha': 51.82351547398134, 'reg_lambda': 9.25198665758559}. Best is trial 290 with value: 0.39243341529400166.[0m
