[32m[I 2022-07-06 09:57:35,854][0m Trial 253 finished with value: 0.388511565457996 and parameters: {'sigma': 0.007703549592302655, 'a': 10.407817412064315, 'strategy': 'median', 'add_indicator': True, 'max_depth': 86, 'n_estimators': 2757, 'boosting_type': 'gbdt', 'num_leaves': 291, 'learning_rate': 0.0038154331238340424, 'min_split_gain': 1.1259465535755153, 'min_child_samples': 666, 'subsample': 0.8669030874095385, 'subsample_freq': 2510, 'colsample_bytree': 0.4442229519643013, 'reg_alpha': 47.727784156246756, 'reg_lambda': 17.37755926712604}. Best is trial 234 with value: 0.39041325693788764.[0m
[32m[I 2022-07-06 10:01:43,400][0m Trial 254 finished with value: 0.3779946750554133 and parameters: {'sigma': 0.8483735837323945, 'a': 11.525479721671635, 'strategy': 'median', 'add_indicator': True, 'max_depth': 89, 'n_estimators': 2899, 'boosting_type': 'gbdt', 'num_leaves': 176, 'learning_rate': 0.0028067109248614028, 'min_split_gain': 0.9771937142733048, 'min_child_samples': 606, 'subsample': 0.7784822126217763, 'subsample_freq': 2359, 'colsample_bytree': 0.4023237747885161, 'reg_alpha': 52.112061182565085, 'reg_lambda': 15.336777530910002}. Best is trial 234 with value: 0.39041325693788764.[0m
[32m[I 2022-07-06 10:04:51,490][0m Trial 255 finished with value: 0.37914462584870984 and parameters: {'sigma': 1.084018050076857, 'a': 12.454973693495926, 'strategy': 'median', 'add_indicator': True, 'max_depth': 85, 'n_estimators': 2817, 'boosting_type': 'gbdt', 'num_leaves': 351, 'learning_rate': 0.005271932902989709, 'min_split_gain': 1.3127609429114402, 'min_child_samples': 718, 'subsample': 0.8188108966731872, 'subsample_freq': 2412, 'colsample_bytree': 0.3743098923217438, 'reg_alpha': 49.25233287899995, 'reg_lambda': 20.846079208518642}. Best is trial 234 with value: 0.39041325693788764.[0m
[32m[I 2022-07-06 10:08:29,336][0m Trial 256 finished with value: 0.38497041649208186 and parameters: {'sigma': 0.4791834602879078, 'a': 10.824849687088687, 'strategy': 'median', 'add_indicator': True, 'max_depth': 88, 'n_estimators': 2733, 'boosting_type': 'gbdt', 'num_leaves': 247, 'learning_rate': 0.003965687451706598, 'min_split_gain': 0.6273094939407589, 'min_child_samples': 475, 'subsample': 0.8331379402815443, 'subsample_freq': 2268, 'colsample_bytree': 0.4606558196798159, 'reg_alpha': 43.523491187758644, 'reg_lambda': 10.10276609331249}. Best is trial 234 with value: 0.39041325693788764.[0m
[32m[I 2022-07-06 10:11:53,731][0m Trial 257 finished with value: 0.389748004347885 and parameters: {'sigma': 0.015597472708190601, 'a': 11.792372252292937, 'strategy': 'median', 'add_indicator': True, 'max_depth': 83, 'n_estimators': 2873, 'boosting_type': 'gbdt', 'num_leaves': 451, 'learning_rate': 0.008481671661844242, 'min_split_gain': 0.7898756224871634, 'min_child_samples': 557, 'subsample': 0.8056396075294832, 'subsample_freq': 2226, 'colsample_bytree': 0.42121553433070846, 'reg_alpha': 46.79602185825331, 'reg_lambda': 12.258367202770216}. Best is trial 234 with value: 0.39041325693788764.[0m
[32m[I 2022-07-06 10:14:37,542][0m Trial 258 finished with value: 0.381894897735955 and parameters: {'sigma': 0.6240924629773933, 'a': 11.937760915485326, 'strategy': 'median', 'add_indicator': True, 'max_depth': 81, 'n_estimators': 2878, 'boosting_type': 'gbdt', 'num_leaves': 459, 'learning_rate': 0.008313934029353608, 'min_split_gain': 0.7870848948569985, 'min_child_samples': 549, 'subsample': 0.7833456114694596, 'subsample_freq': 2209, 'colsample_bytree': 0.3472231317701238, 'reg_alpha': 46.56355368568076, 'reg_lambda': 11.862631976948382}. Best is trial 234 with value: 0.39041325693788764.[0m
[32m[I 2022-07-06 10:17:57,329][0m Trial 259 finished with value: 0.3860703095485593 and parameters: {'sigma': 0.3855461163612474, 'a': 11.582565766990419, 'strategy': 'median', 'add_indicator': True, 'max_depth': 86, 'n_estimators': 2950, 'boosting_type': 'gbdt', 'num_leaves': 550, 'learning_rate': 0.006626586387413983, 'min_split_gain': 0.4485473695636101, 'min_child_samples': 510, 'subsample': 0.7996028862805039, 'subsample_freq': 2423, 'colsample_bytree': 0.4306821735751165, 'reg_alpha': 51.454772294427066, 'reg_lambda': 16.312213331980992}. Best is trial 234 with value: 0.39041325693788764.[0m
[32m[I 2022-07-06 10:21:04,288][0m Trial 260 finished with value: 0.3805600215725547 and parameters: {'sigma': 1.1622890761097386, 'a': 10.867646088858454, 'strategy': 'median', 'add_indicator': True, 'max_depth': 78, 'n_estimators': 2862, 'boosting_type': 'gbdt', 'num_leaves': 291, 'learning_rate': 0.008376236735988698, 'min_split_gain': 0.7819706705476768, 'min_child_samples': 846, 'subsample': 0.8476810137081856, 'subsample_freq': 2364, 'colsample_bytree': 0.38786727708317603, 'reg_alpha': 55.65833290292805, 'reg_lambda': 14.217155612652764}. Best is trial 234 with value: 0.39041325693788764.[0m
[32m[I 2022-07-06 10:24:21,190][0m Trial 261 finished with value: 0.3886690274559831 and parameters: {'sigma': 0.00841083716457335, 'a': 10.076459489969054, 'strategy': 'median', 'add_indicator': True, 'max_depth': 90, 'n_estimators': 2689, 'boosting_type': 'gbdt', 'num_leaves': 212, 'learning_rate': 0.006307050985890214, 'min_split_gain': 1.1876577759287206, 'min_child_samples': 572, 'subsample': 0.8078354763815856, 'subsample_freq': 2266, 'colsample_bytree': 0.36920454459092383, 'reg_alpha': 45.31026351246763, 'reg_lambda': 18.664403974678663}. Best is trial 234 with value: 0.39041325693788764.[0m
[32m[I 2022-07-06 10:27:01,009][0m Trial 262 finished with value: 0.38161543413350907 and parameters: {'sigma': 0.7344558699802136, 'a': 10.508747410412282, 'strategy': 'median', 'add_indicator': True, 'max_depth': 82, 'n_estimators': 2830, 'boosting_type': 'gbdt', 'num_leaves': 411, 'learning_rate': 0.009433489135982534, 'min_split_gain': 0.8980322012038175, 'min_child_samples': 723, 'subsample': 0.7674780650595292, 'subsample_freq': 2486, 'colsample_bytree': 0.4031355862052992, 'reg_alpha': 52.889840420296764, 'reg_lambda': 11.848546210607372}. Best is trial 234 with value: 0.39041325693788764.[0m
[32m[I 2022-07-06 10:31:12,720][0m Trial 263 finished with value: 0.38394375930857094 and parameters: {'sigma': 0.2988147287416764, 'a': 11.559032124495076, 'strategy': 'median', 'add_indicator': True, 'max_depth': 92, 'n_estimators': 2995, 'boosting_type': 'gbdt', 'num_leaves': 365, 'learning_rate': 0.0031254750687317477, 'min_split_gain': 0.6065423293892409, 'min_child_samples': 657, 'subsample': 0.7855787588654055, 'subsample_freq': 2108, 'colsample_bytree': 0.4261748909816002, 'reg_alpha': 47.61043426878853, 'reg_lambda': 16.38676070110089}. Best is trial 234 with value: 0.39041325693788764.[0m
[32m[I 2022-07-06 10:35:15,908][0m Trial 264 finished with value: 0.38095075384472277 and parameters: {'sigma': 0.8061578328700283, 'a': 12.17040924944553, 'strategy': 'median', 'add_indicator': True, 'max_depth': 87, 'n_estimators': 2890, 'boosting_type': 'gbdt', 'num_leaves': 278, 'learning_rate': 0.005312698124163255, 'min_split_gain': 1.0938731552730552, 'min_child_samples': 789, 'subsample': 0.8389940942552426, 'subsample_freq': 2351, 'colsample_bytree': 0.45110430127007733, 'reg_alpha': 50.40404660545103, 'reg_lambda': 9.167929116146748}. Best is trial 234 with value: 0.39041325693788764.[0m
[32m[I 2022-07-06 10:39:07,169][0m Trial 265 finished with value: 0.3879025187151554 and parameters: {'sigma': 0.012253293795040594, 'a': 10.979269943090566, 'strategy': 'median', 'add_indicator': True, 'max_depth': 83, 'n_estimators': 2758, 'boosting_type': 'gbdt', 'num_leaves': 455, 'learning_rate': 0.0038661067029433192, 'min_split_gain': 1.4263062794759194, 'min_child_samples': 579, 'subsample': 0.8084923282816343, 'subsample_freq': 2224, 'colsample_bytree': 0.35267322933776335, 'reg_alpha': 42.79472782563349, 'reg_lambda': 14.373451089894155}. Best is trial 234 with value: 0.39041325693788764.[0m
[32m[I 2022-07-06 10:41:37,474][0m Trial 266 finished with value: 0.3842361259525323 and parameters: {'sigma': 0.42672449509056076, 'a': 11.883101296928684, 'strategy': 'median', 'add_indicator': True, 'max_depth': 85, 'n_estimators': 2785, 'boosting_type': 'gbdt', 'num_leaves': 307, 'learning_rate': 0.007116646458629625, 'min_split_gain': 0.9272767778051642, 'min_child_samples': 658, 'subsample': 0.8706402086581814, 'subsample_freq': 2401, 'colsample_bytree': 0.38993549510125314, 'reg_alpha': 47.411365572850464, 'reg_lambda': 12.459466139735158}. Best is trial 234 with value: 0.39041325693788764.[0m
[32m[I 2022-07-06 10:44:50,802][0m Trial 267 finished with value: 0.3781358724665028 and parameters: {'sigma': 1.2709525644108968, 'a': 11.365117491505051, 'strategy': 'median', 'add_indicator': True, 'max_depth': 80, 'n_estimators': 2925, 'boosting_type': 'gbdt', 'num_leaves': 215, 'learning_rate': 0.005145968397265565, 'min_split_gain': 1.1716316473464803, 'min_child_samples': 530, 'subsample': 0.7489715269058776, 'subsample_freq': 2568, 'colsample_bytree': 0.4121720799178575, 'reg_alpha': 54.345614065999044, 'reg_lambda': 16.69537508424346}. Best is trial 234 with value: 0.39041325693788764.[0m
[32m[I 2022-07-06 10:49:26,242][0m Trial 268 finished with value: 0.3859071183680018 and parameters: {'sigma': 0.42476817736575756, 'a': 10.597104949545544, 'strategy': 'median', 'add_indicator': True, 'max_depth': 89, 'n_estimators': 2705, 'boosting_type': 'gbdt', 'num_leaves': 387, 'learning_rate': 0.004016995491921329, 'min_split_gain': 0.5387291727881262, 'min_child_samples': 898, 'subsample': 0.8290695043269795, 'subsample_freq': 2308, 'colsample_bytree': 0.4744939588913927, 'reg_alpha': 49.886166203266676, 'reg_lambda': 9.529617987188594}. Best is trial 234 with value: 0.39041325693788764.[0m
[32m[I 2022-07-06 10:52:45,581][0m Trial 269 finished with value: 0.3802785517111029 and parameters: {'sigma': 0.7809207129691211, 'a': 11.074764949660565, 'strategy': 'median', 'add_indicator': True, 'max_depth': 85, 'n_estimators': 2835, 'boosting_type': 'gbdt', 'num_leaves': 168, 'learning_rate': 0.006990579633311439, 'min_split_gain': 0.7473108069554005, 'min_child_samples': 729, 'subsample': 0.7841442920083245, 'subsample_freq': 2167, 'colsample_bytree': 0.3769882860371559, 'reg_alpha': 44.754787332648355, 'reg_lambda': 14.3485476015885}. Best is trial 234 with value: 0.39041325693788764.[0m
[32m[I 2022-07-06 10:55:51,866][0m Trial 270 finished with value: 0.38361723642863754 and parameters: {'sigma': 0.36079035543091803, 'a': 9.732925178227118, 'strategy': 'median', 'add_indicator': True, 'max_depth': 83, 'n_estimators': 2617, 'boosting_type': 'gbdt', 'num_leaves': 249, 'learning_rate': 0.0057532973854955115, 'min_split_gain': 1.2926629878985214, 'min_child_samples': 601, 'subsample': 0.8075234016553547, 'subsample_freq': 2327, 'colsample_bytree': 0.42733798789200206, 'reg_alpha': 52.01993903333126, 'reg_lambda': 18.633171020410515}. Best is trial 234 with value: 0.39041325693788764.[0m
[32m[I 2022-07-06 11:01:15,850][0m Trial 271 finished with value: 0.3856066782792571 and parameters: {'sigma': 0.005953706906054568, 'a': 10.32678871751064, 'strategy': 'median', 'add_indicator': True, 'max_depth': 88, 'n_estimators': 2885, 'boosting_type': 'gbdt', 'num_leaves': 330, 'learning_rate': 0.0026467589366068966, 'min_split_gain': 0.9914464782750424, 'min_child_samples': 665, 'subsample': 0.8584257056360384, 'subsample_freq': 2436, 'colsample_bytree': 0.400170828778736, 'reg_alpha': 48.61583819484714, 'reg_lambda': 20.67827855267548}. Best is trial 234 with value: 0.39041325693788764.[0m
[32m[I 2022-07-06 11:04:05,911][0m Trial 272 finished with value: 0.38058269746656903 and parameters: {'sigma': 0.9624387043899052, 'a': 11.459064637427279, 'strategy': 'median', 'add_indicator': True, 'max_depth': 86, 'n_estimators': 2806, 'boosting_type': 'gbdt', 'num_leaves': 481, 'learning_rate': 0.00947030487777457, 'min_split_gain': 0.7091168713534362, 'min_child_samples': 473, 'subsample': 0.821970036098787, 'subsample_freq': 2260, 'colsample_bytree': 0.3518262633285154, 'reg_alpha': 53.150071504206466, 'reg_lambda': 12.157043413107056}. Best is trial 234 with value: 0.39041325693788764.[0m
[32m[I 2022-07-06 11:08:54,487][0m Trial 273 finished with value: 0.3819281502881996 and parameters: {'sigma': 1.7899255157510332, 'a': 12.547350128287636, 'strategy': 'median', 'add_indicator': True, 'max_depth': 82, 'n_estimators': 2742, 'boosting_type': 'gbdt', 'num_leaves': 299, 'learning_rate': 0.00437342481730132, 'min_split_gain': 0.4211231136491434, 'min_child_samples': 789, 'subsample': 0.7627652211377528, 'subsample_freq': 2370, 'colsample_bytree': 0.4452066696554327, 'reg_alpha': 50.791865903291836, 'reg_lambda': 14.94333314894924}. Best is trial 234 with value: 0.39041325693788764.[0m
[32m[I 2022-07-06 11:13:25,867][0m Trial 274 finished with value: 0.383329323396988 and parameters: {'sigma': 0.36861710973531153, 'a': 10.955194316682805, 'strategy': 'median', 'add_indicator': True, 'max_depth': 78, 'n_estimators': 2949, 'boosting_type': 'gbdt', 'num_leaves': 376, 'learning_rate': 0.0033854474227869033, 'min_split_gain': 1.0476642708985722, 'min_child_samples': 547, 'subsample': 0.7984949177558411, 'subsample_freq': 2204, 'colsample_bytree': 0.37826898620981764, 'reg_alpha': 45.58953930446254, 'reg_lambda': 10.786292529327156}. Best is trial 234 with value: 0.39041325693788764.[0m
[32m[I 2022-07-06 11:17:11,156][0m Trial 275 finished with value: 0.38857093685703414 and parameters: {'sigma': 0.012010815587452414, 'a': 11.815883432577687, 'strategy': 'median', 'add_indicator': True, 'max_depth': 84, 'n_estimators': 2845, 'boosting_type': 'gbdt', 'num_leaves': 228, 'learning_rate': 0.005352999056917463, 'min_split_gain': 0.8988927052977718, 'min_child_samples': 598, 'subsample': 0.8439061653893017, 'subsample_freq': 2292, 'colsample_bytree': 0.4170036786271863, 'reg_alpha': 56.201129160706515, 'reg_lambda': 13.122859346519412}. Best is trial 234 with value: 0.39041325693788764.[0m
[32m[I 2022-07-06 11:20:06,757][0m Trial 276 finished with value: 0.38029158971199956 and parameters: {'sigma': 0.674777553523041, 'a': 11.364896200452298, 'strategy': 'median', 'add_indicator': True, 'max_depth': 90, 'n_estimators': 2773, 'boosting_type': 'gbdt', 'num_leaves': 551, 'learning_rate': 0.00669520655337232, 'min_split_gain': 1.2906560976271604, 'min_child_samples': 709, 'subsample': 0.7248430465880991, 'subsample_freq': 2375, 'colsample_bytree': 0.40026888717077513, 'reg_alpha': 41.42902457968216, 'reg_lambda': 16.93910622889232}. Best is trial 234 with value: 0.39041325693788764.[0m
[32m[I 2022-07-06 11:24:19,831][0m Trial 277 finished with value: 0.3847506391241676 and parameters: {'sigma': 0.43362710189759257, 'a': 10.660305567232735, 'strategy': 'median', 'add_indicator': True, 'max_depth': 87, 'n_estimators': 2883, 'boosting_type': 'gbdt', 'num_leaves': 267, 'learning_rate': 0.004467858993303398, 'min_split_gain': 0.676144251559933, 'min_child_samples': 638, 'subsample': 0.7796892039088977, 'subsample_freq': 2453, 'colsample_bytree': 0.3641551870455268, 'reg_alpha': 47.41241392264503, 'reg_lambda': 15.117414673266715}. Best is trial 234 with value: 0.39041325693788764.[0m
[32m[I 2022-07-06 11:28:15,346][0m Trial 278 finished with value: 0.3784144622575572 and parameters: {'sigma': 1.256854272438953, 'a': 10.02081809749738, 'strategy': 'median', 'add_indicator': True, 'max_depth': 80, 'n_estimators': 2695, 'boosting_type': 'gbdt', 'num_leaves': 334, 'learning_rate': 0.0034375967823524604, 'min_split_gain': 1.4566591213527325, 'min_child_samples': 520, 'subsample': 0.8192731930493402, 'subsample_freq': 2316, 'colsample_bytree': 0.43191242886632897, 'reg_alpha': 50.163054920711645, 'reg_lambda': 10.883722908651452}. Best is trial 234 with value: 0.39041325693788764.[0m
[32m[I 2022-07-06 11:31:13,158][0m Trial 279 finished with value: 0.3815485270014497 and parameters: {'sigma': 0.7343356041990103, 'a': 12.263202158983304, 'strategy': 'median', 'add_indicator': True, 'max_depth': 85, 'n_estimators': 2804, 'boosting_type': 'gbdt', 'num_leaves': 435, 'learning_rate': 0.005687372974506617, 'min_split_gain': 0.8609186238347837, 'min_child_samples': 741, 'subsample': 0.798556423393006, 'subsample_freq': 2278, 'colsample_bytree': 0.3901305573458606, 'reg_alpha': 52.90569175190045, 'reg_lambda': 18.918891611809062}. Best is trial 234 with value: 0.39041325693788764.[0m
[32m[I 2022-07-06 11:34:09,734][0m Trial 280 finished with value: 0.38970251698508995 and parameters: {'sigma': 0.0186692149603992, 'a': 11.090704631706362, 'strategy': 'median', 'add_indicator': True, 'max_depth': 83, 'n_estimators': 2932, 'boosting_type': 'gbdt', 'num_leaves': 186, 'learning_rate': 0.009934164315105808, 'min_split_gain': 1.1262830608449292, 'min_child_samples': 573, 'subsample': 0.8856208596693432, 'subsample_freq': 2406, 'colsample_bytree': 0.41752476301289193, 'reg_alpha': 48.800926341482274, 'reg_lambda': 14.077084633902258}. Best is trial 234 with value: 0.39041325693788764.[0m
[32m[I 2022-07-06 11:38:23,098][0m Trial 281 finished with value: 0.3845415247910912 and parameters: {'sigma': 0.38682835592837994, 'a': 10.987983867768083, 'strategy': 'median', 'add_indicator': True, 'max_depth': 81, 'n_estimators': 2953, 'boosting_type': 'gbdt', 'num_leaves': 203, 'learning_rate': 0.007447429942778163, 'min_split_gain': 1.1393082252826598, 'min_child_samples': 571, 'subsample': 0.882749942839294, 'subsample_freq': 2497, 'colsample_bytree': 0.4513330982671205, 'reg_alpha': 44.137015364267015, 'reg_lambda': 13.013403064114527}. Best is trial 234 with value: 0.39041325693788764.[0m
[32m[I 2022-07-06 11:41:57,750][0m Trial 282 finished with value: 0.3893229605246808 and parameters: {'sigma': 0.008483310718748263, 'a': 10.37454455051331, 'strategy': 'median', 'add_indicator': True, 'max_depth': 83, 'n_estimators': 2919, 'boosting_type': 'gbdt', 'num_leaves': 389, 'learning_rate': 0.009134225529007747, 'min_split_gain': 1.0907144267366422, 'min_child_samples': 493, 'subsample': 0.8999237920442652, 'subsample_freq': 2392, 'colsample_bytree': 0.41912215761700994, 'reg_alpha': 54.967967205910725, 'reg_lambda': 8.832654008770245}. Best is trial 234 with value: 0.39041325693788764.[0m
[32m[I 2022-07-06 11:45:37,169][0m Trial 283 finished with value: 0.37919548782840384 and parameters: {'sigma': 1.0564966396867685, 'a': 10.354724218519126, 'strategy': 'median', 'add_indicator': True, 'max_depth': 83, 'n_estimators': 2998, 'boosting_type': 'gbdt', 'num_leaves': 405, 'learning_rate': 0.007943712117350095, 'min_split_gain': 1.3105892260684397, 'min_child_samples': 478, 'subsample': 0.9028914497727236, 'subsample_freq': 2139, 'colsample_bytree': 0.41969342458464776, 'reg_alpha': 54.79580850583558, 'reg_lambda': 8.63722055307297}. Best is trial 234 with value: 0.39041325693788764.[0m
[32m[I 2022-07-06 11:50:17,940][0m Trial 284 finished with value: 0.3865575972643412 and parameters: {'sigma': 0.38057747222552996, 'a': 10.63023209336992, 'strategy': 'median', 'add_indicator': True, 'max_depth': 83, 'n_estimators': 2910, 'boosting_type': 'gbdt', 'num_leaves': 574, 'learning_rate': 0.00462710032890809, 'min_split_gain': 0.6617619756345774, 'min_child_samples': 506, 'subsample': 0.8646006750171096, 'subsample_freq': 2223, 'colsample_bytree': 0.4393349250803171, 'reg_alpha': 46.83920501139903, 'reg_lambda': 10.227831976075874}. Best is trial 234 with value: 0.39041325693788764.[0m
[32m[I 2022-07-06 11:53:28,536][0m Trial 285 finished with value: 0.3785956190410422 and parameters: {'sigma': 0.7336936888744158, 'a': 11.365240521560422, 'strategy': 'median', 'add_indicator': True, 'max_depth': 80, 'n_estimators': 2907, 'boosting_type': 'gbdt', 'num_leaves': 307, 'learning_rate': 0.0025159860187846258, 'min_split_gain': 1.141057582882247, 'min_child_samples': 440, 'subsample': 0.8433425496631279, 'subsample_freq': 2425, 'colsample_bytree': 0.4671662659606247, 'reg_alpha': 49.91481067831351, 'reg_lambda': 7.411258800310933}. Best is trial 234 with value: 0.39041325693788764.[0m
[32m[I 2022-07-06 11:58:46,722][0m Trial 286 finished with value: 0.3852117940071203 and parameters: {'sigma': 0.34538913008451216, 'a': 10.153057275793579, 'strategy': 'median', 'add_indicator': True, 'max_depth': 84, 'n_estimators': 2744, 'boosting_type': 'gbdt', 'num_leaves': 166, 'learning_rate': 0.003660618777123492, 'min_split_gain': 0.4570620141880968, 'min_child_samples': 675, 'subsample': 0.8895361623850669, 'subsample_freq': 2350, 'colsample_bytree': 0.3861408952907963, 'reg_alpha': 39.83843256020684, 'reg_lambda': 11.4869625085164}. Best is trial 234 with value: 0.39041325693788764.[0m
[32m[I 2022-07-06 12:01:47,001][0m Trial 287 finished with value: 0.37837420828109913 and parameters: {'sigma': 1.6182045188490735, 'a': 11.931130016803802, 'strategy': 'median', 'add_indicator': True, 'max_depth': 82, 'n_estimators': 2871, 'boosting_type': 'gbdt', 'num_leaves': 466, 'learning_rate': 0.006613554404900236, 'min_split_gain': 1.5102234369012544, 'min_child_samples': 574, 'subsample': 0.8331142701580024, 'subsample_freq': 2556, 'colsample_bytree': 0.4145726302676595, 'reg_alpha': 51.444904552217366, 'reg_lambda': 14.893635705240865}. Best is trial 234 with value: 0.39041325693788764.[0m
[32m[I 2022-07-06 12:05:32,807][0m Trial 288 finished with value: 0.3891691554301445 and parameters: {'sigma': 0.019087959122429474, 'a': 10.813534255889383, 'strategy': 'median', 'add_indicator': True, 'max_depth': 87, 'n_estimators': 2682, 'boosting_type': 'gbdt', 'num_leaves': 377, 'learning_rate': 0.005016575787856274, 'min_split_gain': 0.9648717794469615, 'min_child_samples': 640, 'subsample': 0.7616802667371743, 'subsample_freq': 2338, 'colsample_bytree': 0.3725792206436248, 'reg_alpha': 46.264603313343514, 'reg_lambda': 13.548359768088305}. Best is trial 234 with value: 0.39041325693788764.[0m
