[32m[I 2022-07-06 04:18:26,448][0m Trial 109 finished with value: 0.2857216523357784 and parameters: {'sigma': 7.355193339952283, 'a': 8.341182075325648, 'strategy': 'mean', 'add_indicator': False, 'max_depth': 3, 'n_estimators': 783, 'boosting_type': 'rf', 'num_leaves': 2, 'learning_rate': 1.149751204495917e-07, 'min_split_gain': 2.412014575995415, 'min_child_samples': 13291, 'subsample': 0.8015371118829896, 'subsample_freq': 752, 'colsample_bytree': 0.49297550348709884, 'reg_alpha': 10.973619867750351, 'reg_lambda': 54.79594889736929}. Best is trial 106 with value: 0.37587706549111516.[0m
[32m[I 2022-07-06 04:19:58,172][0m Trial 110 finished with value: 0.2991479893903478 and parameters: {'sigma': 9.087552147425871, 'a': 16.902705946518356, 'strategy': 'median', 'add_indicator': True, 'max_depth': 39, 'n_estimators': 1186, 'boosting_type': 'dart', 'num_leaves': 10815, 'learning_rate': 0.000860036595368127, 'min_split_gain': 3.1540689574801273, 'min_child_samples': 3139, 'subsample': 0.4376031240553919, 'subsample_freq': 303, 'colsample_bytree': 0.8424628636316633, 'reg_alpha': 3.8426348962324997, 'reg_lambda': 90.17619921354235}. Best is trial 106 with value: 0.37587706549111516.[0m
[32m[I 2022-07-06 04:20:28,938][0m Trial 111 finished with value: 0.17721354799823988 and parameters: {'sigma': 9.229554677720037, 'a': 12.78030938848478, 'strategy': 'median', 'add_indicator': False, 'max_depth': 16, 'n_estimators': 2214, 'boosting_type': 'gbdt', 'num_leaves': 3, 'learning_rate': 0.00038160753400791477, 'min_split_gain': 0.7208433599867337, 'min_child_samples': 142, 'subsample': 0.01210847523488745, 'subsample_freq': 2118, 'colsample_bytree': 0.7401332758644169, 'reg_alpha': 35.32514085020642, 'reg_lambda': 29.65355812876552}. Best is trial 106 with value: 0.37587706549111516.[0m
[32m[I 2022-07-06 04:20:47,227][0m Trial 112 finished with value: 0.3188106326399099 and parameters: {'sigma': 6.994071097884693, 'a': 15.515605270505517, 'strategy': 'mean', 'add_indicator': False, 'max_depth': 28, 'n_estimators': 67, 'boosting_type': 'gbdt', 'num_leaves': 1916, 'learning_rate': 0.0001328366284837284, 'min_split_gain': 3.8193963965289592, 'min_child_samples': 279, 'subsample': 0.12138641815940643, 'subsample_freq': 42, 'colsample_bytree': 0.7768874428314101, 'reg_alpha': 64.39042535411306, 'reg_lambda': 53.030213324915835}. Best is trial 106 with value: 0.37587706549111516.[0m
[32m[I 2022-07-06 04:24:08,968][0m Trial 113 finished with value: 0.3373979701036724 and parameters: {'sigma': 0.839034049120491, 'a': 19.372926674128237, 'strategy': 'most_frequent', 'add_indicator': False, 'max_depth': 82, 'n_estimators': 1971, 'boosting_type': 'dart', 'num_leaves': 12, 'learning_rate': 7.258303421052701e-06, 'min_split_gain': 4.32076882944196, 'min_child_samples': 902, 'subsample': 0.6129395824945255, 'subsample_freq': 1859, 'colsample_bytree': 0.24828578471417992, 'reg_alpha': 12.150137630091805, 'reg_lambda': 19.747048985993732}. Best is trial 106 with value: 0.37587706549111516.[0m
[32m[I 2022-07-06 04:25:13,116][0m Trial 114 finished with value: 0.3174291783963461 and parameters: {'sigma': 17.738499134936387, 'a': 12.951635171838598, 'strategy': 'most_frequent', 'add_indicator': True, 'max_depth': 76, 'n_estimators': 1384, 'boosting_type': 'rf', 'num_leaves': 670, 'learning_rate': 7.711588505891457e-07, 'min_split_gain': 5.450269188969383, 'min_child_samples': 13890, 'subsample': 0.9373880664971189, 'subsample_freq': 60, 'colsample_bytree': 0.17316666757214277, 'reg_alpha': 13.172877345456191, 'reg_lambda': 72.59799099852955}. Best is trial 106 with value: 0.37587706549111516.[0m
[32m[I 2022-07-06 04:27:25,472][0m Trial 115 finished with value: 0.3235891985504725 and parameters: {'sigma': 16.3557084192856, 'a': 4.34887618958237, 'strategy': 'median', 'add_indicator': True, 'max_depth': 31, 'n_estimators': 1697, 'boosting_type': 'gbdt', 'num_leaves': 1777, 'learning_rate': 6.31477927241335e-07, 'min_split_gain': 4.6155747441978985, 'min_child_samples': 104, 'subsample': 0.24667886452162302, 'subsample_freq': 1233, 'colsample_bytree': 0.9918918518358698, 'reg_alpha': 9.917809958721591, 'reg_lambda': 40.14943158612883}. Best is trial 106 with value: 0.37587706549111516.[0m
[32m[I 2022-07-06 04:27:52,083][0m Trial 116 finished with value: 0.30946868675024874 and parameters: {'sigma': 16.0014213732735, 'a': 4.160309129115086, 'strategy': 'median', 'add_indicator': False, 'max_depth': 56, 'n_estimators': 20, 'boosting_type': 'rf', 'num_leaves': 10, 'learning_rate': 0.006171168441372644, 'min_split_gain': 3.679407513020845, 'min_child_samples': 513, 'subsample': 0.14888805033244468, 'subsample_freq': 7, 'colsample_bytree': 0.8778842542099186, 'reg_alpha': 99.63343376272474, 'reg_lambda': 36.83095305068483}. Best is trial 106 with value: 0.37587706549111516.[0m
[32m[I 2022-07-06 04:29:00,184][0m Trial 117 finished with value: 0.34044618861009696 and parameters: {'sigma': 8.972218132984542, 'a': 14.469211670234467, 'strategy': 'mean', 'add_indicator': True, 'max_depth': 63, 'n_estimators': 1070, 'boosting_type': 'rf', 'num_leaves': 131, 'learning_rate': 0.0001627899648992604, 'min_split_gain': 0.6485359448296835, 'min_child_samples': 1825, 'subsample': 0.5614845879595237, 'subsample_freq': 600, 'colsample_bytree': 0.6074527899304902, 'reg_alpha': 67.64679372263622, 'reg_lambda': 80.49889996807697}. Best is trial 106 with value: 0.37587706549111516.[0m
[32m[I 2022-07-06 04:32:16,010][0m Trial 118 finished with value: 0.3263824388751554 and parameters: {'sigma': 5.396421704357086, 'a': 16.518483262583235, 'strategy': 'mean', 'add_indicator': True, 'max_depth': 80, 'n_estimators': 1554, 'boosting_type': 'rf', 'num_leaves': 85, 'learning_rate': 2.773333823938157e-07, 'min_split_gain': 2.2061195271121123, 'min_child_samples': 2000, 'subsample': 0.7356631142391898, 'subsample_freq': 1552, 'colsample_bytree': 0.9337821980301221, 'reg_alpha': 64.25651995351916, 'reg_lambda': 42.1248053294072}. Best is trial 106 with value: 0.37587706549111516.[0m
[32m[I 2022-07-06 04:33:43,386][0m Trial 119 finished with value: 0.34073476657368923 and parameters: {'sigma': 12.723550932391007, 'a': 15.734467199796615, 'strategy': 'most_frequent', 'add_indicator': False, 'max_depth': 20, 'n_estimators': 1090, 'boosting_type': 'rf', 'num_leaves': 3426, 'learning_rate': 2.319284629747373e-06, 'min_split_gain': 5.180787662388155, 'min_child_samples': 445, 'subsample': 0.9406792451153405, 'subsample_freq': 283, 'colsample_bytree': 0.4353602446115457, 'reg_alpha': 87.27302504846018, 'reg_lambda': 84.19335667918087}. Best is trial 106 with value: 0.37587706549111516.[0m
[32m[I 2022-07-06 04:34:56,274][0m Trial 120 finished with value: 0.0 and parameters: {'sigma': 3.722036495911368, 'a': 16.072601864934636, 'strategy': 'median', 'add_indicator': True, 'max_depth': 45, 'n_estimators': 2190, 'boosting_type': 'rf', 'num_leaves': 5, 'learning_rate': 0.0005713147414232522, 'min_split_gain': 6.569551562671395, 'min_child_samples': 12067, 'subsample': 0.06895801635642118, 'subsample_freq': 125, 'colsample_bytree': 0.28936520394626813, 'reg_alpha': 26.170568373590598, 'reg_lambda': 24.697879907199983}. Best is trial 106 with value: 0.37587706549111516.[0m
[32m[I 2022-07-06 04:35:19,231][0m Trial 121 finished with value: 0.32383680688888566 and parameters: {'sigma': 18.125092547874928, 'a': 5.065969377005171, 'strategy': 'constant', 'add_indicator': False, 'max_depth': 5, 'n_estimators': 192, 'boosting_type': 'rf', 'num_leaves': 5, 'learning_rate': 5.454018808453857e-06, 'min_split_gain': 8.998333456872725, 'min_child_samples': 111, 'subsample': 0.6637896861755891, 'subsample_freq': 185, 'colsample_bytree': 0.5645665016272235, 'reg_alpha': 93.68224620330918, 'reg_lambda': 5.225787928602377}. Best is trial 106 with value: 0.37587706549111516.[0m
[32m[I 2022-07-06 04:36:31,723][0m Trial 122 finished with value: 0.3326739866763078 and parameters: {'sigma': 8.375872193550038, 'a': 5.277140040144817, 'strategy': 'median', 'add_indicator': False, 'max_depth': 47, 'n_estimators': 2917, 'boosting_type': 'rf', 'num_leaves': 6, 'learning_rate': 1.3383960608804055e-06, 'min_split_gain': 2.50966661340298, 'min_child_samples': 7091, 'subsample': 0.5612227882825249, 'subsample_freq': 1527, 'colsample_bytree': 0.1236211831505253, 'reg_alpha': 86.0139693349435, 'reg_lambda': 72.28143032084837}. Best is trial 106 with value: 0.37587706549111516.[0m
[32m[I 2022-07-06 04:38:24,839][0m Trial 123 finished with value: 0.31331717013590077 and parameters: {'sigma': 1.3533765613164128, 'a': 14.185918434872395, 'strategy': 'mean', 'add_indicator': False, 'max_depth': 86, 'n_estimators': 2009, 'boosting_type': 'dart', 'num_leaves': 239, 'learning_rate': 2.048167777625221e-07, 'min_split_gain': 5.125026487703317, 'min_child_samples': 5681, 'subsample': 0.45923987759695806, 'subsample_freq': 105, 'colsample_bytree': 0.7884154173901927, 'reg_alpha': 20.13637821359744, 'reg_lambda': 25.862083488803876}. Best is trial 106 with value: 0.37587706549111516.[0m
[32m[I 2022-07-06 04:39:16,652][0m Trial 124 finished with value: 0.30320809560279494 and parameters: {'sigma': 3.2941354215823835, 'a': 6.6712797909428, 'strategy': 'constant', 'add_indicator': True, 'max_depth': 25, 'n_estimators': 1356, 'boosting_type': 'rf', 'num_leaves': 3, 'learning_rate': 2.08764612671255e-05, 'min_split_gain': 9.092202058615602, 'min_child_samples': 1483, 'subsample': 0.4978125080342902, 'subsample_freq': 144, 'colsample_bytree': 0.6602123036770511, 'reg_alpha': 82.21031606002255, 'reg_lambda': 38.04200075075623}. Best is trial 106 with value: 0.37587706549111516.[0m
[32m[I 2022-07-06 04:40:35,254][0m Trial 125 finished with value: 0.3087053881339435 and parameters: {'sigma': 15.51223926238804, 'a': 19.29308541262615, 'strategy': 'constant', 'add_indicator': False, 'max_depth': 80, 'n_estimators': 1191, 'boosting_type': 'rf', 'num_leaves': 969, 'learning_rate': 0.0009253515402643548, 'min_split_gain': 3.1676167706752665, 'min_child_samples': 7328, 'subsample': 0.9061432547657664, 'subsample_freq': 330, 'colsample_bytree': 0.9836862579880699, 'reg_alpha': 14.071152804875842, 'reg_lambda': 20.201566840248997}. Best is trial 106 with value: 0.37587706549111516.[0m
[32m[I 2022-07-06 04:41:40,445][0m Trial 126 finished with value: 0.2435102422786048 and parameters: {'sigma': 3.68450494251213, 'a': 17.89039522915662, 'strategy': 'mean', 'add_indicator': False, 'max_depth': 81, 'n_estimators': 1518, 'boosting_type': 'dart', 'num_leaves': 747, 'learning_rate': 0.0001490583694837303, 'min_split_gain': 1.65954895295785, 'min_child_samples': 8297, 'subsample': 0.42748968792061515, 'subsample_freq': 247, 'colsample_bytree': 0.02248144477600145, 'reg_alpha': 55.975568363838256, 'reg_lambda': 52.739962212267635}. Best is trial 106 with value: 0.37587706549111516.[0m
[32m[I 2022-07-06 04:42:25,191][0m Trial 127 finished with value: 0.32043216699056254 and parameters: {'sigma': 14.387075253846948, 'a': 17.816135255054263, 'strategy': 'constant', 'add_indicator': True, 'max_depth': 72, 'n_estimators': 946, 'boosting_type': 'gbdt', 'num_leaves': 42, 'learning_rate': 2.958436392728257e-05, 'min_split_gain': 8.282492524372184, 'min_child_samples': 535, 'subsample': 0.1737615931357438, 'subsample_freq': 674, 'colsample_bytree': 0.827718430581001, 'reg_alpha': 10.063747852353334, 'reg_lambda': 23.98741127559447}. Best is trial 106 with value: 0.37587706549111516.[0m
[32m[I 2022-07-06 04:45:29,096][0m Trial 128 finished with value: 0.3008355169909039 and parameters: {'sigma': 2.8394483754999804, 'a': 7.024034090485115, 'strategy': 'median', 'add_indicator': False, 'max_depth': 48, 'n_estimators': 2938, 'boosting_type': 'dart', 'num_leaves': 31, 'learning_rate': 0.0002701692912208833, 'min_split_gain': 0.6964114816240574, 'min_child_samples': 239, 'subsample': 0.8557372589057863, 'subsample_freq': 668, 'colsample_bytree': 0.8386707139905106, 'reg_alpha': 27.927608845441043, 'reg_lambda': 64.28819100587077}. Best is trial 106 with value: 0.37587706549111516.[0m
[32m[I 2022-07-06 04:48:01,489][0m Trial 129 finished with value: 0.3320287583459153 and parameters: {'sigma': 13.883014528690884, 'a': 10.301829587586552, 'strategy': 'mean', 'add_indicator': False, 'max_depth': 88, 'n_estimators': 2300, 'boosting_type': 'rf', 'num_leaves': 6912, 'learning_rate': 0.00022576757049648117, 'min_split_gain': 5.6044063098044, 'min_child_samples': 174, 'subsample': 0.4470555438064254, 'subsample_freq': 1059, 'colsample_bytree': 0.8659179734274433, 'reg_alpha': 54.66482201877885, 'reg_lambda': 38.04005489704097}. Best is trial 106 with value: 0.37587706549111516.[0m
[32m[I 2022-07-06 04:49:12,679][0m Trial 130 finished with value: 0.3084514212623457 and parameters: {'sigma': 19.5360068022099, 'a': 2.303339807193682, 'strategy': 'constant', 'add_indicator': False, 'max_depth': 30, 'n_estimators': 2733, 'boosting_type': 'gbdt', 'num_leaves': 11594, 'learning_rate': 0.00042988764174144595, 'min_split_gain': 3.047510953861333, 'min_child_samples': 6375, 'subsample': 0.28152119841492995, 'subsample_freq': 2386, 'colsample_bytree': 0.12145458650781764, 'reg_alpha': 70.36859774607957, 'reg_lambda': 54.069847664491036}. Best is trial 106 with value: 0.37587706549111516.[0m
[32m[I 2022-07-06 04:49:31,714][0m Trial 131 finished with value: 0.25856499815651074 and parameters: {'sigma': 1.9306984385641144, 'a': 4.913687182350895, 'strategy': 'constant', 'add_indicator': False, 'max_depth': 75, 'n_estimators': 149, 'boosting_type': 'rf', 'num_leaves': 373, 'learning_rate': 0.0028940930525762627, 'min_split_gain': 1.8533017952871444, 'min_child_samples': 148, 'subsample': 0.2395101699095381, 'subsample_freq': 119, 'colsample_bytree': 0.044323564059218494, 'reg_alpha': 58.280683508348964, 'reg_lambda': 99.54375161913099}. Best is trial 106 with value: 0.37587706549111516.[0m
[32m[I 2022-07-06 04:50:53,137][0m Trial 132 finished with value: 0.3405013921395717 and parameters: {'sigma': 17.11392331978985, 'a': 10.47676921196743, 'strategy': 'median', 'add_indicator': False, 'max_depth': 68, 'n_estimators': 2489, 'boosting_type': 'rf', 'num_leaves': 82, 'learning_rate': 3.843553574207695e-06, 'min_split_gain': 4.345959608587117, 'min_child_samples': 4826, 'subsample': 0.6019234310151316, 'subsample_freq': 2222, 'colsample_bytree': 0.4489462142353959, 'reg_alpha': 60.7089578718754, 'reg_lambda': 63.130755309198875}. Best is trial 106 with value: 0.37587706549111516.[0m
[32m[I 2022-07-06 04:51:24,183][0m Trial 133 finished with value: 0.28247491557422244 and parameters: {'sigma': 11.833947329154887, 'a': 14.082412084401774, 'strategy': 'median', 'add_indicator': False, 'max_depth': 96, 'n_estimators': 1804, 'boosting_type': 'rf', 'num_leaves': 3, 'learning_rate': 1.8705008255416594e-06, 'min_split_gain': 3.618530932051387, 'min_child_samples': 1064, 'subsample': 0.045648745502383736, 'subsample_freq': 253, 'colsample_bytree': 0.2840461647133927, 'reg_alpha': 97.15326909010507, 'reg_lambda': 33.134700710305076}. Best is trial 106 with value: 0.37587706549111516.[0m
[32m[I 2022-07-06 04:51:42,305][0m Trial 134 finished with value: 0.30251510873092424 and parameters: {'sigma': 9.640826341831069, 'a': 4.002344483494019, 'strategy': 'mean', 'add_indicator': False, 'max_depth': 23, 'n_estimators': 115, 'boosting_type': 'dart', 'num_leaves': 306, 'learning_rate': 3.658799657696744e-05, 'min_split_gain': 2.9348882320812164, 'min_child_samples': 10652, 'subsample': 0.39701504123719167, 'subsample_freq': 11, 'colsample_bytree': 0.6208958509566233, 'reg_alpha': 11.38383934766014, 'reg_lambda': 34.52231428016921}. Best is trial 106 with value: 0.37587706549111516.[0m
[32m[I 2022-07-06 04:52:00,694][0m Trial 135 finished with value: 0.0 and parameters: {'sigma': 10.14824370023679, 'a': 17.497028241235, 'strategy': 'most_frequent', 'add_indicator': False, 'max_depth': 43, 'n_estimators': 1236, 'boosting_type': 'rf', 'num_leaves': 27, 'learning_rate': 0.0013150792373085361, 'min_split_gain': 9.550605114849889, 'min_child_samples': 6118, 'subsample': 0.0015651051914729042, 'subsample_freq': 787, 'colsample_bytree': 0.06062402762767972, 'reg_alpha': 25.760722033372186, 'reg_lambda': 5.952470034777169}. Best is trial 106 with value: 0.37587706549111516.[0m
[32m[I 2022-07-06 04:52:19,961][0m Trial 136 finished with value: 0.0 and parameters: {'sigma': 12.075913021033225, 'a': 13.763139278502873, 'strategy': 'most_frequent', 'add_indicator': False, 'max_depth': 76, 'n_estimators': 217, 'boosting_type': 'dart', 'num_leaves': 752, 'learning_rate': 0.00024737156882593674, 'min_split_gain': 3.6191999083786497, 'min_child_samples': 1954, 'subsample': 0.010131184027743378, 'subsample_freq': 139, 'colsample_bytree': 0.9141540781004743, 'reg_alpha': 61.25734683448192, 'reg_lambda': 87.3698593466345}. Best is trial 106 with value: 0.37587706549111516.[0m
[32m[I 2022-07-06 04:53:28,063][0m Trial 137 finished with value: 0.3482105379753493 and parameters: {'sigma': 14.47946386959132, 'a': 2.499112486433436, 'strategy': 'mean', 'add_indicator': False, 'max_depth': 31, 'n_estimators': 1461, 'boosting_type': 'rf', 'num_leaves': 270, 'learning_rate': 5.198005873091407e-06, 'min_split_gain': 7.29173487549448, 'min_child_samples': 2622, 'subsample': 0.8456043629899068, 'subsample_freq': 1012, 'colsample_bytree': 0.43563176661624664, 'reg_alpha': 67.29666223944324, 'reg_lambda': 27.538117425541852}. Best is trial 106 with value: 0.37587706549111516.[0m
[32m[I 2022-07-06 04:54:48,343][0m Trial 138 finished with value: 0.27652429768133935 and parameters: {'sigma': 6.126276912429265, 'a': 15.800804682423786, 'strategy': 'constant', 'add_indicator': True, 'max_depth': 33, 'n_estimators': 1749, 'boosting_type': 'dart', 'num_leaves': 904, 'learning_rate': 7.460439882486419e-06, 'min_split_gain': 1.6686020169875282, 'min_child_samples': 862, 'subsample': 0.14259414408190874, 'subsample_freq': 1557, 'colsample_bytree': 0.35241868613047883, 'reg_alpha': 15.445974722332378, 'reg_lambda': 2.5447759905750877}. Best is trial 106 with value: 0.37587706549111516.[0m
[32m[I 2022-07-06 04:55:22,554][0m Trial 139 finished with value: 0.25391625995947137 and parameters: {'sigma': 12.916451267505822, 'a': 12.77435611734939, 'strategy': 'most_frequent', 'add_indicator': True, 'max_depth': 38, 'n_estimators': 657, 'boosting_type': 'rf', 'num_leaves': 6, 'learning_rate': 2.678850628978926e-05, 'min_split_gain': 0.27536719869465487, 'min_child_samples': 1256, 'subsample': 0.9640174071177023, 'subsample_freq': 253, 'colsample_bytree': 0.048606052449162475, 'reg_alpha': 3.095579091934353, 'reg_lambda': 38.798675994686946}. Best is trial 106 with value: 0.37587706549111516.[0m
[32m[I 2022-07-06 04:58:38,479][0m Trial 140 finished with value: 0.350444166897354 and parameters: {'sigma': 3.2005071290145164, 'a': 0.5647067169308996, 'strategy': 'constant', 'add_indicator': False, 'max_depth': 33, 'n_estimators': 2666, 'boosting_type': 'dart', 'num_leaves': 22, 'learning_rate': 0.006392598477708219, 'min_split_gain': 3.8948189490242036, 'min_child_samples': 688, 'subsample': 0.3403871042545057, 'subsample_freq': 1444, 'colsample_bytree': 0.16260359274670222, 'reg_alpha': 55.37114853580112, 'reg_lambda': 54.1704812410004}. Best is trial 106 with value: 0.37587706549111516.[0m
[32m[I 2022-07-06 05:00:37,249][0m Trial 141 finished with value: 0.2796982855465382 and parameters: {'sigma': 15.238038633079274, 'a': 16.689634242557954, 'strategy': 'mean', 'add_indicator': False, 'max_depth': 28, 'n_estimators': 2900, 'boosting_type': 'dart', 'num_leaves': 5, 'learning_rate': 1.6604230208850672e-05, 'min_split_gain': 6.262343214210638, 'min_child_samples': 1156, 'subsample': 0.40177880065432425, 'subsample_freq': 2883, 'colsample_bytree': 0.8815116145274378, 'reg_alpha': 62.34059581594401, 'reg_lambda': 56.93773611822828}. Best is trial 106 with value: 0.37587706549111516.[0m
[32m[I 2022-07-06 05:01:54,384][0m Trial 142 finished with value: 0.31996505754862553 and parameters: {'sigma': 12.413213389886883, 'a': 4.106110945666421, 'strategy': 'constant', 'add_indicator': False, 'max_depth': 92, 'n_estimators': 2168, 'boosting_type': 'gbdt', 'num_leaves': 2336, 'learning_rate': 4.208274590392341e-07, 'min_split_gain': 7.942106625494054, 'min_child_samples': 397, 'subsample': 0.8770905810181889, 'subsample_freq': 2047, 'colsample_bytree': 0.15730800971106448, 'reg_alpha': 46.267560506539354, 'reg_lambda': 98.09873781626851}. Best is trial 106 with value: 0.37587706549111516.[0m
[32m[I 2022-07-06 05:04:21,004][0m Trial 143 finished with value: 0.3269402684487037 and parameters: {'sigma': 9.668153885388572, 'a': 17.28459569803945, 'strategy': 'mean', 'add_indicator': True, 'max_depth': 52, 'n_estimators': 1480, 'boosting_type': 'dart', 'num_leaves': 66, 'learning_rate': 0.0013727599825498497, 'min_split_gain': 7.645277946547177, 'min_child_samples': 1767, 'subsample': 0.9560471436119331, 'subsample_freq': 297, 'colsample_bytree': 0.11817156820652519, 'reg_alpha': 85.39619669554222, 'reg_lambda': 43.91498166337483}. Best is trial 106 with value: 0.37587706549111516.[0m
[32m[I 2022-07-06 05:04:55,152][0m Trial 144 finished with value: 0.2822292267096167 and parameters: {'sigma': 16.939378614452668, 'a': 17.872495083388756, 'strategy': 'median', 'add_indicator': False, 'max_depth': 3, 'n_estimators': 1433, 'boosting_type': 'gbdt', 'num_leaves': 2, 'learning_rate': 3.140349189141228e-06, 'min_split_gain': 3.587155254170135, 'min_child_samples': 5625, 'subsample': 0.278759872414553, 'subsample_freq': 302, 'colsample_bytree': 0.9578735388477152, 'reg_alpha': 0.88632851134689, 'reg_lambda': 99.78208556819781}. Best is trial 106 with value: 0.37587706549111516.[0m
