[32m[I 2022-07-06 14:22:21,267][0m Trial 435 finished with value: 0.3638696240032287 and parameters: {'sigma': 0.8566529005781205, 'a': 12.064984536897782, 'strategy': 'median', 'add_indicator': True, 'max_depth': 85, 'n_estimators': 581, 'boosting_type': 'gbdt', 'num_leaves': 193, 'learning_rate': 0.0051513304147304375, 'min_split_gain': 1.0922222765833736, 'min_child_samples': 693, 'subsample': 0.832780678126354, 'subsample_freq': 471, 'colsample_bytree': 0.40514373507680373, 'reg_alpha': 50.535337823163395, 'reg_lambda': 11.400440219008924}. Best is trial 290 with value: 0.39243341529400166.[0m
[32m[I 2022-07-06 14:23:10,901][0m Trial 436 finished with value: 0.37279254264654454 and parameters: {'sigma': 0.021336561400122685, 'a': 11.453722422953932, 'strategy': 'median', 'add_indicator': True, 'max_depth': 88, 'n_estimators': 1081, 'boosting_type': 'gbdt', 'num_leaves': 352, 'learning_rate': 0.002672299068333788, 'min_split_gain': 1.4078777330138608, 'min_child_samples': 627, 'subsample': 0.8192103794926402, 'subsample_freq': 805, 'colsample_bytree': 0.44189305250558825, 'reg_alpha': 44.510392197859915, 'reg_lambda': 14.544963285539914}. Best is trial 290 with value: 0.39243341529400166.[0m
[32m[I 2022-07-06 14:24:34,447][0m Trial 437 finished with value: 0.3872728802544914 and parameters: {'sigma': 0.0035889094433538974, 'a': 11.050254882426257, 'strategy': 'median', 'add_indicator': True, 'max_depth': 92, 'n_estimators': 1488, 'boosting_type': 'gbdt', 'num_leaves': 293, 'learning_rate': 0.006050627200631005, 'min_split_gain': 0.7004763482234809, 'min_child_samples': 744, 'subsample': 0.9086877209654874, 'subsample_freq': 451, 'colsample_bytree': 0.3930472530613861, 'reg_alpha': 53.94842496432528, 'reg_lambda': 17.918511248886645}. Best is trial 290 with value: 0.39243341529400166.[0m
[32m[I 2022-07-06 14:25:29,658][0m Trial 438 finished with value: 0.36638276289064836 and parameters: {'sigma': 1.387890316774166, 'a': 10.05642817119657, 'strategy': 'median', 'add_indicator': True, 'max_depth': 84, 'n_estimators': 950, 'boosting_type': 'gbdt', 'num_leaves': 411, 'learning_rate': 0.004213984583919079, 'min_split_gain': 0.976749705911307, 'min_child_samples': 1044, 'subsample': 0.8497970237878718, 'subsample_freq': 806, 'colsample_bytree': 0.4833376890980659, 'reg_alpha': 48.81990591512432, 'reg_lambda': 12.352302967641299}. Best is trial 290 with value: 0.39243341529400166.[0m
[32m[I 2022-07-06 14:26:33,759][0m Trial 439 finished with value: 0.37969772829611265 and parameters: {'sigma': 0.3861899338402747, 'a': 10.497948135697179, 'strategy': 'median', 'add_indicator': True, 'max_depth': 86, 'n_estimators': 1483, 'boosting_type': 'gbdt', 'num_leaves': 235, 'learning_rate': 0.007540622169398503, 'min_split_gain': 1.1948565434552025, 'min_child_samples': 462, 'subsample': 0.7957971343976593, 'subsample_freq': 744, 'colsample_bytree': 0.33547150200422465, 'reg_alpha': 51.16041749134922, 'reg_lambda': 20.260199934761175}. Best is trial 290 with value: 0.39243341529400166.[0m
[32m[I 2022-07-06 14:27:13,515][0m Trial 440 finished with value: 0.3572480150022413 and parameters: {'sigma': 0.7735172810879811, 'a': 12.440467685737602, 'strategy': 'median', 'add_indicator': True, 'max_depth': 90, 'n_estimators': 408, 'boosting_type': 'gbdt', 'num_leaves': 168, 'learning_rate': 0.0034376153805052378, 'min_split_gain': 0.3288655399282935, 'min_child_samples': 561, 'subsample': 0.736188997287446, 'subsample_freq': 289, 'colsample_bytree': 0.368100946083678, 'reg_alpha': 42.38526080753927, 'reg_lambda': 15.704729446127713}. Best is trial 290 with value: 0.39243341529400166.[0m
[32m[I 2022-07-06 14:27:30,826][0m Trial 441 finished with value: 0.34291193009675064 and parameters: {'sigma': 0.38016657121255315, 'a': 11.933150779146274, 'strategy': 'median', 'add_indicator': True, 'max_depth': 82, 'n_estimators': 18, 'boosting_type': 'gbdt', 'num_leaves': 617, 'learning_rate': 0.004842156359549947, 'min_split_gain': 0.8100013752926483, 'min_child_samples': 833, 'subsample': 0.7688075393037632, 'subsample_freq': 10, 'colsample_bytree': 0.42779765115260865, 'reg_alpha': 45.75324116494325, 'reg_lambda': 10.338657270727023}. Best is trial 290 with value: 0.39243341529400166.[0m
[32m[I 2022-07-06 14:28:40,127][0m Trial 442 finished with value: 0.37914952646266165 and parameters: {'sigma': 0.6686833629560939, 'a': 11.422635961100013, 'strategy': 'median', 'add_indicator': True, 'max_depth': 84, 'n_estimators': 1392, 'boosting_type': 'gbdt', 'num_leaves': 779, 'learning_rate': 0.006055644320174228, 'min_split_gain': 0.6084948773257859, 'min_child_samples': 678, 'subsample': 0.8785159379721855, 'subsample_freq': 971, 'colsample_bytree': 0.4060957077842774, 'reg_alpha': 47.93486931198434, 'reg_lambda': 13.669686890636218}. Best is trial 290 with value: 0.39243341529400166.[0m
[32m[I 2022-07-06 14:29:21,611][0m Trial 443 finished with value: 0.3684374267321431 and parameters: {'sigma': 0.0003466087013087593, 'a': 11.027498329663912, 'strategy': 'median', 'add_indicator': True, 'max_depth': 87, 'n_estimators': 534, 'boosting_type': 'gbdt', 'num_leaves': 350, 'learning_rate': 0.0038911481303195907, 'min_split_gain': 1.0172444988353107, 'min_child_samples': 509, 'subsample': 0.8123398691768275, 'subsample_freq': 533, 'colsample_bytree': 0.38281914998756117, 'reg_alpha': 56.04085214698754, 'reg_lambda': 15.369909256548926}. Best is trial 290 with value: 0.39243341529400166.[0m
[32m[I 2022-07-06 14:30:00,911][0m Trial 444 finished with value: 0.3721938257219753 and parameters: {'sigma': 1.1047074005843471, 'a': 10.544998255586764, 'strategy': 'median', 'add_indicator': True, 'max_depth': 80, 'n_estimators': 872, 'boosting_type': 'gbdt', 'num_leaves': 288, 'learning_rate': 0.008167530669546771, 'min_split_gain': 1.2877864434018607, 'min_child_samples': 619, 'subsample': 0.7870991598353241, 'subsample_freq': 362, 'colsample_bytree': 0.4637992812473145, 'reg_alpha': 53.00599359061815, 'reg_lambda': 12.003514264125771}. Best is trial 290 with value: 0.39243341529400166.[0m
[32m[I 2022-07-06 14:31:19,545][0m Trial 445 finished with value: 0.3774084053073694 and parameters: {'sigma': 0.40109699297248824, 'a': 9.779876302922249, 'strategy': 'median', 'add_indicator': True, 'max_depth': 85, 'n_estimators': 1243, 'boosting_type': 'gbdt', 'num_leaves': 407, 'learning_rate': 0.0062776665968905234, 'min_split_gain': 0.8689079496209251, 'min_child_samples': 758, 'subsample': 0.8323734931391311, 'subsample_freq': 1139, 'colsample_bytree': 0.3582712838891131, 'reg_alpha': 49.53336426785731, 'reg_lambda': 8.97005913577088}. Best is trial 290 with value: 0.39243341529400166.[0m
[32m[I 2022-07-06 14:31:43,401][0m Trial 446 finished with value: 0.3611105118074666 and parameters: {'sigma': 0.004591326054003163, 'a': 11.757371663331153, 'strategy': 'median', 'add_indicator': True, 'max_depth': 82, 'n_estimators': 174, 'boosting_type': 'gbdt', 'num_leaves': 487, 'learning_rate': 0.0023220897218606054, 'min_split_gain': 1.1292892323364518, 'min_child_samples': 583, 'subsample': 0.7627783453637361, 'subsample_freq': 144, 'colsample_bytree': 0.42012014627703526, 'reg_alpha': 43.72582088968194, 'reg_lambda': 17.59275766526603}. Best is trial 290 with value: 0.39243341529400166.[0m
[32m[I 2022-07-06 14:32:40,990][0m Trial 447 finished with value: 0.37493542532786944 and parameters: {'sigma': 0.8509185843858383, 'a': 10.918812110551583, 'strategy': 'median', 'add_indicator': True, 'max_depth': 89, 'n_estimators': 1493, 'boosting_type': 'gbdt', 'num_leaves': 211, 'learning_rate': 0.004656786743740389, 'min_split_gain': 0.6790583584100771, 'min_child_samples': 678, 'subsample': 0.8013472615429786, 'subsample_freq': 1469, 'colsample_bytree': 0.4437342924576465, 'reg_alpha': 50.96694485460844, 'reg_lambda': 14.121740811610513}. Best is trial 290 with value: 0.39243341529400166.[0m
[32m[I 2022-07-06 14:33:51,769][0m Trial 448 finished with value: 0.3731635831158319 and parameters: {'sigma': 0.3810664253991837, 'a': 9.259781738448881, 'strategy': 'median', 'add_indicator': True, 'max_depth': 86, 'n_estimators': 1428, 'boosting_type': 'gbdt', 'num_leaves': 337, 'learning_rate': 0.003244144715834189, 'min_split_gain': 1.5198707611815963, 'min_child_samples': 524, 'subsample': 0.8514791284027462, 'subsample_freq': 1263, 'colsample_bytree': 0.39763170414201393, 'reg_alpha': 40.939629185048915, 'reg_lambda': 11.202862933554272}. Best is trial 290 with value: 0.39243341529400166.[0m
[32m[I 2022-07-06 14:34:56,103][0m Trial 449 finished with value: 0.3800067223639931 and parameters: {'sigma': 0.4037875270122987, 'a': 12.988266873180319, 'strategy': 'median', 'add_indicator': True, 'max_depth': 83, 'n_estimators': 1213, 'boosting_type': 'gbdt', 'num_leaves': 264, 'learning_rate': 0.0068327999755077844, 'min_split_gain': 0.41992455791977645, 'min_child_samples': 625, 'subsample': 0.8231397119171324, 'subsample_freq': 92, 'colsample_bytree': 0.41654836419778163, 'reg_alpha': 46.854632700003876, 'reg_lambda': 4.63291425984071}. Best is trial 290 with value: 0.39243341529400166.[0m
[32m[I 2022-07-06 14:35:44,208][0m Trial 450 finished with value: 0.36569731589546556 and parameters: {'sigma': 1.0859413049241011, 'a': 10.249591375952043, 'strategy': 'median', 'add_indicator': True, 'max_depth': 94, 'n_estimators': 767, 'boosting_type': 'gbdt', 'num_leaves': 318, 'learning_rate': 0.005270860993812753, 'min_split_gain': 0.936097768429185, 'min_child_samples': 929, 'subsample': 0.77759227025563, 'subsample_freq': 687, 'colsample_bytree': 0.3737166889462601, 'reg_alpha': 49.20177153404025, 'reg_lambda': 16.737477989547365}. Best is trial 290 with value: 0.39243341529400166.[0m
[32m[I 2022-07-06 14:36:33,770][0m Trial 451 finished with value: 0.370697737647643 and parameters: {'sigma': 0.011284747542342148, 'a': 11.29203595011055, 'strategy': 'median', 'add_indicator': True, 'max_depth': 88, 'n_estimators': 565, 'boosting_type': 'gbdt', 'num_leaves': 130, 'learning_rate': 0.004012629281931511, 'min_split_gain': 0.7915175523559554, 'min_child_samples': 726, 'subsample': 0.7985399254885416, 'subsample_freq': 543, 'colsample_bytree': 0.38917092795611835, 'reg_alpha': 45.30085849856941, 'reg_lambda': 13.461025929389077}. Best is trial 290 with value: 0.39243341529400166.[0m
[32m[I 2022-07-06 14:37:42,260][0m Trial 452 finished with value: 0.37834584913573027 and parameters: {'sigma': 0.6852515477875385, 'a': 10.649152901564282, 'strategy': 'median', 'add_indicator': True, 'max_depth': 84, 'n_estimators': 1483, 'boosting_type': 'gbdt', 'num_leaves': 453, 'learning_rate': 0.009911899095215641, 'min_split_gain': 1.3134258327518578, 'min_child_samples': 549, 'subsample': 0.863887478109773, 'subsample_freq': 1375, 'colsample_bytree': 0.43568676733691364, 'reg_alpha': 54.317736435323454, 'reg_lambda': 18.60756135266929}. Best is trial 290 with value: 0.39243341529400166.[0m
[32m[I 2022-07-06 14:38:09,337][0m Trial 453 finished with value: 0.3573482105694561 and parameters: {'sigma': 0.38534046004876943, 'a': 11.653038758513143, 'strategy': 'median', 'add_indicator': True, 'max_depth': 78, 'n_estimators': 216, 'boosting_type': 'gbdt', 'num_leaves': 234, 'learning_rate': 0.005404645815335377, 'min_split_gain': 1.0677740045918171, 'min_child_samples': 429, 'subsample': 0.7490223938751033, 'subsample_freq': 80, 'colsample_bytree': 0.3492686830527394, 'reg_alpha': 51.440365877592896, 'reg_lambda': 7.226193031115396}. Best is trial 290 with value: 0.39243341529400166.[0m
[32m[I 2022-07-06 14:39:20,738][0m Trial 454 finished with value: 0.3730085916235828 and parameters: {'sigma': 0.6740969005122692, 'a': 11.044301462249084, 'strategy': 'median', 'add_indicator': True, 'max_depth': 91, 'n_estimators': 1179, 'boosting_type': 'gbdt', 'num_leaves': 375, 'learning_rate': 0.007148705159473304, 'min_split_gain': 1.987096576219987, 'min_child_samples': 824, 'subsample': 0.8203786610087873, 'subsample_freq': 1090, 'colsample_bytree': 0.4087057244398516, 'reg_alpha': 57.272512069209554, 'reg_lambda': 21.311328384786364}. Best is trial 290 with value: 0.39243341529400166.[0m
[32m[I 2022-07-06 14:40:21,594][0m Trial 455 finished with value: 0.3652162375265129 and parameters: {'sigma': 1.511737931097565, 'a': 12.190655004263803, 'strategy': 'median', 'add_indicator': True, 'max_depth': 81, 'n_estimators': 1063, 'boosting_type': 'gbdt', 'num_leaves': 562, 'learning_rate': 0.0027475844514677204, 'min_split_gain': 0.5300704988894056, 'min_child_samples': 640, 'subsample': 0.893550552040007, 'subsample_freq': 20, 'colsample_bytree': 0.3874700605692945, 'reg_alpha': 47.54486129385848, 'reg_lambda': 14.744565369012815}. Best is trial 290 with value: 0.39243341529400166.[0m
[32m[I 2022-07-06 14:41:20,605][0m Trial 456 finished with value: 0.3817968132985945 and parameters: {'sigma': 0.002785545498032782, 'a': 11.438210507459008, 'strategy': 'median', 'add_indicator': True, 'max_depth': 86, 'n_estimators': 1454, 'boosting_type': 'gbdt', 'num_leaves': 285, 'learning_rate': 0.004331710821953167, 'min_split_gain': 0.9362474990683279, 'min_child_samples': 488, 'subsample': 0.8400664301862569, 'subsample_freq': 1373, 'colsample_bytree': 0.45120947243735476, 'reg_alpha': 52.41337410909917, 'reg_lambda': 9.886972160827728}. Best is trial 290 with value: 0.39243341529400166.[0m
[32m[I 2022-07-06 14:41:40,928][0m Trial 457 finished with value: 0.35040469107053446 and parameters: {'sigma': 0.3775535719603573, 'a': 10.267370092397346, 'strategy': 'median', 'add_indicator': True, 'max_depth': 83, 'n_estimators': 102, 'boosting_type': 'gbdt', 'num_leaves': 161, 'learning_rate': 0.0033381054206178123, 'min_split_gain': 0.7051120530092242, 'min_child_samples': 580, 'subsample': 0.7842264805462491, 'subsample_freq': 49, 'colsample_bytree': 0.5266196539897562, 'reg_alpha': 49.00913768084109, 'reg_lambda': 12.37833156642299}. Best is trial 290 with value: 0.39243341529400166.[0m
[32m[I 2022-07-06 14:42:40,506][0m Trial 458 finished with value: 0.38056096061835376 and parameters: {'sigma': 0.8612937948279332, 'a': 10.762645038635839, 'strategy': 'median', 'add_indicator': True, 'max_depth': 88, 'n_estimators': 1489, 'boosting_type': 'gbdt', 'num_leaves': 203, 'learning_rate': 0.008185211371954744, 'min_split_gain': 0.12084605189134034, 'min_child_samples': 688, 'subsample': 0.8055781070976095, 'subsample_freq': 1031, 'colsample_bytree': 0.42885244374303905, 'reg_alpha': 44.86669780977511, 'reg_lambda': 24.08732520236291}. Best is trial 290 with value: 0.39243341529400166.[0m
[32m[I 2022-07-06 14:43:48,722][0m Trial 459 finished with value: 0.37434545857560725 and parameters: {'sigma': 0.40367398632513973, 'a': 11.761140871408259, 'strategy': 'median', 'add_indicator': True, 'max_depth': 85, 'n_estimators': 960, 'boosting_type': 'gbdt', 'num_leaves': 361, 'learning_rate': 0.005877699218790476, 'min_split_gain': 1.139327929940474, 'min_child_samples': 767, 'subsample': 0.8308589848052638, 'subsample_freq': 622, 'colsample_bytree': 0.36804669437071896, 'reg_alpha': 39.034081356754406, 'reg_lambda': 15.44628321690886}. Best is trial 290 with value: 0.39243341529400166.[0m
[32m[I 2022-07-06 14:45:08,770][0m Trial 460 finished with value: 0.3726695301728407 and parameters: {'sigma': 2.4544927047599794, 'a': 11.243296712148979, 'strategy': 'median', 'add_indicator': True, 'max_depth': 80, 'n_estimators': 1486, 'boosting_type': 'gbdt', 'num_leaves': 439, 'learning_rate': 0.004711066412908682, 'min_split_gain': 1.4496901936180764, 'min_child_samples': 607, 'subsample': 0.8098210705770829, 'subsample_freq': 1387, 'colsample_bytree': 0.40718756150114155, 'reg_alpha': 46.85555790159481, 'reg_lambda': 16.89944298963188}. Best is trial 290 with value: 0.39243341529400166.[0m
[32m[I 2022-07-06 14:45:52,299][0m Trial 461 finished with value: 0.3735791780626208 and parameters: {'sigma': 1.187347243439791, 'a': 9.777887941795905, 'strategy': 'median', 'add_indicator': True, 'max_depth': 87, 'n_estimators': 1317, 'boosting_type': 'gbdt', 'num_leaves': 296, 'learning_rate': 0.006462477250732731, 'min_split_gain': 1.7273581646188496, 'min_child_samples': 672, 'subsample': 0.7707189527181345, 'subsample_freq': 497, 'colsample_bytree': 0.32806849150158335, 'reg_alpha': 43.123845284210574, 'reg_lambda': 13.150613986658065}. Best is trial 290 with value: 0.39243341529400166.[0m
[32m[I 2022-07-06 14:46:15,069][0m Trial 462 finished with value: 0.362216633640245 and parameters: {'sigma': 0.0027801783089687893, 'a': 10.707973491228433, 'strategy': 'median', 'add_indicator': True, 'max_depth': 90, 'n_estimators': 154, 'boosting_type': 'gbdt', 'num_leaves': 250, 'learning_rate': 0.004028450854655109, 'min_split_gain': 0.8376145920510484, 'min_child_samples': 543, 'subsample': 0.8470289009870882, 'subsample_freq': 123, 'colsample_bytree': 0.3837852758607577, 'reg_alpha': 50.10990504802448, 'reg_lambda': 19.325865811470695}. Best is trial 290 with value: 0.39243341529400166.[0m
[32m[I 2022-07-06 14:47:31,348][0m Trial 463 finished with value: 0.3776898554184894 and parameters: {'sigma': 0.683741096728359, 'a': 12.55458671054018, 'strategy': 'median', 'add_indicator': True, 'max_depth': 83, 'n_estimators': 1295, 'boosting_type': 'gbdt', 'num_leaves': 491, 'learning_rate': 0.00826261069568115, 'min_split_gain': 1.2501778814478581, 'min_child_samples': 745, 'subsample': 0.7942576689049083, 'subsample_freq': 166, 'colsample_bytree': 0.42111864173826047, 'reg_alpha': 54.40013489721896, 'reg_lambda': 59.48164043017443}. Best is trial 290 with value: 0.39243341529400166.[0m
[32m[I 2022-07-06 14:48:17,254][0m Trial 464 finished with value: 0.3736796477238317 and parameters: {'sigma': 0.3526126068325866, 'a': 11.095209548008173, 'strategy': 'median', 'add_indicator': True, 'max_depth': 85, 'n_estimators': 1114, 'boosting_type': 'gbdt', 'num_leaves': 357, 'learning_rate': 0.0052018639750883435, 'min_split_gain': 0.4748113146690438, 'min_child_samples': 588, 'subsample': 0.8246789791125639, 'subsample_freq': 1109, 'colsample_bytree': 0.3582716714591124, 'reg_alpha': 51.958305385174015, 'reg_lambda': 10.709734599669577}. Best is trial 290 with value: 0.39243341529400166.[0m
[32m[I 2022-07-06 14:49:15,072][0m Trial 465 finished with value: 0.3706856885794456 and parameters: {'sigma': 0.012069588696933899, 'a': 10.369507582055226, 'strategy': 'median', 'add_indicator': True, 'max_depth': 82, 'n_estimators': 739, 'boosting_type': 'gbdt', 'num_leaves': 300, 'learning_rate': 0.003357585283141547, 'min_split_gain': 1.0176140671700087, 'min_child_samples': 861, 'subsample': 0.7507731631682237, 'subsample_freq': 481, 'colsample_bytree': 0.3996839392875131, 'reg_alpha': 48.31092345569066, 'reg_lambda': 8.547973994317628}. Best is trial 290 with value: 0.39243341529400166.[0m
[32m[I 2022-07-06 14:50:34,482][0m Trial 466 finished with value: 0.3737611266971914 and parameters: {'sigma': 0.9234876054981475, 'a': 11.988757334765236, 'strategy': 'median', 'add_indicator': True, 'max_depth': 87, 'n_estimators': 1025, 'boosting_type': 'gbdt', 'num_leaves': 218, 'learning_rate': 0.0067012330022098035, 'min_split_gain': 0.6749472302590699, 'min_child_samples': 496, 'subsample': 0.8701773299560424, 'subsample_freq': 889, 'colsample_bytree': 0.446192739141516, 'reg_alpha': 60.246381675832154, 'reg_lambda': 15.728104179296583}. Best is trial 290 with value: 0.39243341529400166.[0m
[32m[I 2022-07-06 14:51:28,354][0m Trial 467 finished with value: 0.3754675488073674 and parameters: {'sigma': 0.39392657667074915, 'a': 8.54168786916159, 'strategy': 'median', 'add_indicator': True, 'max_depth': 89, 'n_estimators': 1280, 'boosting_type': 'gbdt', 'num_leaves': 403, 'learning_rate': 0.00484677182681237, 'min_split_gain': 0.2896695784161427, 'min_child_samples': 674, 'subsample': 0.7841640704269911, 'subsample_freq': 1005, 'colsample_bytree': 0.41172298558948806, 'reg_alpha': 45.52738959261, 'reg_lambda': 13.067717788612955}. Best is trial 290 with value: 0.39243341529400166.[0m
[32m[I 2022-07-06 14:51:59,701][0m Trial 468 finished with value: 0.3543881200972954 and parameters: {'sigma': 0.7072874471123808, 'a': 11.461898098637382, 'strategy': 'median', 'add_indicator': True, 'max_depth': 85, 'n_estimators': 299, 'boosting_type': 'gbdt', 'num_leaves': 260, 'learning_rate': 0.0026133153203198763, 'min_split_gain': 0.9100425810654731, 'min_child_samples': 623, 'subsample': 0.8038770908141852, 'subsample_freq': 261, 'colsample_bytree': 0.4637512163711406, 'reg_alpha': 41.276381054437614, 'reg_lambda': 11.522762327086994}. Best is trial 290 with value: 0.39243341529400166.[0m
[32m[I 2022-07-06 14:53:14,097][0m Trial 469 finished with value: 0.37362147382264466 and parameters: {'sigma': 0.33958679679941073, 'a': 10.087907121900372, 'strategy': 'median', 'add_indicator': True, 'max_depth': 79, 'n_estimators': 1291, 'boosting_type': 'gbdt', 'num_leaves': 615, 'learning_rate': 0.0038840269833937437, 'min_split_gain': 1.1622431098999397, 'min_child_samples': 541, 'subsample': 0.8465025141025049, 'subsample_freq': 1075, 'colsample_bytree': 0.37932327523206005, 'reg_alpha': 50.286863131586976, 'reg_lambda': 14.667233775362021}. Best is trial 290 with value: 0.39243341529400166.[0m
[32m[I 2022-07-06 14:54:44,861][0m Trial 470 finished with value: 0.37115818473368295 and parameters: {'sigma': 0.006696997419380374, 'a': 10.817461920315424, 'strategy': 'median', 'add_indicator': True, 'max_depth': 76, 'n_estimators': 1435, 'boosting_type': 'gbdt', 'num_leaves': 175, 'learning_rate': 0.0018773758188706394, 'min_split_gain': 0.696374613960169, 'min_child_samples': 742, 'subsample': 0.8139369233568742, 'subsample_freq': 669, 'colsample_bytree': 0.43211729234359925, 'reg_alpha': 53.207612105612, 'reg_lambda': 17.59476139971614}. Best is trial 290 with value: 0.39243341529400166.[0m
