[32m[I 2022-07-06 16:25:33,492][0m Trial 578 finished with value: 0.3705643808895502 and parameters: {'sigma': 0.37113943252143183, 'a': 10.475146061884741, 'strategy': 'constant', 'add_indicator': True, 'max_depth': 88, 'n_estimators': 786, 'boosting_type': 'gbdt', 'num_leaves': 159, 'learning_rate': 0.006426119057715065, 'min_split_gain': 1.1729082594796556, 'min_child_samples': 614, 'subsample': 0.8059382652378241, 'subsample_freq': 703, 'colsample_bytree': 0.38459679635476846, 'reg_alpha': 51.2935005579017, 'reg_lambda': 14.479767372837737}. Best is trial 290 with value: 0.39243341529400166.[0m
/opt/conda/lib/python3.10/site-packages/optuna/samplers/_tpe/parzen_estimator.py:188: RuntimeWarning: divide by zero encountered in true_divide
  coefficient = 1 / z / p_accept
[33m[W 2022-07-06 16:26:00,051][0m Trial 580 failed because of the following error: ValueError('Cannot set different distribution kind to the same parameter name.')[0m/opt/conda/lib/python3.10/site-packages/optuna/samplers/_tpe/parzen_estimator.py:188: RuntimeWarning: divide by zero encountered in true_divide
  coefficient = 1 / z / p_accept
[33m[W 2022-07-06 16:27:16,013][0m Trial 581 failed because of the following error: ValueError('Cannot set different distribution kind to the same parameter name.')[0m[32m[I 2022-07-06 16:29:21,749][0m Trial 582 finished with value: 0.34735434213774335 and parameters: {'sigma': 1.4474365267107019, 'a': 11.1973013486381, 'strategy': 'median', 'add_indicator': True, 'max_depth': 82, 'n_estimators': 62, 'boosting_type': 'gbdt', 'num_leaves': 353, 'learning_rate': 0.00367335324677795, 'min_split_gain': 0.9347019109214003, 'min_child_samples': 512, 'subsample': 0.7766540166877597, 'subsample_freq': 29, 'colsample_bytree': 0.4350084062236564, 'reg_alpha': 43.78895468795498, 'reg_lambda': 16.869172858397338}. Best is trial 290 with value: 0.39243341529400166.[0m
[32m[I 2022-07-06 16:29:40,949][0m Trial 583 finished with value: 0.35736705112695155 and parameters: {'sigma': 0.017615911983083512, 'a': 11.653283398014377, 'strategy': 'median', 'add_indicator': True, 'max_depth': 87, 'n_estimators': 44, 'boosting_type': 'gbdt', 'num_leaves': 553, 'learning_rate': 0.0055768319014991375, 'min_split_gain': 0.5932489181899913, 'min_child_samples': 683, 'subsample': 0.8349300759702241, 'subsample_freq': 38, 'colsample_bytree': 0.41335595259152835, 'reg_alpha': 52.85232951768253, 'reg_lambda': 10.602996027107267}. Best is trial 290 with value: 0.39243341529400166.[0m
[32m[I 2022-07-06 16:30:07,110][0m Trial 584 finished with value: 0.35149305517326557 and parameters: {'sigma': 1.0013689865345952, 'a': 10.112692835178864, 'strategy': 'median', 'add_indicator': True, 'max_depth': 79, 'n_estimators': 281, 'boosting_type': 'gbdt', 'num_leaves': 209, 'learning_rate': 0.002796030825429468, 'min_split_gain': 0.20488822786078253, 'min_child_samples': 1047, 'subsample': 0.8179932643987882, 'subsample_freq': 130, 'colsample_bytree': 0.36278142441004846, 'reg_alpha': 61.90292083401507, 'reg_lambda': 20.59972255912318}. Best is trial 290 with value: 0.39243341529400166.[0m
[32m[I 2022-07-06 16:30:55,629][0m Trial 585 finished with value: 0.3869361317559999 and parameters: {'sigma': 0.009451774135274456, 'a': 10.798488146581445, 'strategy': 'mean', 'add_indicator': True, 'max_depth': 83, 'n_estimators': 1494, 'boosting_type': 'gbdt', 'num_leaves': 300, 'learning_rate': 0.008307810599618494, 'min_split_gain': 1.0184173628870243, 'min_child_samples': 767, 'subsample': 0.8764358295798487, 'subsample_freq': 1216, 'colsample_bytree': 0.39369556015543017, 'reg_alpha': 46.6933939940229, 'reg_lambda': 12.461550325282339}. Best is trial 290 with value: 0.39243341529400166.[0m
[32m[I 2022-07-06 16:31:47,381][0m Trial 586 finished with value: 0.3707463587726154 and parameters: {'sigma': 0.6604989484603029, 'a': 11.051250803997146, 'strategy': 'median', 'add_indicator': True, 'max_depth': 85, 'n_estimators': 1330, 'boosting_type': 'gbdt', 'num_leaves': 398, 'learning_rate': 0.004107116456693482, 'min_split_gain': 1.3266186291589854, 'min_child_samples': 1574, 'subsample': 0.7957896217804029, 'subsample_freq': 961, 'colsample_bytree': 0.5064424452681432, 'reg_alpha': 49.69743182146993, 'reg_lambda': 15.103531821760548}. Best is trial 290 with value: 0.39243341529400166.[0m
[32m[I 2022-07-06 16:32:59,886][0m Trial 587 finished with value: 0.37683213335905785 and parameters: {'sigma': 0.3784596617514018, 'a': 11.939897600076304, 'strategy': 'median', 'add_indicator': True, 'max_depth': 77, 'n_estimators': 1490, 'boosting_type': 'gbdt', 'num_leaves': 239, 'learning_rate': 0.006540032392723905, 'min_split_gain': 0.7216441605998571, 'min_child_samples': 596, 'subsample': 0.7575108845984483, 'subsample_freq': 941, 'colsample_bytree': 0.29604913163523017, 'reg_alpha': 54.03264332353563, 'reg_lambda': 8.931504520900017}. Best is trial 290 with value: 0.39243341529400166.[0m
[32m[I 2022-07-06 16:33:31,016][0m Trial 588 finished with value: 0.36336887768983833 and parameters: {'sigma': 0.6414092247755623, 'a': 10.486468372328302, 'strategy': 'median', 'add_indicator': True, 'max_depth': 89, 'n_estimators': 463, 'boosting_type': 'gbdt', 'num_leaves': 461, 'learning_rate': 0.004914349599962744, 'min_split_gain': 1.1344874026897678, 'min_child_samples': 660, 'subsample': 0.8441766339525056, 'subsample_freq': 178, 'colsample_bytree': 0.4403574503201531, 'reg_alpha': 48.56874189174091, 'reg_lambda': 18.588150249849434}. Best is trial 290 with value: 0.39243341529400166.[0m
[32m[I 2022-07-06 16:34:10,544][0m Trial 589 finished with value: 0.37145296522589594 and parameters: {'sigma': 5.616552471852781, 'a': 13.071594635959894, 'strategy': 'median', 'add_indicator': True, 'max_depth': 92, 'n_estimators': 635, 'boosting_type': 'gbdt', 'num_leaves': 318, 'learning_rate': 0.009995852709155427, 'min_split_gain': 1.6753739922489412, 'min_child_samples': 537, 'subsample': 0.8154523431646526, 'subsample_freq': 620, 'colsample_bytree': 0.420846001950521, 'reg_alpha': 42.31359269563268, 'reg_lambda': 13.520179152667529}. Best is trial 290 with value: 0.39243341529400166.[0m
[32m[I 2022-07-06 16:35:00,560][0m Trial 590 finished with value: 0.37127666405957016 and parameters: {'sigma': 0.33857730895015126, 'a': 11.452368925631008, 'strategy': 'median', 'add_indicator': True, 'max_depth': 86, 'n_estimators': 1133, 'boosting_type': 'gbdt', 'num_leaves': 260, 'learning_rate': 0.0032670130226672544, 'min_split_gain': 0.8694293079241658, 'min_child_samples': 584, 'subsample': 0.9536931623961672, 'subsample_freq': 726, 'colsample_bytree': 0.33729787039237713, 'reg_alpha': 45.08852217840736, 'reg_lambda': 16.79702912501325}. Best is trial 290 with value: 0.39243341529400166.[0m
[32m[I 2022-07-06 16:36:04,122][0m Trial 591 finished with value: 0.3831446914776429 and parameters: {'sigma': 0.0068311669940283, 'a': 9.688217683628492, 'strategy': 'median', 'add_indicator': True, 'max_depth': 81, 'n_estimators': 1278, 'boosting_type': 'gbdt', 'num_leaves': 371, 'learning_rate': 0.005254010418672697, 'min_split_gain': 0.39411070960120576, 'min_child_samples': 418, 'subsample': 0.7746626267376537, 'subsample_freq': 888, 'colsample_bytree': 0.37570348232179435, 'reg_alpha': 50.37867955132371, 'reg_lambda': 11.243321196021348}. Best is trial 290 with value: 0.39243341529400166.[0m
[32m[I 2022-07-06 16:36:55,104][0m Trial 592 finished with value: 0.367136838708135 and parameters: {'sigma': 1.0696087044754587, 'a': 10.84220067852189, 'strategy': 'median', 'add_indicator': True, 'max_depth': 84, 'n_estimators': 636, 'boosting_type': 'gbdt', 'num_leaves': 183, 'learning_rate': 0.007066977664921287, 'min_split_gain': 0.6256054854889681, 'min_child_samples': 840, 'subsample': 0.7989567556272725, 'subsample_freq': 415, 'colsample_bytree': 0.39849350747100803, 'reg_alpha': 56.81128917931857, 'reg_lambda': 14.494676127157947}. Best is trial 290 with value: 0.39243341529400166.[0m
[32m[I 2022-07-06 16:37:26,274][0m Trial 593 finished with value: 0.3362077715268268 and parameters: {'sigma': 0.0029139521819114417, 'a': 11.292253474114226, 'strategy': 'median', 'add_indicator': True, 'max_depth': 87, 'n_estimators': 483, 'boosting_type': 'dart', 'num_leaves': 287, 'learning_rate': 0.004041596077692376, 'min_split_gain': 1.022973848766188, 'min_child_samples': 698, 'subsample': 0.8645440342049153, 'subsample_freq': 127, 'colsample_bytree': 0.4636964314843579, 'reg_alpha': 52.10221482199472, 'reg_lambda': 12.487594659254949}. Best is trial 290 with value: 0.39243341529400166.[0m
[32m[I 2022-07-06 16:37:48,865][0m Trial 594 finished with value: 0.3532995939941604 and parameters: {'sigma': 0.6776178059270517, 'a': 12.376747542216753, 'strategy': 'median', 'add_indicator': True, 'max_depth': 90, 'n_estimators': 137, 'boosting_type': 'gbdt', 'num_leaves': 498, 'learning_rate': 0.006056299049490034, 'min_split_gain': 3.3562279986159678, 'min_child_samples': 478, 'subsample': 0.9030329912490773, 'subsample_freq': 134, 'colsample_bytree': 0.41709096734283957, 'reg_alpha': 47.786873347233815, 'reg_lambda': 16.3451258692516}. Best is trial 290 with value: 0.39243341529400166.[0m
[32m[I 2022-07-06 16:38:29,924][0m Trial 595 finished with value: 0.3586483704588506 and parameters: {'sigma': 1.8271171492139542, 'a': 10.20019525378541, 'strategy': 'median', 'add_indicator': True, 'max_depth': 83, 'n_estimators': 683, 'boosting_type': 'gbdt', 'num_leaves': 135, 'learning_rate': 0.0023223982534717044, 'min_split_gain': 1.4376498564662805, 'min_child_samples': 650, 'subsample': 0.8308122822872798, 'subsample_freq': 138, 'colsample_bytree': 0.36615161405410085, 'reg_alpha': 45.573904295654486, 'reg_lambda': 5.426229042716528}. Best is trial 290 with value: 0.39243341529400166.[0m
[32m[I 2022-07-06 16:40:05,820][0m Trial 596 finished with value: 0.379637144773828 and parameters: {'sigma': 0.35767372362563987, 'a': 11.641318719075334, 'strategy': 'median', 'add_indicator': True, 'max_depth': 85, 'n_estimators': 1488, 'boosting_type': 'gbdt', 'num_leaves': 341, 'learning_rate': 0.004627477186167233, 'min_split_gain': 1.2181006421227676, 'min_child_samples': 773, 'subsample': 0.7860931912483018, 'subsample_freq': 1481, 'colsample_bytree': 0.39549186391338653, 'reg_alpha': 37.744915906379944, 'reg_lambda': 8.28140712781248}. Best is trial 290 with value: 0.39243341529400166.[0m
[32m[I 2022-07-06 16:40:31,300][0m Trial 597 finished with value: 0.3686846957897121 and parameters: {'sigma': 0.0037321760967096076, 'a': 10.532405367638466, 'strategy': 'median', 'add_indicator': True, 'max_depth': 80, 'n_estimators': 213, 'boosting_type': 'gbdt', 'num_leaves': 654, 'learning_rate': 0.00802723110176125, 'min_split_gain': 0.8662934443669393, 'min_child_samples': 535, 'subsample': 0.811672878979593, 'subsample_freq': 205, 'colsample_bytree': 0.42930343783171837, 'reg_alpha': 50.9051558176751, 'reg_lambda': 10.372128264957444}. Best is trial 290 with value: 0.39243341529400166.[0m
[32m[I 2022-07-06 16:42:06,026][0m Trial 598 finished with value: 0.36962031666439393 and parameters: {'sigma': 1.2759452015484953, 'a': 11.064424557455114, 'strategy': 'median', 'add_indicator': True, 'max_depth': 87, 'n_estimators': 1494, 'boosting_type': 'gbdt', 'num_leaves': 217, 'learning_rate': 0.00360535104724572, 'min_split_gain': 0.7229639895500402, 'min_child_samples': 919, 'subsample': 0.8473415971250496, 'subsample_freq': 1043, 'colsample_bytree': 0.38411912356273986, 'reg_alpha': 53.82219641124849, 'reg_lambda': 19.638833541438654}. Best is trial 290 with value: 0.39243341529400166.[0m
[32m[I 2022-07-06 16:42:51,296][0m Trial 599 finished with value: 0.3694074687479021 and parameters: {'sigma': 0.7867415421126103, 'a': 11.820477646599107, 'strategy': 'median', 'add_indicator': True, 'max_depth': 82, 'n_estimators': 1015, 'boosting_type': 'gbdt', 'num_leaves': 420, 'learning_rate': 0.005494238432607818, 'min_split_gain': 1.0591440234495935, 'min_child_samples': 601, 'subsample': 0.7433534356072007, 'subsample_freq': 327, 'colsample_bytree': 0.31558617327603844, 'reg_alpha': 47.04059683778965, 'reg_lambda': 13.907866199548687}. Best is trial 290 with value: 0.39243341529400166.[0m
[32m[I 2022-07-06 16:43:46,068][0m Trial 600 finished with value: 0.38183842199845913 and parameters: {'sigma': 0.4076324814118667, 'a': 10.754438982728873, 'strategy': 'median', 'add_indicator': True, 'max_depth': 88, 'n_estimators': 1431, 'boosting_type': 'gbdt', 'num_leaves': 289, 'learning_rate': 0.006783271641515425, 'min_split_gain': 0.5350075759014177, 'min_child_samples': 729, 'subsample': 0.773459491485499, 'subsample_freq': 105, 'colsample_bytree': 0.4479284403543607, 'reg_alpha': 48.93045710489118, 'reg_lambda': 16.16734218916527}. Best is trial 290 with value: 0.39243341529400166.[0m
[32m[I 2022-07-06 16:44:37,048][0m Trial 601 finished with value: 0.3638086088808495 and parameters: {'sigma': 0.3800079405956835, 'a': 9.989386264572207, 'strategy': 'median', 'add_indicator': True, 'max_depth': 84, 'n_estimators': 631, 'boosting_type': 'gbdt', 'num_leaves': 380, 'learning_rate': 0.004541414516557585, 'min_split_gain': 1.2606275173749248, 'min_child_samples': 658, 'subsample': 0.674182424134394, 'subsample_freq': 583, 'colsample_bytree': 0.4083754622328687, 'reg_alpha': 44.385029300753224, 'reg_lambda': 12.10292990982869}. Best is trial 290 with value: 0.39243341529400166.[0m
[32m[I 2022-07-06 16:45:27,462][0m Trial 602 finished with value: 0.36596957141065317 and parameters: {'sigma': 0.9732468038963538, 'a': 11.351749289028657, 'strategy': 'median', 'add_indicator': True, 'max_depth': 86, 'n_estimators': 1338, 'boosting_type': 'gbdt', 'num_leaves': 254, 'learning_rate': 0.003009905762933005, 'min_split_gain': 0.9229016454811378, 'min_child_samples': 562, 'subsample': 0.822695712408153, 'subsample_freq': 858, 'colsample_bytree': 0.35204538116996226, 'reg_alpha': 59.88696417110404, 'reg_lambda': 21.505395894026563}. Best is trial 290 with value: 0.39243341529400166.[0m
[32m[I 2022-07-06 16:46:28,598][0m Trial 603 finished with value: 0.3769575119414954 and parameters: {'sigma': 19.941757471893503, 'a': 12.051245348660931, 'strategy': 'most_frequent', 'add_indicator': True, 'max_depth': 94, 'n_estimators': 1493, 'boosting_type': 'gbdt', 'num_leaves': 346, 'learning_rate': 0.007823596422323085, 'min_split_gain': 0.7779549327014521, 'min_child_samples': 491, 'subsample': 0.7938287438140674, 'subsample_freq': 85, 'colsample_bytree': 0.4273579635267255, 'reg_alpha': 55.640993920811646, 'reg_lambda': 25.537338503650354}. Best is trial 290 with value: 0.39243341529400166.[0m
[32m[I 2022-07-06 16:47:12,811][0m Trial 604 finished with value: 0.36529546495456905 and parameters: {'sigma': 0.6774009437599346, 'a': 11.013919937961132, 'strategy': 'median', 'add_indicator': True, 'max_depth': 91, 'n_estimators': 645, 'boosting_type': 'gbdt', 'num_leaves': 498, 'learning_rate': 0.005751154122402267, 'min_split_gain': 1.4341068603558997, 'min_child_samples': 818, 'subsample': 0.8063270639380983, 'subsample_freq': 644, 'colsample_bytree': 0.38311368188310074, 'reg_alpha': 51.559834796754615, 'reg_lambda': 17.97978868769693}. Best is trial 290 with value: 0.39243341529400166.[0m
[32m[I 2022-07-06 16:47:56,036][0m Trial 605 finished with value: 0.36571193219447456 and parameters: {'sigma': 0.357255194106106, 'a': 10.451116582430915, 'strategy': 'constant', 'add_indicator': True, 'max_depth': 89, 'n_estimators': 922, 'boosting_type': 'gbdt', 'num_leaves': 180, 'learning_rate': 0.004064732374080343, 'min_split_gain': 1.0613197834753854, 'min_child_samples': 601, 'subsample': 0.8560804462158982, 'subsample_freq': 920, 'colsample_bytree': 0.48330755971692185, 'reg_alpha': 42.42433126738549, 'reg_lambda': 65.94171330005913}. Best is trial 290 with value: 0.39243341529400166.[0m
[32m[I 2022-07-06 16:48:35,626][0m Trial 606 finished with value: 0.3649476864526626 and parameters: {'sigma': 0.3609075320031685, 'a': 11.433227615693706, 'strategy': 'median', 'add_indicator': True, 'max_depth': 83, 'n_estimators': 551, 'boosting_type': 'gbdt', 'num_leaves': 237, 'learning_rate': 0.005046244826740061, 'min_split_gain': 0.2784292059402651, 'min_child_samples': 690, 'subsample': 0.7613376096692163, 'subsample_freq': 550, 'colsample_bytree': 0.40418498232255196, 'reg_alpha': 49.350711977930324, 'reg_lambda': 14.456342328375575}. Best is trial 290 with value: 0.39243341529400166.[0m
[32m[I 2022-07-06 16:49:44,074][0m Trial 607 finished with value: 0.387272780477873 and parameters: {'sigma': 0.01737351970096631, 'a': 10.830944976604835, 'strategy': 'median', 'add_indicator': True, 'max_depth': 80, 'n_estimators': 1482, 'boosting_type': 'gbdt', 'num_leaves': 313, 'learning_rate': 0.006917277159437262, 'min_split_gain': 0.649503798456104, 'min_child_samples': 520, 'subsample': 0.8400074508964424, 'subsample_freq': 1469, 'colsample_bytree': 0.35863304366746923, 'reg_alpha': 46.64290397896259, 'reg_lambda': 10.881918814803731}. Best is trial 290 with value: 0.39243341529400166.[0m
[32m[I 2022-07-06 16:51:04,055][0m Trial 608 finished with value: 0.36899508654762164 and parameters: {'sigma': 1.2456921268841314, 'a': 9.802006912133573, 'strategy': 'median', 'add_indicator': True, 'max_depth': 85, 'n_estimators': 1158, 'boosting_type': 'gbdt', 'num_leaves': 420, 'learning_rate': 0.003654272803159928, 'min_split_gain': 1.1932247201692687, 'min_child_samples': 751, 'subsample': 0.8863589913189753, 'subsample_freq': 948, 'colsample_bytree': 0.4372348175408734, 'reg_alpha': 53.55178050402892, 'reg_lambda': 13.075540370490158}. Best is trial 290 with value: 0.39243341529400166.[0m
[32m[I 2022-07-06 16:51:24,824][0m Trial 609 finished with value: 0.3582178768048281 and parameters: {'sigma': 0.7069567355982439, 'a': 11.62918275428803, 'strategy': 'mean', 'add_indicator': True, 'max_depth': 82, 'n_estimators': 136, 'boosting_type': 'gbdt', 'num_leaves': 216, 'learning_rate': 0.009934186672510389, 'min_split_gain': 0.9142123414458115, 'min_child_samples': 627, 'subsample': 0.8245364715268311, 'subsample_freq': 93, 'colsample_bytree': 0.39602314240406883, 'reg_alpha': 50.50096000180876, 'reg_lambda': 16.066296628962185}. Best is trial 290 with value: 0.39243341529400166.[0m
[32m[I 2022-07-06 16:52:21,626][0m Trial 610 finished with value: 0.3642643743246718 and parameters: {'sigma': 0.344135818723865, 'a': 11.137312354152273, 'strategy': 'median', 'add_indicator': True, 'max_depth': 99, 'n_estimators': 745, 'boosting_type': 'gbdt', 'num_leaves': 594, 'learning_rate': 0.0025200064006778546, 'min_split_gain': 0.5522068465690424, 'min_child_samples': 565, 'subsample': 0.9151924597569943, 'subsample_freq': 738, 'colsample_bytree': 0.37419494483292554, 'reg_alpha': 47.6702496327608, 'reg_lambda': 8.821584186551}. Best is trial 290 with value: 0.39243341529400166.[0m
[32m[I 2022-07-06 16:52:58,961][0m Trial 611 finished with value: 0.36271577599368454 and parameters: {'sigma': 0.8900787215409481, 'a': 10.2891771638858, 'strategy': 'median', 'add_indicator': True, 'max_depth': 87, 'n_estimators': 512, 'boosting_type': 'gbdt', 'num_leaves': 308, 'learning_rate': 0.005766732291536986, 'min_split_gain': 2.365678967778348, 'min_child_samples': 664, 'subsample': 0.8042750162206955, 'subsample_freq': 511, 'colsample_bytree': 0.4172824799387824, 'reg_alpha': 43.94615918792075, 'reg_lambda': 18.426924188880136}. Best is trial 290 with value: 0.39243341529400166.[0m
[32m[I 2022-07-06 16:53:50,663][0m Trial 612 finished with value: 0.3695225429860208 and parameters: {'sigma': 0.3650329498514667, 'a': 12.460080097879949, 'strategy': 'median', 'add_indicator': True, 'max_depth': 78, 'n_estimators': 1036, 'boosting_type': 'gbdt', 'num_leaves': 395, 'learning_rate': 0.0045367133019355394, 'min_split_gain': 0.8121024803468307, 'min_child_samples': 2607, 'subsample': 0.7791611629828539, 'subsample_freq': 421, 'colsample_bytree': 0.4574410142334411, 'reg_alpha': 40.459667821484, 'reg_lambda': 14.770039068392457}. Best is trial 290 with value: 0.39243341529400166.[0m
[32m[I 2022-07-06 16:55:12,921][0m Trial 613 finished with value: 0.34620337106078863 and parameters: {'sigma': 0.6317444430057829, 'a': 12.035744254980356, 'strategy': 'median', 'add_indicator': True, 'max_depth': 84, 'n_estimators': 1143, 'boosting_type': 'dart', 'num_leaves': 255, 'learning_rate': 0.008179295322857827, 'min_split_gain': 1.0464582513894414, 'min_child_samples': 442, 'subsample': 0.7872003066708775, 'subsample_freq': 913, 'colsample_bytree': 0.5306590565583399, 'reg_alpha': 52.09894561184975, 'reg_lambda': 11.944493124084481}. Best is trial 290 with value: 0.39243341529400166.[0m
[32m[I 2022-07-06 16:56:04,345][0m Trial 614 finished with value: 0.37259194696291403 and parameters: {'sigma': 0.03172327581983875, 'a': 11.152637423863743, 'strategy': 'median', 'add_indicator': True, 'max_depth': 89, 'n_estimators': 779, 'boosting_type': 'gbdt', 'num_leaves': 7927, 'learning_rate': 0.0032282561887595857, 'min_split_gain': 1.2720392450927633, 'min_child_samples': 731, 'subsample': 0.8283751340079089, 'subsample_freq': 778, 'colsample_bytree': 0.33455893376578105, 'reg_alpha': 49.58384296962221, 'reg_lambda': 6.961989406298888}. Best is trial 290 with value: 0.39243341529400166.[0m
[32m[I 2022-07-06 16:57:20,248][0m Trial 615 finished with value: 0.37415983459318664 and parameters: {'sigma': 1.102596743903837, 'a': 9.375894092203705, 'strategy': 'median', 'add_indicator': True, 'max_depth': 86, 'n_estimators': 1260, 'boosting_type': 'gbdt', 'num_leaves': 348, 'learning_rate': 0.006605975860886391, 'min_split_gain': 1.572769870310266, 'min_child_samples': 866, 'subsample': 0.8108011874352768, 'subsample_freq': 437, 'colsample_bytree': 0.403808228187562, 'reg_alpha': 45.90325795265712, 'reg_lambda': 13.898359998356625}. Best is trial 290 with value: 0.39243341529400166.[0m
